983b	nam illi, qui nil metuont, postquam malum promeriti, tunc ei metuont.
984	metuam haúd multum. prope est quándo erus ob fácta pretium exsólvet.
985	éo ego exemplo servio, térgi ut in rem esse arbitror.
986	postquam ín tabernam vása et servos cónlocavi, ut iusserat,
987	ita vénio adversum. nunc foris pultabo, adesse ut me sciat,
988	† neque virum ex hoc saltu damni salvom ut educam foras.
989	séd metuo, ne sero veniam depugnato proelio.
990	Pér ego vobis deos atque homines dico, ut imperium meum
991	sapienter habeatis curae, quae imperavi atque impero:
992	facite illic homo iam in medicinam ablatus sublimen siet,
993	nisi quidem vos vostra crura aut latera nihili penditis.
994	cave quisquam, quod illíc minitetur, vostrum flocci fecerit.
995	quid státis? quid dubitátis? iam sublímen raptum opórtuit.
996	ego ibo ad medicum: praesto ero illi, cum venietis.
996b	Occidi,
997	quid hoc ést negoti? quid illisce homines ad me currunt, opsecro?
998	quid voltis vos? quid quaeritatis? quid me circumsistitis?
999	quo rapitis me? quo fertis me? perii, opsecro vestram fidem,
1000	Epidamnienses, subvenite, cives. quin me mittitis?
1001	Pro di immortales, obsecro, quid ego oculis aspicio meis?
1002	erum meum indignissime nescio qui sublimen ferunt.
1003	Ecquis suppetias mihi audet ferre?
1003b	Ego, ere, audacissime.
1004	o facinus indignum et malum, Epidamnii cives, erum
1005	meum hic in pacato oppido luci deripier in via,
1006	qui liber ad vos venerit.
1007	mittite istunc.
1007b	Obsecro te, quisquis es, operam mihi ut des,
1008	neu sinas in me insignite fieri tantam iniuriam.
1009	Immo et operam dabo et defendam et subvenibo sedulo.
1010	numquam te patiar perire, me perirest aequius.
1011	eripe oculum ísti, ab umero qui tenet, ere, te obsecro.
1012	hisce ego iam sementem in ore faciam pugnosque obseram.
1013	maximo hodie malo hercle vostro ístunc fertis. mittite.
1014	Teneo ego huic oculum.
1014b	Face ut oculi locus in capite appareat.
1015	vos scelesti, vos rapacis, vos praedones.
1015b	Periimus.
1016	obsecro hercle.
1016b	Mittite ergo.
1016c	Quid me vobis tactiost?
1017	pecte pugnis.
1017b	Agite abite, fugite hinc in malam crucem.
1018	em tibi etiam: quia postremus cedis, hoc praemi feres.
1019	nimis bene ora commetavi atque ex mea sententia.
1020	edepol, ere, ne tibi suppetias temperi adveni modo.
1021	At tibi di semper, adulescens, quisquis es, faciant bene.
1022	nam absque te esset, hodie numquam ad solem occasum viverem.
1023	Ergo edepol, si recte facias, ere, med emittas manu.
1024	Liberem ego te?
1024b	Verum, quandoquidem, ere, te servavi.
1024c	Quid est?
1025	adulescens, erras.
1025b	Quid, erro?
1025c	Per Iovem adiuro patrem,
1026	med erum tuom non esse.
1026b	Non taces?
1026c	Non mentior;
1027	nec meus servos úmquam tale fecit quale tu mihi.
1028	Sic sine igitur, si tuom négas me ésse, abire liberum.
1029	Mea quidem hercle causa liber esto atque ito quo voles.
1030	Nempe iubes?
1030b	Iubeo hercle, si quid imperi est in te mihi.
1031	Salve, mi patrone. cum tu liber es, Messenio,
1032	gaudeo. credo hercle vobis. sed, patrone, te obsecro,
1033	ne minus imperes mihí quam cum tuos servos fui.
1034	apud ted habitabo et quando ibis, una tecum ibo domum.
1035	Minime.
1035b	Nunc ibo in tabernam, vasa atque argentum tibi
1036	referam. recte est obsignatum in vidulo marsuppium
1037	cum viatico: id tibí iam huc adferam.
1037b	Adfer strenue.
1038	Salvom tibi ita ut mihi dedisti reddibo. hic me mane.—
1039	Nimia mira mihi quidem hodie exorta sunt miris modis:
1040	alii me negant eum esse qui sum, atque excludunt foras
1040a	
1041	vel ille qui se petere argentum modo, qui servom se meum
1042	esse aiebat, meus servator, quem ego modo emisi manu;
1043	is ait se mihi allaturum cum argento marsuppium:
1044	id si attulerit, dicam ut a me ábeat liber quo volet,
1045	ne tum, quando sanus factus sit, a me argentum petat.
1046	socer et medicus me insanire aiebant. quid sit, mira sunt.
1047	haec nihilo esse mihi videntur setius quam somnia.
1048	nunc ibo intro ad hanc meretricem, quamquam suscenset mihi,
1049	si possum exorare ut pallam reddat, quam referam domum.—
1050	Men hodie usquam convenisse te, audax, audes dicere,
1051	postquam advorsum mi imperavi ut huc venires?
1051b	Quin modo
1052	erupui, homines quom ferebant te sublimen quattuor,
1053	apud hasce aedis. tu clamabas deum fidem atque hominum omnium,
1054	quóm ego accurro teque eripio vi pugnando ingratiis.
1055	ob eam rem, quia te servavi, me amisisti liberum.
1056	cum argentum dixi me petere et vasa, tu quantum potest
1057	praecucurristi obviam, ut quae fecisti infitias eas.
1058	Liberum ego te iussi abire?
1058b	Certo.
1058c	Quin certissimumst,
1059	mepte potius fieri servom, quam te umquam emittam manu.
1060	Si vóltis per oculos iurare, nihilo hercle ea causa magis
1061	faciétis, ut ego hódie abstulerim pallam et spinter, pessumae.
1062	Pro di ímmortales, quid ego video?
1062b	Quid vides?
1062c	Speculum tuom.
1063	Quid negoti est?
1063b	Tuast imago. tam consimilest quam potest.
1064	Pol profecto haud est dissimilis, meam quom formam noscito.
1065	O adulescens, salve, qui me servavisti, quisquis es.
1066	Adulescens, quaeso hercle eloquere tuom mihi nomen, nisi piget.
1067	Non edepol ita promeruisti de me, ut pigeat, quae velis
1068	obsequi . mihi est Menaechmo nomen.
1068b	Immo edepol mihi.
1069	Siculus sum Syracusanus.
1069b	Eadem urbs et patria est mihi.
1070	Quid ego ex te audio?
1070b	Hoc quod res est.
1070c	Novi equidem hunc: erus est meus.
1071	ego quidem huius servos sum, sed med esse huius credidi.
1072	ego hunc censebam te esse, huic etiam éxhibui negotium.
1073	quaeso ignoscas, si quid stulte dixi atque imprudens tibi.
1074	Delirare mihi videre: non commeministi, simul
1075	te hodie mecum exire ex navi?
1075b	Enim vero aequom postulas.
1076	tú erus es: tu servom quaere. tu salveto: tu vale.
1077	hunc ego esse aio Menaechmum.
1077b	At ego me.
1077c	Quae haec fabulast?
1078	tú es Menaechmus?
1078b	Me esse dico, Moscho prognatum patre.
1079	Tun meo patre es prognatus?
1079b	Immo equidem, adulescens, meo;
1080	tuom tibi neque occupare neque praeripere postulo.
1081	Di immortales, spem insperatam date mihi quam suspicor.
1082	nam nisi me animus fallit, hi sunt gemini germani duo.
1083	nam et patriam et patrem conmemorant pariter qui fuerint sibi.
1084	sevocabo erum. Menaechme.
1084b	Quid vis?
1084c	Non ambos volo,
1085	sed uter vostrorum est advectus mecum navi.
1085b	Non ego.
1086	At ego.
1086b	Te volo igitur. huc concede.
1086c	Concessi. quid est?
1087	Illic homó aut sycophanta aut geminus est frater tuos.
1088	nam ego hominem hominis similiorem numquam vidi álterum.
1089	neque aqua aquae nec lacte est lactis, crede mi, usquam similius,
1090	quam hic tui est, tuque huius autem; post eandem patriam ac patrem
1091	memorat. meliust nos adire átque hunc percontarier.
1092	Hercle qui tu me admonuisti recte, et habeo gratiam.
1093	perge operam dare, obsecro hercle; liber esto, si invenis
1094	hunc meum fratrem esse.
1094b	Spero.
1094c	Et ego item spero fore.
1095	Quid ais tu? Menaechmum, opinor, te vocari dixeras.
1096	Ita vero.
1096b	Huic item Menaechmo nomen est. in Sicilia
1097	te Syracusis natum esse dixti: et hic natust ibi.
1098	Moschum tibi patrem fuisse dixti: huic itidem fuit.
1099	nunc operam potestis ambo mihi dare et vobis simul.
1100	Promeruisti ut ne quid ores quod velis, quin impetres.
1101	tam quasi me emeris argento, liber servibo tibi.
1102	Spes mihi est, vos inventurum fratres germanos duos
1103	geminos, una matre natos et patre uno uno die.
1104	Mira memoras. utinam efficere quod pollicitu's pollicitus es possies.
1105	Possum. sed nunc agite uterque id quod rogabo dicite.
1106	Vbi lubet, roga: réspondebo. nil reticebo quod sciam.
1107	Est tibi nomen Menaechmo?
1107b	Fateor.
1107c	Est itidem tibi?
1108	Est.
1108b	Patrem fuisse Moschum tibi ais?
1108c	Ita vero.
1108d	Et mihi.
1109	Esne tu Syracusanus?
1109b	Certo.
1109c	Quid tu?
1109d	Quippini?
1110	Optime usque adhuc conveniunt signa. porro operam date.
1111	quid longissime meministi, dic mihi, in patria tua?
1112	Cum patre ut abii Tarentum ád mercatum, postea
1113	inter homines me deerrare á patre atque inde avehi.
1114	Iuppiter supreme, serva me.
1114b	Quid clamas? quin taces?
1115	quot eras annos gnatus, quom te pater a patria ávehit?
1116	Septuennis: nam tunc dentes mihi cadebant primulum.
1117	neque patrém umquam postilla vidi.
1117b	Quid? vos tum patri
1118	filii quot eratis?
1118b	Vt nunc maxime memini, duo.
1119	Vter eratis, tun an ille, maior?
1119b	Aeque ambo pares.
1120	Qui id potest?
1120b	Gemini ambo eramus.
1120c	Di me servatum volunt.
1121	Si interpellas, ego tacebo potius.
1121b	Taceo.
1121c	Dic mihi:
1122	uno nomine ambo eratis?
1122b	Minime. nam mihi hoc erat,
1123	quod nunc est, Menaechmo: íllum tum vocabant Sosiclem.
1124	Signa adgnovi, contineri quin complectar non queo.
1125	mi germane gemine frater, salve. ego sum Sosicles.
1126	Quo modo igitur post Menaechmo nomen est factum tibi?
1127	Postquam ad nos renuntiatum est te et patrem esse mortuom,
1128	avos noster mutavit: quod tibi nomen est, fecit mihi.
1129	Credo ita esse factum ut dicis. sed mi hoc responde.
1129a	Roga.
1131	Quid erat nomen nostrae matri?
1131b	Teuximarchae.
1131c	Convenit.
1132	o salve, insperate multis annis post quem conspicor.
1133	Frater, et tu, quém ego multis miseriis laboribus
1134	usque adhuc quaesivi quemque ego esse inventum gaudeo.
1135	Hoc erat, quod haec te meretrix huius vocabat nomine:
1136	hunc censebat te esse, credo, quom vocat te ad prandium.
1137	Namque edepol iussi hic mihi hodie prandium appararier,
1138	clam meam uxorem, quoi pallam surrupui dudum domo,
1139	eam dedi huic.
1139b	Hanc, dicis, frater, pallam, quam ego habeo?
1139c	Haec east.
1140	quo modo haec ad te pervenit?
1140b	Meretrix huc ad prandium
1141	me abduxit, me sibi dedisse aiebat. prandi perbene,
1142	potavi atque accubui scortum, pallam et aurum hoc abstuli .
1143	Gaudeo edepol, si quid propter me tibi evenit boni.
1144	nam illa quom te ad se vocabat, memet esse credidit.
1146	Numquid me morare quin ego liber, ut iusti, siem?
1147	Optimum atque aequissimum orat, frater: fac causa mea.
1148	Liber esto.
1148b	Quom tu es liber, gaudeo, Messenio.
1149	Sed meliorest opus auspicio, ut liber perpetuo siem.
1151	Quoniam haec evenerunt, frater, nostra éx sententia,
1152	in patriam redeamus ambo.
1152b	Frater, faciam, ut tu voles.
1153	auctionem hic faciam et vendam quidquid est. nunc interim
1154	eamus intro, frater.
1154b	Fiat.
1154c	Scitin quid ego vos rogo?
1155	Quid?
1155b	Praeconium mi ut detis.
1155c	Dabitur.
1155d	Ergo nunciam
1156	vis conclamari auctionem fore?
1156b	Equidem die septimi.
1157	Auctio fiet Menaechmi mane sane septimi.
1158	venibunt servi, supellex, fundi, aedes, omnia.
1159	venibunt quiqui licebunt, praesenti pecunia.
1160	venibit uxor quoque etiam, si quis emptor venerit.
1161	vix credo tota auctione capiet † quinquagesies.
1162	nunc, spectatores, valete et nobis clare plaudite.
