1	cum in omnibus causis gravioribus, C. Caesar, initio dicendi commoveri soleam vehementius quam videtur vel usus vel aetas mea postulare, tum in hac causa ita multa me multa me α , Prisc. K. iii. p. 369: me multa βγ perturbant ut, quantum mea fides studi mihi adferat ad salutem regis Deiotari defendendam, tantum facultatis timor detrahat. primum dico pro capite fortunisque regis regis Deiotari γ , quod ipsum, etsi etsi αβ a: si gh non iniquum est in tuo dumtaxat periculo, tamen est ita inusitatum, regem reum capitis esse, ut ante hoc tempus non sit auditum. 
2	deinde eum regem quem ornare antea ante CAVB cuncto cum senatu solebam solebamus β ( contra Mart. Cap. Rhet. L. p. 470) pro perpetuis eius in nostram rem publicam meritis, nunc contra atrocissimum crimen cogor defendere. accedit ut accusatorum alterius crudelitate, alterius indignitate conturber perturber γ . crudelis Castor crudelis Castor C 1 V β : crudelis Castor est C 2 AH : crudelem Castorem γ , Madvig , ne dicam sceleratum et impium, qui nepos avum in capitis discrimen discr. capitis γ adduxerit adulescentiaeque suae terrorem intulerit ei cuius senectutem tueri et tegere debebat debeat γ , commendationemque ineuntis aetatis ab impietate et ab scelere et scelere β duxerit; avi servum corruptum praemiis ad accusandum dominum impulerit, a legatorum pedibus abduxerit. 
3	fugitivi autem dominum accusantis et dominum absentem et dominum amicissimum nostrae rei publicae cum os videbam, cum verba audiebam cum verba audiebam om. DE , non tam adflictam regiam condicionem dolebam quam de fortunis communibus extimescebam. nam cum more maiorum de servo in dominum ne tormentis quidem quaeri liceat, in qua quaestione dolor elicere veram vocem possit etiam ab invito, exortus est servus qui, quem in eculeo appellare non posset possit CAV , eum accuset solutus. 
4	perturbat me, C. Caesar C. om. C α , etiam illud interdum quod tamen, cum te penitus recognovi, timere desino: re enim iniquum est, sed tua sapientia fit aequissimum. nam dicere apud eum de facinore contra cuius vitam consilium facinoris inisse arguare, cum cum si D ( ante ras. ) g per se ipsum consideres, grave est; nemo enim fere est qui sui periculi iudex non sibi se aequiorem quam reo praebeat. sed tua, Caesar, praestans singularisque natura hunc mihi metum minuit. non enim tam timeo quid tu de rege Deiotaro, quam intellego quid de te ceteros velis iudicare. 
5	moveor etiam loci ipsius insolentia, quod tantam causam quanta nulla umquam in disceptatione versata est dico intra domesticos domesticos β a: om. C α gh parietes, dico extra conventum et eam frequentiam in qua oratorum studia niti solent: in tuis oculis, in tuo ore voltuque acquiesco, te unum intueor, ad te unum omnis omnis mea β spectat oratio: quae mihi ad spem obtinendae veritatis gravissima sunt, ad motum animi et ad omnem impetum dicendi contentionemque leviora. 
6	hanc enim, C. Caesar causam C. Caesar β , causam si in foro dicerem eodem audiente et disceptante te, quantam mihi alacritatem populi Romani concursus adferret! quis enim civis ei regi ei regi aa : ei rei gh : regi β non faveret cuius omnem aetatem in populi Romani bellis consumptam esse meminisset? spectarem curiam, intuerer forum, caelum denique testarer ipsum. sic , cum et deorum immortalium et populi Romani et senatus beneficia in regem Deiotarum in regem Deiotarum αβ a : in rege Deiotaro hg recordarer, nullo modo mihi deesse posset oratio. 
7	quae quoniam angustiora parietes faciunt actioque maximae causae debilitatur loco, tuum est, Caesar, qui pro multis saepe dixisti, quid mihi nunc animi sit ad te ipsum referre, quo facilius cum aequitas tua tum audiendi diligentia minuat hanc perturbationem meam. sed ante quam de accusatione ipsa dico, de accusatorum spe pauca dicam; qui cum videantur neque ingenio neque nec... nec β usu atque exercitatione rerum valere, tamen ad hanc causam non sine aliqua spe et cogitatione venerunt. 
8	iratum te regi Deiotaro fuisse non erant nescii; adfectum adfectum H γ : adflictum A β illum quibusdam incommodis et detrimentis propter offensionem animi tui meminerant, teque cum huic iratum, tum sibi amicum esse cognoverant teque... cognoverant del. Madvig : te que cum huic iratum, tum sibi Eberhard , quodque cumque β apud ipsum te de tuo periculo dicerent, fore putabant ut in exulcerato animo facile fictum crimen insideret. quam ob rem hoc nos primum metu, Caesar, per fidem et constantiam et clementiam et per clem. β tuam libera, ne residere in te ullam partem iracundiae suspicemur. per dexteram istam te oro quam regi Deiotaro hospes hospiti porrexisti, istam, inquam, dexteram non tam tam del. Manutius ( contra Prisc. K. ii. 93) in bellis neque in proeliis quam in in om. β ( contra Prisc. ) promissis et fide firmiorem. tu illius domum inire, tu vetus hospitium renovare voluisti; te eius di penates acceperunt, te amicum et placatum Deiotari regis arae focique viderunt. 
9	cum facile orari, Caesar, tum semel exorari exorari γ soles. nemo umquam te placavit inimicus qui ullas resedisse in te simultatis reliquias senserit. quamquam cui sunt inauditae cum Deiotaro querelae tuae? numquam tu illum accusavisti ut hostem, sed ut amicum officio parum functum, quod propensior in Cn. Pompei amicitiam fuisset quam in tuam: cui tamen ipsi rei veniam te daturum fuisse dicebas, si tum tum dett. aliquot : cum αβ ag : tantum h auxilia Pompeio vel si etiam filium misisset, ipse ipse tamen β ita cum aah : itaque cum β : ita si cum g aetatis excusatione usus esset. 
10	ita cum maximis eum rebus liberares, perparvam perparvam in amicitia add. α : inimicitiae add. γ : amicitiae add. β : ego delevi culpam relinquebas. itaque non solum in eum non animadvertisti sed omni metu liberavisti, hospitem agnovisti, regem reliquisti. neque enim ille odio tui progressus, sed errore communi lapsus est progr. est γ . is rex quem senatus hoc nomine saepe honorificentissimis decretis appellavisset, quique illum quique cum illum β ordinem ab adulescentia gravissimum sanctissimumque duxisset, isdem rebus est perturbatus homo longinquus et alienigena quibus nos in media re publica nati semperque versati. 
11	cum audiret senatus consentientis auctoritate arma sumpta sumpta esse γ , consulibus, praetoribus, tribunis plebis, nobis nobis α D : novis BE γ imperatoribus rem publicam defendendam datam, movebatur animo et vir huic imperio amicissimus de salute populi Romani extimescebat, in qua etiam suam esse inclusam videbat. in summo tamen timore quiescendum esse esse αβ : ut sibi esset (-se g ) γ arbitrabatur. maxime vero perturbatus est, ut audivit consules ex Italia profugisse, omnis omnis α g : omnisque β a : omnis et h consularis—sic enim ei nuntiabatur ei nunt. enunt. β —cunctum senatum, totam Italiam effusam esse effusam β . talibus enim nuntiis et rumoribus patebat ad orientem via nec ulli veri nulli veri nuntii γ subsequebantur. nihil ille de condicionibus tuis, nihil de studio concordiae et pacis, nihil de conspiratione audiebat certorum certorum HBDE 1 : ceterorum AVE 2 γ hominum contra dignitatem tuam. quae cum ita essent, tamen usque eo se tenuit quoad a Cn. Pompeio legati ad eum leg. ad eum α : ad eum leg. βγ litteraeque venerunt. 
12	ignosce , ignosce, Caesar, si eius viri auctoritati rex Deiotarus cessit quem in quem E 2 γ ( contra Arusian. K. vii. p. 461) nos omnes secuti sumus; ad quem cum di atque homines omnia ornamenta congessissent, tum tu ipse plurima et maxima. nec enim neque enim β , si tuae res gestae ceterorum laudibus obscuritatem attulerunt, idcirco Cn. Pompei memoriam amisimus. quantum nomen illius eius β fuerit, quantae opes, quanta in omni genere bellorum gloria, quanti honores populi Romani, quanti senatus, quanti tui, quis ignorat? tanto quanto... tanto β ( contra Serv. Aen. xi. 438) ille superiores vicerat gloria quanto tu omnibus omnibus A β : in omnibus VE 2 γ : omnia H praestitisti. itaque Cn. Pompei bella, victorias, triumphos, consulatus admirantes numerabamus: tuos enumerare non possumus. 
13	ad eum igitur rex Deiotarus venit hoc misero fatalique bello quem antea iustis hostilibusque bellis adiuverat, quocum erat non hospitio solum verum etiam familiaritate coniunctus, et venit vel rogatus ut amicus, vel arcessitus ut socius, vel evocatus evocatus γ : vocatus αβ ut is qui senatui parere didicisset: postremo venit ut ad fugientem, non ut ad non ut ad α a : non ad β h : non ut g insequentem, id est ad periculi periculi α BDa : -culum Egh , non ad victoriae societatem. itaque Pharsalico proelio facto a Pompeio discessit; spem infinitam persequi noluit; vel officio si quid debuerat, vel errori si quid nescierat, satis factum esse duxit; domum se contulit, teque Alexandrinum bellum gerente utilitatibus tuis paruit. 
14	ille exercitum Cn. Domiti, amplissimi viri, suis tectis et copiis sustentavit; ille Ephesum ad eum quem tu ex tuis fidelissimum ex civibus fid. γ et probatissimum et probat. om. γ (et prob. omnibus del. Garat. ) omnibus delegisti pecuniam misit; ille iterum, ille tertio auctionibus factis pecuniam dedit qua ad bellum uterere uterere α DE : -ris B : -remini γ ; ille corpus suum periculo obiecit, tecumque in acie contra Pharnacem fuit tuumque hostem esse duxit suum. quae quidem a te in eam partem accepta sunt, Caesar, ut eum amplissimo regis honore et nomine adfeceris. 
15	is igitur non modo a te periculo liberatus sed etiam honore amplissimo ornatus, arguitur domi te te hoc loco hab. αβ , ante domi (domui a) γ , post suae Cassiod. ii. 543, Mart. Cap. Rhet. L. p. 468 suae interficere voluisse: quod tu, nisi eum furiosissimum iudicas iudices β , suspicari profecto prof. suspicari γ non potes. ut enim omittam cuius tanti sceleris fuerit in conspectu deorum penatium necare hospitem, cuius tantae importunitatis omnium gentium atque omnis memoriae clarissimum lumen exstinguere, cuius cuius tantae a ferocitatis victorem orbis terrae terrae α : terrarum βγ non extimescere, cuius tam inhumani et ingrati animi animi om. α , a quo rex appellatus esset, in eo tyrannum inveniri—ut haec omittam, cuius tanti furoris fuit omnis reges, quorum multi erant finitimi, omnis liberos populos omnis socios, omnis lib. pop. γ , omnis socios, omnis provincias, omnia denique omnium arma contra se unum excitare? quonam quonam BDg : quoniam C α ah : quomodo E ille modo cum regno, cum domo cum domo om. γ , cum coniuge, cum carissimo carissimo C α DE : clarissimo B γ filio distractus esset, tanto scelere non modo perfecto sed etiam cogitato? 
16	at , credo, haec homo inconsultus et temerarius non videbat. quis consideratior illo, quis tectior tectior C α D 1 : rectior D 2 BE γ , quis prudentior? quamquam hoc loco Deiotarum non tam ingenio et prudentia quam fide et religione vitae defendendum puto. nota tibi est hominis probitas, C. Caesar, noti mores, nota constantia. cui porro qui modo populi Romani nomen audivit, Deiotari integritas, gravitas, virtus, fides non audita sit audita β est? quod igitur facinus nec in hominem imprudentem prudentem C α caderet caderet CHV γ : cadere A : cadere posset β propter metum praesentis exiti, nec in facinerosum, nisi esset idem amentissimus, id vos et a viro optimo et ab homine minime stulto cogitatum esse confingitis? 
17	at quam non atque non γ modo non credibiliter, sed ne suspiciose quidem! cum inquit inquit C α : in castellum ( ex § 21) add. βγ Blucium Blucium Garat. : Reium Wagner : Luceium (Lucc. CH ) codd. ( cf. Strab. xii. 5. 2) venisses et domum regis hospitis tui devertisses, locus erat quidam in quo erant ea composita quibus te rex munerari munerari C α : -rare βγ constituerat. huc te e balneo balineo CA, ita § 21 CA ( ter ) et § 42 CH , prius quam accumberes, ducere volebat. erant enim ibi enim erant β armati ut te qui te β interficerent in eo ipso loco conlocati. en crimen, en causa, cur regem fugitivus, dominum servus accuset. ego mehercules mehercule γ , cf. Mil. 85 , Caesar, initio, cum est ad me ita ita Müller : ista codd. causa delata, Phidippum Phidippum β : Philippum C αγ medicum, servum regium, qui cum legatis missus esset, ab ab ipso β isto adulescente esse corruptum, hac sum suspicione percussus percussus CHV β gh : perculsus Aa : medicum indicem subornavit; finget fingit gh videlicet aliquod crimen veneni. etsi a veritate longe, tamen a consuetudine criminandi non multum res abhorrebat. 
18	quid ait medicus? nihil de veneno. at id fieri potuit primum primo β occultius in potione, in cibo vel in cibo γ : del. Kayser ; deinde etiam impunius fit quod, cum est factum quod cum est factum quicquid cum est C α , negari potest. si palam te interemisset, omnium in se gentium non solum odia sed etiam arma convertisset: si veneno, Iovis illius illius a: illius quidem cett. : ille quidem Ernesti hospitalis numen numquam celare potuisset, homines fortasse celasset. quod igitur et conari occultius et efficere cautius potuit, id tibi et medico callido et servo, ut putabat, fideli non credidit: de armis, de ferro, de insidiis celare te noluit? 
19	at quam festive crimen contexitur! tua te inquit eadem quae quae semper β saepe fortuna servavit: negavisti tum te inspicere velle. quid postea? an Deiotarus, re illo tempore non perfecta re illo... perfecta C α BD : rex illo... perfecta re E γ , continuo dimisit exercitum? nullus erat alius insidiandi locus? at eodem te, cum cenavisses, rediturum dixeras, itaque fecisti. Horam unam aut duas eodem loco armatos, ut conlocati fuerant, retineri retineri CA : retine H : retinere cett. magnum fuit? cum in convivio comiter et iucunde fuisses, tum illuc illuc illuc istum C 1 : istum illuc H isti, ut dixeras: quo in loco Deiotarum talem erga te cognovisti qualis rex Attalus in P. Africanum fuit, cui magnificentissima dona, ut scriptum legimus, usque ad Numantiam misit ex Asia, quae Africanus P. Afr. C α inspectante exercitu accepit. quod cum praesens Deiotarus regio regio gh : et C α : et regio a: regio et β animo et more fecisset, tu in cubiculum discessisti. 
20	obsecro , Caesar, repete illius temporis memoriam, pone ante oculos illum ante oculos β illum diem, voltus hominum te intuentium atque admirantium recordare. num quae trepidatio, num qui quae (qua a)... qui CH β a : quid... quid AVg : ei quã... quid h (quid trepidationis coni Halm ) tumultus, num quid nisi modeste modeste β : modo C α : moderate γ , nisi quiete, nisi ex hominis gravissimi et sanctissimi disciplina? quid igitur causae excogitari potest cur te lautum voluerit, cenatum noluerit occidere? 
21	in posterum inquit diem distulit ut, cum in castellum castellum Luceium (Lucc. H ) add. codd., ego delevi, cf. § 17 ventum esset, ibi cogitata perficeret. non video causam loci mutandi mut. loci β , sed tamen acta res criminose est. cum inquit vomere post cenam te velle dixisses, in balneum te ducere coeperunt: ibi enim erant insidiae. at te eadem tua eadem tua C αβ : illa tua g : eadem tua illa ah fortuna servavit: in cubiculo in cubiculum (-lo D 1 ) te ire malle β a malle dixisti. di te perduint perduint BD : -dunt CHVE : -dent A : -dant γ , fugitive! ita non non ita C α modo nihili et nihili et scripsi : nihil sed D 1 : nequam et D 2 γ : om. α BE improbus, sed fatuus et improbus et fatuus, sed etiam (eiam D 1 ) amens β amens es. quid ? ille signa aenea in balneo in balneo α : in insidiis (in sup. lin. in β ) βγ posuerat, quae e balneo in cubiculum transire transire (-ent AV ) C α gh : transferri β a non possent? habes crimina insidiarum: nihil enim dixit amplius. horum inquit eram conscius. quid tum? ita ille demens erat ut eum quem conscium tanti sceleris habebat haberet γ ab ab C α : a βγ se dimitteret, Romam etiam mitteret ubi et inimicissimum sciret esse nepotem suum et C. Caesarem cui fecisset insidias, praesertim cum is unus esset qui posset de absente se indicare indicare Victorius : iud. CAV : uind. β ah : diud. H ? 
22	et fratres meos, inquit, quod erant conscii, in vincla vincla C α D : vincula cett. ( ita l. 14) coniecit coegit C α . cum igitur eos vinciret quos secum habebat, te solutum Romam mittebat qui eadem scires quae illos scire dicis? reliqua pars accusationis duplex fuit: una regem in speculis semper fuisse in spec. semp. fu. C α h : in spec. fu. semp. ag : semp. in spec. fu. β , cum a te animo esset esset animo β alieno, altera exercitum eum contra te magnum comparasse. de exercitu dicam breviter, ut cetera. numquam eas copias rex Deiotarus habuit quibus inferre bellum populo Romano posset, sed quibus finis suos ab excursionibus et latrociniis latroc. hostium γ tueretur et imperatoribus nostris auxilia mitteret. atque antea quidem maiores copias alere poterat; nunc exiguas vix tueri potest. 
23	at misit ad nescio quem Caecilium ad Caec. nescio quem β : sed eos quos misit, quod ire noluerunt, in vincla coniecit. non quaero quam veri simile sit non sit γ veri simile sit aut] verissiles itaut C : veris si lesit aut H : simile sit veri A aut non non ante habuisse del. Cardenus habuisse regem quos quos misisset β mitteret aut eos qui missi essent non paruisse, aut, qui dicto audientes audientes C α Dag : obaud. h : obed. BE in tanta re non fuissent, eos vinctos potius quam necatos. sed tamen cum ad Caecilium mittebat, utrum causam illam victam esse nesciebat an Caecilium istum magnum hominem putabat? quem profecto is qui optime nostros homines novit vel quia non nosset vel si nosset, contemneret. 
24	addit etiam illud, equites non optimos misisse. credo credo gh : veteris credo (-es. Credo a) C αβ a ( voc. veteris ex veri l. 15 repetitum videtur ) , Caesar, nihil ad tuum equitatum, sed misit ex eis quos habuit electos. ait ait etiam C α a nescio quem ex eo numero servum iudicatum. non arbitror, non audivi: sed in eo, etiam si accidisset, culpam regis nullam fuisse arbitrarer. alieno autem a te animo quo modo fuit ante quo modo (quia a) add. γ ? speravit , credo, difficilis tibi Alexandreae Alexandriae mei fore exitus propter regionum naturam et fluminis. at eo tempore ipso pecuniam dedit, exercitum aluit, ei ei om. β quem Asiae praefeceras nulla in in om. β re defuit; tibi victori non solum ad hospitium sed ad periculum etiam atque ad etiam atque ad (ad om. V ) aciem CHVag : etiam atque etiam A : etiam et ad om. β aciem praesto fuit. 
25	secutum bellum est Africanum. graves de te rumores rumores sparsi E 2 γ , qui etiam furiosum illum Caecilium excitaverunt. quo tum rex animo animo C α : fuit add. β : erga te fuit add. γ , qui auctionatus sit seseque spoliare spoliare CH β : exspol. AVa maluerit quam tibi pecuniam non subministrare. at eo inquit tempore ipso Nicaeam Ephesumque mittebat qui rumores Africanos exciperent et celeriter ad se referrent. itaque cum esset ei nuntiatum Domitium naufragio perisse, te in castello circumsederi, de Domitio dixit versum Graecum eadem sententia qua etiam nos habemus Latinum: pereant amici, dum inimici una intercidant. quod ille, si tibi esset tibi esset C α : esset tibi βγ inimicissimus, numquam tamen dixisset: ipse enim mansuetus, versus immanis. qui autem Domitio poterat esse amicus, qui tibi esset inimicus? tibi porro inimicus cur esset a quo, cum vel interfici belli lege potuisset potuisset et inposuisset C : et potuisset H : fort. et iure potuisset , regem et se et filium suum constitutos esse meminisset? 
26	quid deinde? furcifer quo progreditur? ait hac laetitia Deiotarum elatum vino se obruisse in convivioque nudum in convivio nudumque AV saltavisse se salt. C . quae crux huic fugitivo potest satis supplici adferre? Deiotarum saltantem quisquam aut ebrium vidit umquam? omnes sunt in illo in illo sunt β regiae a rege virtutes, quod te, Caesar, ignorare non arbitror, sed praecipue singularis et admiranda frugalitas: etsi hoc verbo scio laudari reges reges CHV γ : regem A β non solere. Frugi hominem dici non multum habet laudis in rege: fortem, iustum, severum, gravem, magni animi magni animi C α BD : magnianimum σ : magnanimum Eh , largum, beneficum, liberalem: hae hae CAV β h : haec Hag ( cf. Phil. v. 8) sunt regiae laudes, illa privata est. ut volet quisque, accipiat: ego tamen frugalitatem, id est modestiam et temperantiam, virtutem maximam iudico. haec in illo est ab ineunte aetate aetate hic defic. gh ( ex hoc loc. γ = a σ ) cum a cuncta Asia, cum a magistratibus legatisque nostris, tum ab equitibus Romanis qui in Asia negotiati sunt perspecta et cognita. 
27	multis ille quidem ille quidem CH σ : quidem ille AV β a gradibus officiorum erga rem publicam nostram ad hoc regium nomen ascendit; sed tamen quicquid a bellis populi Romani vacabat, cum hominibus nostris consuetudines, amicitias, res rationesque amicitias res rationes om. C α iungebat, ut non solum tetrarches nobilis sed etiam etiam β a : om. C ασ optimus pater familias et diligentissimus et dil. dil. C α agricola et pecuarius haberetur. qui igitur adulescens nondum tanta gloria praeditus nihil umquam nisi severissime et gravissime fecerit, is ea existimatione eaque aetate saltavit? 
28	imitari , Castor, potius avi mores disciplinamque debebas quam optimo et clarissimo viro fugitivi ore male dicere. quod si saltatorem avum habuisses neque eum virum unde pudoris pudicitiaeque exempla peterentur, tamen hoc maledictum minime in illam aetatem conveniret. quibus ille studiis ab ineunte aetate se imbuerat, non saltandi, sed bene ut armis, optime ut equis uteretur, ea tamen illum cuncta cuncta om. C α iam aetate aetate C α : exacta aetate BD γ : exacta E defecerant. itaque Deiotarum cum plures in equum sustulissent, quod haerere in eo senex posset, admirari solebamus: hic vero adulescens qui meus in Cilicia miles, in Graecia commilito fuit, cum in illo nostro exercitu equitaret cum suis delectis equitibus quos una cum eo ad Pompeium pater miserat, quos concursus facere solebat, quam se iactare, quam ostentare, quam nemini in illa causa studio et cupiditate concedere! 
29	tum tum scripsi : cum codd. vero exercitu amisso ego, qui pacis semper auctor auctor C ασ : auctor fui BDa , post Pharsalicum autem autem om. BE proelium post Pharsal. aut. proelium del. Ernesti suasor fuissem armorum non ponendorum ponendorum C α a : depon. βσ , sed abiciendorum, hunc ad meam auctoritatem non potui adducere, quod et ipse ipsius β ardebat studio illius belli et patri satis faciendum faciendum C α a : fac. esse βσ arbitrabatur. felix ista domus quae non impunitatem solum adepta sit sed etiam accusandi accus. etiam β licentiam: calamitosus Deiotarus qui et ab eo qui in isdem eisdem C α castris fuerit, et et ante non modo om. β non modo apud te sed etiam non modo apud te sed etiam del. Halm a suis accusetur! vos vestra secunda fortuna, Castor Castor om. AV , non potestis sine propinquorum calamitate esse contenti? 
30	sint sane inimicitiae, quae esse non debebant—rex enim Deiotarus vestram familiam abiectam et obscuram e tenebris in lucem evocavit: quis tuum patrem ante ante C α a : antea βσ quis esset quam cuius gener gener C 2 AV γ : genere C 1 H β esset audivit?—sed quamvis ingrate et impie necessitudinis nomen repudiaretis repudiaretis ( ex -itis D ) β : -ritis C αγ , tamen inimicitias hominum more gerere poteratis, non ficto crimine insectari, non expetere vitam, non capitis arcessere. esto : concedatur haec quoque acerbitatis acerbitatis CHV β a : acerbitas A σ et odi magnitudo: adeone ut omnia vitae salutisque communis atque etiam humanitatis iura violentur? servum sollicitare verbis, spe promissisque corrumpere, abducere abducere C α a : adducere βσ domum, contra dominum armare, hoc est non uni propinquo, sed omnibus familiis nefarium bellum indicere. nam ista corruptela servi si non modo impunita fuerit sed etiam a tanta auctoritate approbata, nulli parietes nostram salutem, nullae leges, nulla iura custodient. Vbi enim id quod intus est atque nostrum impune evolare potest contraque nos pugnare, fit in dominatu servitus, in servitute in serv. βσ : et in serv. C α a dominatus. 
31	O tempora, o mores! Cn. Domitius ille quem nos pueri consulem, censorem, pontificem maximum vidimus, cum tribunus plebis M. Scaurum principem civitatis in iudicium populi vocavisset Scaurique servus ad eum clam domum venisset et crimina in dominum delaturum se esse dixisset, prendi prendi C α a : apprehendi (adprendi D ) βσ hominem iussit ad Scaurumque deduci. vide quid intersit, etsi inique Castorem cum Domitio comparo comparo βσ et Priscian. K. ii. 239: confero C α a : sed tamen ille inimico servum remisit, tu ab avo abduxisti; ille incorruptum audire noluit, tu corrupisti; ille adiutorem servum contra dominum repudiavit, tu etiam accusatorem adhibuisti. at semel iste est corruptus iste est corr. CH βσ : est corr. iste AVa a vobis. 
32	nonne , cum esset perductus perductus C α D γ : productus BE et cum tecum fuisset, refugit ad legatos? nonne ad hunc Cn. Domitium venit? nonne audiente hoc Ser. Sulpicio, clarissimo viro, qui tum casu apud Domitium cenabat, et hoc T. Torquato, optimo adulescente, se a te corruptum, tuis promissis in fraudem impulsum esse confessus est? quae est ista tam impotens tam impudens BE , tam crudelis, tam immoderata inhumanitas? idcirco in hanc urbem venisti ut huius urbis iura et exempla corrumperes domesticaque immanitate inhumanitate BE nostrae civitatis humanitatem inquinares? 
