33	at quam acute conlecta crimina! Blesamius inquit,—eius enim nomine, optimi viri nomine optimi viri H, Prisc. K. iii. 325: hominis nom. opt. viri CAV : nom. opt. hominis β : nom. viri opt. γ nec tibi ignoti, male dicebat tibi— ad regem inquit inquit om. unus cod. Halmii ( cf. Phil. viii. 27) in invidia esse C α Da (in om. AD ): invidiose BE scribere solebat te in invidia esse, tyrannum existimari, statua inter reges posita animos hominum vehementer offensos, plaudi tibi non solere. nonne intellegis, Caesar, ex urbanis malevolorum sermunculis haec ab istis esse conlecta? Blesamius tyrannum Caesarem scriberet? multorum enim capita civium viderat, multos iussu Caesaris vexatos, verberatos, necatos, multas adflictas et eversas domos, armatis militibus refertum forum! quae semper in civili victoria sensimus, ea te victore non vidimus. 
34	solus , inquam, es, C. Caesar, cuius in solus... cuius in om. C α victoria ceciderit nemo nisi armatus. et quem nos liberi liberi om. H in summa populi Romani populi Romani del. Halm libertate nati non modo non tyrannum sed etiam clementissimum in victoria ducimus ducimus C αγ : ducem vidimus E : vidimus ducem BD , is Blesamio qui vivit in regno tyrannus videri potest? nam de statua quis queritur, una praesertim, cum tam multas videat? valde enim invidendum est eius statuis cuius tropaeis non invidemus invidimus β . nam si locus adfert invidiam, nullus est est C ασ : locus est β a ad statuam quidem rostris clarior. de plausu autem quid respondeam? qui nec desideratus umquam in te in te C α : a te βγ est et non numquam obstupefactis hominibus ipsa admiratione compressus est et fortasse eo praetermissus quia nihil volgare te dignum videri potest. 
35	nihil a me arbitror praeteritum praeteritum C α a : praetermissum βσ , sed aliquid ad extremam partem causae extremam partem causae CH : extremum causae AVa : extremam (-um σ ) causae partem βσ reservatum. id autem aliquid quid aliquid quid scripsi ( cf. Lig. 22): aliquid codd. : quid Halm est? te ut plane Deiotaro reconciliet conciliet CH oratio mea. non enim iam metuo ne illi tu suscenseas; illud vereor ne tibi illum suscensere aliquid suspicere: quod abest longissime, mihi crede, Caesar. quid enim retineat per te meminit, non quid amiserit; neque se a te multatum arbitratur, sed, cum existimares existimaret CH : existimarer A multis tibi multa esse tribuenda, quo minus a se qui a se qui H : assequi cett. ( C ) in altera parte fuisset fuisset C ασ : potuisset β a ea sumeres non recusavit. 
36	etenim si Antiochus Magnus ille, rex Asiae, cum, postea quam cum postea quam CAV β a : cum postea H : qui postquam σ a L. Scipione L. om. C 1 β devictus est Lambin. devictus Tauro tenus regnare iussus est est C α D γ : esset BE , omnem omnem Garatoni : omnemque codd. hanc Asiam quae est nunc nostra provincia amisisset, dicere est solitus benigne sibi a populo Romano esse factum, quod nimis magna procuratione liberatus modicis regni terminis uteretur, potest multo facilius hoc hoc C α a : om. βσ se Deiotarus consolari. ille enim furoris multam sustulerat sustulerat CH : distulerat AV : sustinuerat β a : subierat σ , hic erroris. omnia tu Deiotaro, Caesar, tribuisti, cum et ipsi et filio nomen regium concessisti. hoc nomine retento atque servato nullum beneficium populi Romani, nullum iudicium de se senatus imminutum putat. Magno animo et erecto est, nec umquam succumbet inimicis, ne fortunae quidem. 
37	multa se arbitratur et peperisse et reperisse β ante factis et habere in animo atque virtute, quae nullo modo possit amittere. quae enim fortuna aut quis casus aut quae tanta possit iniuria omnium imperatorum de Deiotaro decreta delere? ab omnibus est enim is ornatus est enim is orn. C α a : enim his orn. est σ : enim est orn. β qui, postea quam in castris esse potuit per aetatem, in Asia, Cappadocia, Ponto, Cilicia, Syria bella gesserunt: senatus vero iudicia de illo tam multa tamque honorifica, quae publicis populi Romani litteris monumentisque consignata sunt, quae umquam vetustas obruet aut quae tanta delebit oblivio? quid de virtute eius dicam, de magnitudine animi, gravitate, constantia? quae omnes docti atque sapientes summa, quidam etiam bona sola bona sola C α a : sola bona βσ eisque Nohl : isque (hisque) codd. esse dixerunt, eisque non modo ad bene sed etiam ad beate vivendum contentam esse virtutem. 
38	haec ille reputans et dies noctesque cogitans non modo tibi non suscenset—esset enim non solum ingratus sed etiam amens—, verum omnem tranquillitatem et quietem senectutis refert acceptam accept. refert β clementiae tuae. quo quidem animo cum antea fuit, tum non dubito quin tuis litteris, quarum exemplum legi, quas ad eum Tarracone huic Blesamio dedisti, se magis etiam erexerit ab omnique sollicitudine abstraxerit. iubes enim eum bene sperare et bono esse animo, quod scio te non frustra scribere solere. memini enim isdem fere verbis ad me te scribere meque tuis litteris bene sperare non frustra esse iussum. 
39	laboro equidem regis Deiotari causa quocum mihi amicitiam res publica conciliavit, hospitium voluntas utriusque coniunxit, familiaritatem consuetudo attulit, summam vero necessitudinem magna eius officia in me et in exercitum meum effecerunt: sed cum de illo laboro, tum de multis amplissimis viris quibus semel ignotum a te esse oportet, nec tuum benefic. tuum β beneficium in dubium vocari, nec haerere in animis hominum sollicitudinem sempiternam, nec accidere ut quisquam te timere timere iterum timere Lehmann incipiat eorum qui sint semel a te liberati timore. 
40	non debeo, Caesar Caesar C α a : C. Caesar βσ , quod fieri solet in tantis periculis, temptare ecquonam ecquonam Gulielmius : et quonam CH : quonam A (e coll. mea) V βγ modo dicendo misericordiam tuam commovere movere CAH possim. nihil opus est. occurrere solet ipsa supplicibus et calamitosis, nullius oratione evocata. propone tibi duos reges et id animo contemplare quod oculis non potes: dabis profecto id misericordiae quod iracundiae denegasti. multa sunt monumenta clementiae tuae, sed maxime maxime maxima Wesenberg eorum incolumitates quibus salutem dedisti. quae si in privatis gloriosa sunt, multo magis commemorabuntur in regibus. semper regium nomen in hac civitate sanctum fuit, sociorum vero regum et amicorum sanctissimum. 
41	quod nomen hi reges ne amitterent te victore timuerunt, retentum vero et a te confirmatum posteris etiam suis tradituros se esse confidunt se esse confidunt C α a : esse confido BD σ : confido E . corpora sua pro salute regum suorum hi legati legati C α a : tibi ante regii add. β : post reg. σ regii tradunt, Hieras et Blesamius et Antigonus Antigonus BD 2 σ : Antigenus D 1 E : Artignus C α : Antigronus a: Antiochus Probus K. iv. p. 27, Sacerdos ii. 40 , tibi nobisque omnibus iam diu noti, eademque fide et virtute praeditus Dorylaus Dorulaus C α , qui nuper cum Hiera legatus est ad te missus, cum regum amicissimi, tum tibi etiam, ut spero, probati. 
42	exquire de Blesamio num quid ad regem contra dignitatem tuam tuam H βσ : suam CAVa scripserit. Hieras quidem causam omnem suscipit et criminibus illis pro rege se supponit reum. memoriam tuam implorat, qua vales plurimum; negat umquam se a te in Deiotari tetrarchia pedem discessisse; in primis finibus tibi praesto se praesto se C α a : se praesto βσ fuisse dicit, usque ad ultimos prosecutum; cum e balneo exisses, tecum cum... tecum om. C 1 se se om. C α fuisse, cum illa munera munera om. CH inspexisses cenatus, cum in cubiculo recubuisses; eandemque adsiduitatem tibi se praebuisse postridie. 
43	quam ob rem si quid eorum quae obiecta sunt cogitatum sit, non recusat quin id suum facinus iudices. Quocirca, C. Caesar, velim existimes hodierno die sententiam tuam aut cum summo dedecore miserrimam pestem importaturam esse regibus aut incolumem famam cum salute: quorum alterum optare illorum crudelitatis est, alterum conservare clementiae tuae. 
