942	et id et aliud, quod me orabis, impetrabis. atque te
943	nolim suscensere quod ego iratus ei feci male.
944	Quid fecisti?
944b	In lapicidinas compeditum condidi,
945	ubi rescivi mihi data esse verba.
945b	Vae misero mihi,
946	propter meum caput labores homini evenisse optumo.
947	At ob eam rem mihi libellam pró eo argenti ne duis:
948	gratiis a me, ut sit liber, ducito.
948b	Edepol, Hegio,
949	facis benigne. sed quaeso, hominem ut iubeas arcessi.
949b	Licet.
950	ubi estís vos? ite actutum, Tyndarum huc arcessite.
951	vos ite intro. interibi ego ex hac statua verberea volo
952	erogitare, meo minore quid sit factum filio.
953	vos lavate interibi.
953b	Sequere hac, Philocrates, me intro.—
953c	Sequor.—
954	Age tu illuc procede, bone vir, lepidum mancupium meum.
955	Quid me oportet facere, ubi tu talis vir falsum autumas?
956	fui ego bellus, lepidus: bonus vir numquam, neque frugi bonae,
957	neque ero umquam, ne erres : spem ponas me bonae frugi fore.
958	Propemodum ubi loci fortunae tuae sint facile intellegis.
959	sí eris verax, tua ex re, facies ex mala meliusculam.
960	recte et vera loquere, sed neque vere neque tu recte adhuc
961	fecisti umquam.
961b	Quod ego fatear, credin pudeat cum autumes?
962	At ego faciam ut pudeat, nam in ruborem te totum dabo.
963	Eia, credo ego imperito plagas minitaris mihi.
964	tandem ista aufer ac dic quid fers, ut feras hinc quod petis.
965	Satis facundu's facundus es . sed iam fieri dicta compendi volo.
966	Vt vis fiat.
966b	Bene morigerus fuit puer, nunc non decet.
967	hoc agamus. iam animum advorte ac mihi quae dicam edissere.
968	sí eris verax, ex tuis rebus feceris meliusculas.
969	Nugae istaec sunt. non me censes scire quid dignus siem?
970	At ea subterfugere potis es pauca, si non omnia.
971	Pauca effugiam, scio; nam multa evenient, et merito meo,
972	quia et fugi et tibi surripui filium et eum vendidi.
973	Cui homini?
973b	Theodoromedi in Alide Polyplusio,
974	sex minis.
974b	Pro di immortales, is quidem huius est pater
975	Philocrati.
975b	Quin melius novi quam tu et vidi saepius.
976	Serva, Iuppiter supreme, et me et meum gnatum mihi.
977	Philocrates, per tuom te genium óbsecro, exi, te volo.
978	Hegio, assum. si quid me vis, impera.
978b	Hic gnatum meum
979	tuo patri ait se vendidisse sex minis in Alide.
980	Quam diu id factum est?
980b	Hic annus incipit vicensimus.
981	Falsa memorat.
981b	Aut ego aut tu. nam tibi quadrimulum
982	tuos pater peculiarem parvolo puero dedit.
983	Quid erat ei nomen? si vera dicis, memoradum mihi.
984	Paegnium vocitatust, post vos indidistis Tyndaro.
985	Cur ego te non novi?
985b	Quia mos est oblivisci hominibus
986	neque novisse cuius nihili sit faciunda gratia.
987	Dic mihi, isne istíc fuit, quem vendidisti meo patri,
988	qui mihi peculiaris datus est?
988b	Huius filius.
989	Vivitne is homo?
989b	Argentum accepi, nil curavi ceterum.
990	Quid tu ais?
990b	Quin istic ipsust Tyndarus tuos filius,
991	ut quidem hic árgumenta loquitur. nam is mecum a puero puer
992	bene pudiceque educatust usque ad adulescentiam.
993	Et miser sum et fortunatus, si vos vera dicitis;
994	eo miser sum quia male illi feci, si gnatust meus.
995	eheu, quóm ego plus minusve feci quam me aequom fuit.
996	quod male feci crucior; modo si infectum fieri possiet.
997	sed eccum incedit huc ornatus haúd ex suis virtutibus.
998	Vidi ego multa saepe picta, quae Acherunti fierent
999	cruciamenta, verum enim vero nulla adaeque est Acheruns
1000	atque ubi ego fui, in lapicidinis. illic ibi demumst locus,
1001	ubi labore lassitudo est exigunda ex corpore.
1002	nam ubi illo adveni, quasi patriciis pueris aut monerulae,
1003	aut anites aut coturnices dantur, quicum lusitent,
1004	itidem mi haec advenienti upupa, qui me delectem, datast.
1005	sed erus eccum ante ostium, et erus alter eccum ex Alide
1006	rediit.
1006b	Salve, éxoptate gnate mi.
1006c	Hem, quid gnate mi?
1007	attat, scio cur te patrem adsimules esse et me filium:
1008	quia mi item ut parentes lucis das tuendi copiam.
1009	Salve, Tyndare.
1009b	Et tu, quoius causa hanc aerumnam exigo.
1010	At nunc liber in divitias faxo venies. nam tibi
1011	pater hic est; hic servos, qui te huic hinc quadrimum surpuit,
1012	vendidit patri meo te sex minis, is te mihi
1013	parvolum peculiarem parvolo puero dedit:
1014	illic indícium fecit; nam hunc ex Alide huc reduximus.
1015	Quid huius filium?
1015b	Intus eccum fratrem germanum tuom.
1016	
1016b	Quid tu ais? adduxtin illum huius captivom filium?
1017	Quin, inquam, intus hic est.
1017b	Fecisti edepol et recte et bene.
1018	Nunc tibi páter hic est: hic fur est tuos, qui parvom hinc te abstulit.
1019	At ego hunc grandis grandem natu ob furtum ad carnificem dabo.
1020	Meritus est.
1020b	Ergo edepol merito meritam mercedem dabo.
1021	sed tu dic oro: pater meus tune es?
1021b	Ego sum, gnate mi.
1022	Nunc demum in memoriam redeo, cum mecum recogito.
1023	nunc edepol demum in memoriam regredior, audisse me
1024	quasi per nebulam, Hégionem meum patrem vocarier.
1025	Is ego sum.
1025b	Compedibus quaeso ut tibi sit levior filius
1026	atque huic gravior servos.
1026b	Certum est principio id praevortier.
1027	eamus intro, ut arcessatur faber, ut istas compedes
1028	tibi adimam, huic dem.
1028b	Quoi peculi nihil est, recte feceris.
1029	Spectatores, ad pudicos mores facta haec fabula est,
1030	neque in hac subigitationes sunt neque ulla amatio
1031	nec pueri suppositio nec argénti circumductio,
1032	neque ubi amans adulescens scortum liberet clam suom patrem.
1033	huius modi paucas poetae reperiunt comoedias,
1034	ubi boni meliores fiant. nunc vos, si vobis placet
1035	et si placuimus neque odio fuimus, signum hoc mittite:
1036	qui pudicitiae esse voltis praemium, plausum date.
