1	diuturni silenti, patres conscripti, quo eram his temporibus usus, non timore aliquo, sed partim dolore, partim verecundia, finem hodiernus dies attulit, idemque initium quae vellem quaeque sentirem meo pristino more dicendi. tantam enim mansuetudinem, tam inusitatam invisitatam Eberhard inauditamque clementiam, tantum in summa potestate rerum omnium modum, tam denique incredibilem sapientiam ac paene divinam tacitus praeterire nullo modo nullo modo praet. β possum. 
2	M. enim Marcello vobis, patres conscripti, reique publicae reddito non illius solum solum illius γ sed etiam meam meam hoc loco hab. HBDE, post vocem L γ , om. AV vocem et auctoritatem vobis et et vobis β rei publicae conservatam conservatam ac om. α ac restitutam puto. dolebam enim, patres conscripti, et vehementer angebar, cum viderem cum viderem γ : om. αβ cum BDL : qui cum α : qui E γ virum talem, cum in eadem causa in qua ego fuisset fuisset α : fuisse h : fuissem Bam , non in eadem esse fortuna, nec mihi persuadere poteram nec fas esse ducebam versari me in nostro vetere vetere V γ : veteri H β : om. A curriculo illo aemulo atque imitatore studiorum ac laborum meorum quasi quodam socio a me et comite distracto. ergo et mihi meae et mihi meae k, ed. Cratand. : mihi et meae L : et mihi et meae cett. pristinae vitae consuetudinem, C. Caesar, interclusam aperuisti et his omnibus ad bene de re publica de re p. α : de omni re p. βγ sperandum quasi signum aliquod sustulisti. 
3	intellectum est enim mihi quidem in multis et maxime in me ipso, sed paulo ante omnibus omnibus Victorius : in omnibus codd. , cum M. Marcellum senatui reique publicae concessisti, commemoratis praesertim offensionibus, te auctoritatem huius ordinis dignitatemque rei publicae tuis vel doloribus vel suspicionibus anteferre. ille quidem fructum omnis ante actae vitae vitae om. σ : aetatis h hodierno die maximum cepit, cum summo consensu senatus tum tum praeterea γ iudicio tuo gravissimo et maximo. ex quo profecto intellegis quanta in dato beneficio sit laus, cum in accepto sit tanta gloria. 
4	est es H vero fortunatus fortun. α hm : fortun. ille β a cuius ex salute non minor paene ad omnis quam ad illum ipsum Ernesti ventura sit laetitia pervenerit: quod quidem merito merito α : ei merito βγ atque optimo iure contigit. quis enim est illo aut nobilitate aut probitate aut optimarum artium studio aut innocentia aut ullo in in α : om. βγ laudis genere praestantior? nullius tantum flumen est ingeni, nulla nulla α hm : nulli DELa : nullius R. Klotz dicendi aut scribendi tanta vis, tantaque tantaque α : tanta βγ copia quae non dicam exornare, sed enarrare, C. Caesar, res tuas gestas possit. tamen hoc adfirmo et adfirmo et hoc β pace dicam tua, nullam in his esse laudem ampliorem quam eam quam hodierno die consecutus es. 
5	soleo saepe ante oculos ponere idque libenter crebris usurpare sermonibus, omnis nostrorum imperatorum, omnis exterarum gentium potentissimorumque populorum, omnis regum clarissimorum clariss. regum β res gestas cum tuis nec contentionum magnitudine nec numero proeliorum nec varietate regionum nec celeritate conficiendi nec dissimilitudine bellorum posse conferri, nec vero disiunctissimas terras citius passibus cuiusquam potuisse peragrari quam tuis non dicam cursibus, sed victoriis lustratae lustratae β : illustratae αγ sunt. 
6	quae quidem ego nisi ita ita αγ : tam β magna esse fatear ut ea vix cuiusquam mens aut cogitatio capere possit, amens sim; sed tamen sunt alia maiora. nam bellicas laudes solent quidam extenuare verbis easque detrahere ducibus, communicare cum multis, ne propriae sint imperatorum. et certe in armis militum virtus, locorum opportunitas, auxilia sociorum, classes, commeatus multum iuvant, maximam vero partem quasi suo iure Fortuna sibi sibi β hm : om. α a vindicat et, quicquid est est post gestum hab. β prospere gestum, id paene omne ducit suum. 
7	at vero huius gloriae, C. C. om. α a Caesar, quam es paulo ante adeptus socium habes neminem: totum hoc quantumcumque est, quod certe maximum est, totum est, inquam, tuum. nihil sibi ex ista laude centurio, nihil praefectus, nihil cohors, nihil turma decerpit; quin etiam illa ipsa rerum humanarum domina, Fortuna, in istius se se ante non hab. β societatem gloriae non offert: tibi cedit, tuam tuam α hm : tuam se β a (se sup. lin. in D ) esse totam et propriam fatetur. numquam enim temeritas cum sapientia commiscetur nec ad consilium casus admittitur. 
8	domuisti gentis immanitate barbaras, multitudine innumerabilis, locis infinitas, omni copiarum genere abundantis: ea tamen sed tamen ea β vicisti quae et naturam et condicionem ut vinci possent habebant. nulla est enim tanta vis vis, tanta copia γ fort. recte quae non ferro et viribus debilitari frangique possit. animum vincere, iracundiam cohibere, victo victo α D : victum hm : victoriam BELa ( Arus. Mess. K. viii. p. 512. 17 temperat huic Cic. de M. Marc. ) temperare, adversarium nobilitate, ingenio, virtute praestantem non modo extollere iacentem sed etiam amplificare eius pristinam dignitatem, haec qui faciat facit β ( contra Lactant. Div. Inst. i. 9. 3) , non ego eum cum summis viris comparo, sed simillimum deo iudico. 
9	itaque , C. Caesar, bellicae tuae laudes celebrabuntur illae quidem non solum nostris sed paene omnium gentium litteris atque linguis, neque ulla umquam aetas de tuis laudibus conticescet; sed tamen eius modi res nescio quo modo, etiam cum leguntur, obstrepi clamore militum obstrepit clamor mil. (videntur add. V ) et tub. soni AV videntur et tubarum sono. at vero cum aliquid clementer, mansuete, iuste, moderate, sapienter factum, in iracundia praesertim quae est inimica consilio, et in victoria quae natura insolens et et insolens α superba est, audimus aut legimus aut audimus γ , quo studio incendimur, non modo in gestis rebus sed etiam in fictis ut eos saepe quos numquam vidimus diligamus! 
10	te vero quem praesentem intuemur, cuius mentem sensusque et os cernimus, ut, quicquid belli fortuna reliquum rei publicae fecerit, id esse salvum velis, quibus laudibus efferemus, quibus studiis prosequemur, qua benevolentia complectemur? parietes , me dius fidius, ut mihi videtur videntur HV m et Sacerdosi. 166 , huius curiae tibi gratias agere gestiunt, quod brevi tempore futura sit illa auctoritas in his maiorum suorum et suis sedibus. equidem cum C. Marcelli, viri optimi et commemorabili pietate praediti lacrimas modo vobiscum viderem, omnium Marcellorum meum pectus memoria offudit effudit Dhm (in meum pectus se memoria effudit Madvig ) , quibus tu etiam mortuis M. Marcello conservato dignitatem suam reddidisti nobilissimamque familiam iam iam om. β ad paucos redactam paene ab interitu vindicasti. 
11	hunc tu tu α m : tu igitur β ah diem tuis maximis et innumerabilibus gratulationibus iure anteponis anteponis αβ a : -pones hm . haec enim res unius est propria C. C. om. α Caesaris; ceterae duce te gestae magnae illae quidem, sed tamen multo magnoque comitatu. huius autem rei tu idem dux es dux es α : et dux es γ : es et dux β et comes: quae quidem tanta est ut ut am : ut nulla β ah tropaeis et monumentis tuis adlatura finem sit aetas—nihil est enim opere et manu factum quod non non α , Schol. Lucani vi. 20, Lactant. Div. Inst. vi. 11. 25: non aliquando βγ conficiat et consumat vetustas—
12	at haec tua tua om. Lactant. iustitia et lenitas lenitas α a et Lactant. : lenitas animi β hm florescet florescit β ( contra Lactant. ) cotidie magis. ita ita α : ita ut βγ quantum operibus tuis tuis oper. β diuturnitas detrahet, tantum adferet adferet AHDLm : adferat BEah : adfert V laudibus. et ceteros quidem omnis victores bellorum civilium iam antea antea α : ante βγ aequitate et misericordia viceras: hodierno vero die te ipse ipse α : ipsum βγ vicisti. vereor ut hoc quod dicam perinde intellegi possit auditu auditum Patricius atque ipse cogitans sentio: ipsam victoriam vicisse videris, cum ea quae erant adempta quae erant adempta Harl. 2545, Madvig : quae erant (erat AV ) adepta α : quae illa erat adepta βγ victis remisisti. nam cum ipsius victoriae iure omnes iure omnes scripsi : condicione iure omnes α ah : condicione omnes iure m : condicione omnes β victi occidissemus, clementiae tuae iudicio conservati sumus. recte igitur unus invictus es es γ : om. αβ : diceris mallet Müller a quo etiam ipsius victoriae condicio visque devicta est. 
13	atque hoc C. Caesaris iudicium, patres conscripti, quam late pateat attendite. omnes enim qui ad illa arma fato sumus nescio quo rei publicae misero funestoque compulsi, etsi aliqua culpa tenemur erroris humani, ab ab om. β scelere certe liberati sumus. nam cum M. Marcellum deprecantibus vobis rei publicae conservavit, me et mihi et item rei publicae, nullo deprecante, reliquos amplissimos viros et sibi ipsos et patriae reddidit, quorum et frequentiam et dignitatem hoc ipso in consessu videtis, non ille hostis induxit in curiam, sed iudicavit a plerisque ignoratione potius et falso atque inani metu quam cupiditate aut crudelitate bellum esse susceptum. 
14	quo quidem in bello semper de pace audiendum audiendum α Em : agendum audiendum BDL : agendum audiendumque ah putavi semperque dolui non modo pacem sed etiam orationem civium pacem flagitantium repudiari. neque enim ego illa nec ulla umquam secutus sum arma civilia semperque mea consilia pacis et togae socia, non belli atque armorum fuerunt. hominem sum secutus privato officio, non publico, tantumque apud me grati animi fidelis memoria valuit ut nulla non modo cupiditate sed ne spe quidem prudens et sciens tamquam ad interitum ruerem voluntarium. 
15	quod quidem meum consilium minime obscurum fuit. nam et in hoc ordine integra re multa de pace dixi et in ipso bello eadem etiam cum cum partis meae per. γ capitis mei periculo sensi. ex quo nemo erit iam erit β tam iniustus rerum existimator existim. rerum β qui dubitet quae Caesaris de bello voluntas fuerit, cum pacis auctores conservandos statim censuerit, ceteris fuerit iratior. atque id minus mirum fortasse tum mirum fort. tum α BDL : fort. mirum tum E : mirum videretur fort. tum γ (videtur h ) cum esset incertus exitus et anceps fortuna belli: qui vero victor pacis auctores diligit, is profecto declarat maluisse se se maluisse β non dimicare quam vincere. 
16	atque huius quidem rei M. M. om. β Marcello sum testis. nostri enim sensus ut in pace semper, sic tum etiam in bello congruebant. quotiens ego eum et quanto cum dolore vidi, cum insolentiam certorum certorum Em : ceterorum α BDLah hominum tum etiam ipsius victoriae ferocitatem extimescentem! quo gratior tua liberalitas, C. Caesar, nobis qui illa illam β vidimus debet esse. non enim iam iam α ah : tam m : om. β causae sunt inter se, sed victoriae comparandae. 
17	vidimus tuam victoriam proeliorum exitu terminatam: gladium vagina vacuum in urbe non vidimus. quos amisimus civis, eos vis Martis vis Martis α h : Martis vis β am perculit, non ira victoriae, ut dubitare debeat nemo quin multos, si posset posset α : fieri posset βγ , C. Caesar ab inferis excitaret, quoniam ex eadem acie conservat quos potest. alterius vero partis nihil amplius dico dicam β quam id quod omnes verebamur, nimis iracundam futuram fuisse victoriam. 
18	quidam enim non modo armatis sed interdum etiam otiosis minabantur, nec quid quisque sensisset, sed ubi fuisset cogitandum esse dicebant; ut mihi quidem videantur di immortales, etiam si poenas a populo Romano ob aliquod delictum expetiverunt, qui civile bellum tantum et tam luctuosum excitaverunt excitaverint cod. Faerni , vel placati iam vel satiati aliquando omnem spem salutis ad clementiam victoris et sapientiam contulisse. 
19	qua re gaude tuo gaude tuo gaudeto A isto tam excellenti bono et fruere cum fortuna et gloria tum etiam natura et moribus tuis; ex quo quidem maximus est fructus iucunditasque sapienti. cetera cum tua recordabere, etsi persaepe virtuti, tamen plerumque felicitati tuae gratulabere: de nobis quos in re publica tecum simul simul αβ : salvos γ esse voluisti quotiens cogitabis, totiens de maximis tuis beneficiis, totiens de incredibili liberalitate, totiens de singulari sapientia sapientia tua γ cogitabis: quae non modo summa bona sed nimirum audebo vel sola dicere. tantus est est α DEL : om. B γ enim splendor in laude vera, tanta in magnitudine animi et consili dignitas ut haec a virtute donata, cetera a fortuna commodata esse videantur. 
20	noli igitur in conservandis viris bonis bonis viris β defetigari defet. BDH : defat. AVEh , non cupiditate praesertim aliqua aut pravitate lapsis, sed opinione offici stulta fortasse, certe non improba, et specie specie facie hm (-ce m ) quadam rei publicae. non enim tua ulla culpa culpa ulla γ est, si te aliqui timuerunt, contraque summa laus, quod minime timendum fuisse senserunt. 
21	nunc venio ad gravissimam querelam et atrocissimam suspicionem tuam, quae non tibi ipsi magis quam cum omnibus civibus, tum maxime nobis qui a te conservati sumus providenda est: quam etsi spero falsam esse, numquam tamen tamen numquam β extenuabo extenuabo verbis γ , tua enim cautio nostra cautio est. quod si quod si H, Priscian. K. ii. pp. 181, 226: ut si cett. in alterutro peccandum sit, malim videri nimis timidus quam parum prudens. sed quisnam est iste tam demens? de tuisne?—tametsi qui magis sunt tui quam quibus tu salutem insperantibus reddidisti?—anne ex eo anne ex eo scripsi : axeneone ex H : anexeo ne V : an ex eone ex A : an ex eo γ : an ex hoc β numero qui una tecum fuerunt? non est credibilis tantus in ullo furor ut quo duce omnia summa sit adeptus, huius vitam non anteponat suae. an si nihil tui cogitant sceleris, cavendum est ne quid inimici? qui ? omnes enim qui fuerunt qui superfuerunt hm aut sua pertinacia vitam amiserunt aut tua misericordia retinuerunt, ut aut nulli supersint de inimicis aut qui fuerunt sint amicissimi. 
22	sed tamen cum in animis hominum tantae latebrae sint et tanti recessus, augeamus sane suspicionem tuam: simul enim augebimus diligentiam. nam quis est omnium tam ignarus rerum, tam rudis in re publica, tam nihil umquam nec de sua nec de communi communi αβ : omnium hm : communi omnium a salute cogitans, qui non qui non quin AV intellegat tua salute contineri suam et ex unius tua vita pendere omnium pendere omnia α et Schol. Lucani v. 686 ? equidem de te dies noctesque, ut debeo, cogitans casus dumtaxat humanos et incertos eventus valetudinis et naturae communis fragilitatem fragilitatẽs H extimesco, doleoque, cum res publica immortalis esse debeat, eam in unius mortalis anima consistere. 
23	si vero ad humanos casus incertosque motus valetudinis sceleris etiam accedit accedat γ insidiarumque consensio, quem deum, si cupiat, posse opitulari rei publicae credimus credimus α : -amus βγ ? omnia sunt excitanda tibi, C. Caesar, uni quae iacere sentis belli ipsius impetu, quod necesse fuit, perculsa atque prostrata: constituenda iudicia, revocanda fides, comprimendae libidines, propaganda suboles, omnia quae dilapsa dilapsa Ha γ : delapsa AV β iam diffluxerunt difflux. Bm : deflux. α ELa : fluxerunt h severis legibus vincienda sunt. 
24	non fuit recusandum in tanto civili bello, tanto animorum tantoque an. γ ardore et armorum quin quassata res publica, quicumque belli eventus fuisset, multa perderet et ornamenta dignitatis et praesidia stabilitatis suae, multaque uterque dux faceret armatus quae idem togatus fieri prohibuisset. quae quidem tibi nunc nunc tibi γ omnia belli volnera sananda sananda a αβ : curanda γ sunt, quibus praeter te mederi nemo potest. 
25	itaque illam tuam praeclarissimam et sapientissimam vocem invitus audivi: satis diu vel naturae vixi diu ... vixi αβ a : te diu ... vixisse hm vel gloriae. satis , si ita vis, fortasse naturae, addam addam α : addo βγ etiam, si placet, gloriae: at, quod maximum est, patriae certe parum. qua re omitte, quaeso, istam quaeso, istam α ah : istam, quaeso β m doctorum hominum in contemnenda morte prudentiam: noli nostro periculo esse sapiens. saepe enim venit ad meas auris auris meas β te idem istud nimis crebro dicere, satis te tibi satis te tibi α : tibi satis te BDL γ : tibi te satis E vixisse. credo , sed tum id audirem, si tibi soli viveres aut si tibi etiam soli natus esses. omnium salutem civium cunctamque rem publicam res tuae gestae complexae sunt nunc cum omnium ... compl. sunt (sint a ) γ ; tantum abes a perfectione maximorum operum ut fundamenta nondum quae cogitas ieceris. hic tu modum vitae tuae non salute rei publicae, sed aequitate animi definies? quid , si istud ne gloriae quidem quidem Schol. : quidem tuae αγ : tuae quidem β satis est? cuius te esse avidissimum, quamvis sis sapiens, non negabis. 
26	parumne parumne α L : parumne igitur BDE γ , inquies, magna magna αβ : gloriam magnam γ relinquemus? immo vero aliis quamvis multis satis, tibi uni parum. quicquid est enim, quamvis amplum sit, id est parum tum cum est aliquid amplius. quod si rerum tuarum immortalium, C. Caesar, hic exitus futurus fuit ut devictis adversariis rem publicam in eo statu relinqueres in quo nunc est, vide, quaeso, ne tua divina virtus admirationis plus sit habitura quam gloriae; si quidem gloria est inlustris et pervagata magnorum vel in suos civis civis om. γ vel in patriam vel in omne genus hominum fama meritorum. 
27	haec igitur tibi reliqua pars est; hic restat actus, in hoc elaborandum est ut rem publicam constituas, eaque tu in primis summa tranquillitate et otio perfruare: tum te, si voles, cum et patriae cum patriae β quod debes solveris et naturam ipsam expleveris satietate vivendi, satis diu vixisse vixisse te vixisse H : vixisse in ras. hab. A est enim Schol. et Servius Aen. x. 467 dicito. quid enim est omnino omnino om. Schol. et Serv. hoc om. γ hoc ipsum diu in quo est aliquid extremum? quod cum venit, omnis voluptas praeterita pro nihilo est, quia postea nulla est futura. quamquam iste tuus animus numquam his angustiis quas natura nobis ad vivendum dedit contentus fuit, semper immortalitatis amore flagravit. 
28	nec vero haec tua vita ducenda ducenda A β : dicenda HV γ est quae corpore et spiritu continetur: illa, inquam, illa vita est tua quae vigebit memoria saeculorum omnium, quam posteritas alet, quam ipsa aeternitas semper tuebitur. huic tu inservias, huic te ostentes oportet, quae quidem quae miretur iam pridem multa habet; nunc etiam quae laudet exspectat. obstupescent posteri certe imperia, provincias, Rhenum, Oceanum, Nilum, pugnas innumerabilis, incredibilis victorias, monumenta, munera, triumphos audientes et legentes tuos. 
29	sed nisi haec urbs stabilita tuis consiliis et institutis erit, vagabitur modo tuum nomen longe atque late, sedem sedem quidem γ stabilem et domicilium certum non habebit. erit inter eos etiam qui nascentur, sicut inter nos fuit, magna dissensio, cum alii laudibus ad caelum res tuas gestas efferent, alii fortasse aliquid requirent, idque vel maximum, nisi belli civilis incendium salute patriae restinxeris, ut illud fati fuisse fuisse hoc loco hab. β hm, post videaur α , post hoc a videatur, hoc consili. Servi igitur eis eis α : etiam h : eis etiam β am iudicibus qui multis post saeculis de te iudicabunt et quidem haud scio an incorruptius quam nos; nam et sine amore et sine cupiditate et rursus sine odio et sine invidia iudicabunt. 
30	id autem etiam si tum ad te, ut quidam falso putant, non pertinebit, nunc certe pertinet esse te talem ut tuas laudes obscuratura nulla umquam sit oblivio. diversae voluntates civium fuerunt distractaeque sententiae. non enim consiliis solum et studiis sed armis etiam et castris dissidebamus. erat erat α h : erat enim β : erat autem am obscuritas quaedam, erat certamen inter clarissimos duces; multi dubitabant quid optimum esset, multi quid sibi expediret, multi quid deceret deceret AVDELa : diceret HBhm , non nulli etiam quid liceret. 
31	perfuncta res publica est hoc hoc om. α misero fatalique bello: vicit is qui non fortuna inflammaret odium suum, sed bonitate leniret; neque omnis nec qui omn. β quibus iratus esset eosdem etiam etiam α DEL : om. B γ exsilio aut morte dignos iudicaret. arma ab aliis posita, ab aliis erepta sunt. ingratus est iniustusque civis qui armorum periculo liberatus animum tamen retinet armatum, ut etiam ille melior sit melior sit H β : sit melior AV γ qui in acie cecidit, qui in causa animam profudit. quae enim pertinacia quibusdam, eadem aliis constantia videri potest. 
32	sed iam omnis fracta dissensio est armis, exstincta aequitate victoris: restat ut omnes unum velint qui habent habent α m : modo habent β ah aliquid non sapientiae modo non sap. modo AVam : non modo sap. Hh : non solum sap. β sed etiam sanitatis. Nisi te, C. Caesar, salvo et in ista sententia qua cum antea tum hodie maxime vel maxime β usus es manente salvi esse non possumus. qua re omnes te qui haec salva esse volumus et hortamur et obsecramus ut vitae, ut saluti tuae ut vitae, ut saluti tuae α : ut vitae tuae et saluti β a : ut vitae hm consulas, omnesque tibi, ut pro aliis etiam loquar quod de me ipso me ipse β sentio, quoniam subesse aliquid putas quod cavendum sit, non modo excubias et custodias sed etiam laterum nostrorum oppositus et corporum pollicemur. 
33	sed ut ut α Em : om. BDah , unde est orsa, in eodem terminetur oratio oratio mea hm , maximas tibi omnes gratias agimus, C. Caesar, maiores etiam habemus. nam omnes idem sentiunt, quod ex omnium precibus et lacrimis sentire potuisti. sed quia non et quoniam non γ est omnibus omnibus post stant. hab. a : om. hm stantibus necesse dicere, a me certe dici volunt, cui necesse est quodam modo, et quod fieri decet M. Marcello a te huic ordini populoque Romano et rei publicae reddito, fieri id intellego. nam laetari omnis non ut de unius solum sed ut de non ut de unius solum sed ut de ( om. solum ah ) α ah : non de unius solum sed de β : non de unius sed de m : fort. salute post solum transponendum ( de numero cf. Zielinski, p. 212) omnium omnium AV : omni H : communi βγ salute sentio. 
34	quod autem summae benevolentiae est, quae mea erga illum omnibus nota semper semper nota β fuit, ut vix C. Marcello C. α D : M. / EL : om. γ , optimo et amantissimo fratri, praeter eum quidem cederem nemini, cum id sollicitudine, cura, labore tam diu praestiterim quam diu est de illius salute dubitatum, certe hoc tempore magnis curis, molestiis, doloribus liberatus praestare debeo debebo H sol. . itaque , C. Caesar, sic tibi gratias ago ut me omnibus rebus omnibus me rebus β a te non conservato solum sed etiam ornato, tamen ad tua in me unum unum β : om. αγ innumerabilia merita, quod fieri iam posse non arbitrabar, magnus maximus β hoc tuo facto cumulus accesserit. 
