30	atque etiam illud scire ex te cupio, quo consilio aut qua mente feceris ut in epulo Q. Arri, familiaris mei, cum toga pulla accumberes? quem umquam videris, quem audieris? quo exemplo, quo more feceris? dices supplicationes te illas non probasse. optime : nullae fuerint fuerint Angelius : fuerunt codd. supplicationes. videsne me nihil de anni illius causa, nihil de eo quod tibi commune cum summis viris esse videatur, sed de tuis propriis sceleribus ex te quaerere? nulla supplicatio fuerit. cedo quis umquam cenarit atratus? ita enim illud epulum est funebre ut munus sit funeris, epulae quidem ipsae dignitatis. 
31	sed omitto epulum populi Romani, festum diem argento, veste, omni apparatu ornatuque visendo visendum coni. Baiter : quis umquam in luctu domestico, quis in funere familiari cenavit cum toga pulla? cui de balineis balneis P 2 B Σ exeunti praeter te toga pulla umquam data est? Cum tot hominum milia accumberent, cum accumberent ⟨cum togis albis⟩ cum K. Busche ipse epuli dominus, Q. Arrius, albatus esset, tu in templum Castoris te cum C. Fibulo Fidulo GEs atrato ceterisque tuis furiis funestum intulisti. quis tum non ingemuit, quis non doluit rei publicae casum? qui sermo alius in illo epulo fuit nisi hanc tantam et tam gravem civitatem subiectam esse non modo furori, verum etiam inrisioni tuae? 
32	hunc tu morem ignorabas? numquam epulum videras? numquam puer aut adulescens inter cocos cocos PBG : coquos edd. vett. fueras? Fausti, adulescentis nobilissimi, paulo ante ex epulo magnificentissimo famem illam veterem tuam non expleras expleras Naugerius (1): expiares P 1 G : expiaras P 2 Σ ? quem accumbere atratum videras? dominum cum toga pulla et eius amicos ante convivium videras? Videras dominum ... convivium ( sine signo interrog. ) Madv., Mueller ? quae tanta te te hic suppl. Baiter : te tanta Hks ed. V. : tanta rell. tenuit amentia dementia s : insania Hk all. ut, nisi id fecisses quod fas non fuit, nisi violasses templum Castoris, nomen epuli, oculos civium, morem veterem, eius qui te invitarat auctoritatem, parum putares testificatum esse supplicationes te illas non putare? 
33	quaero etiam illud ex te, quod privatus admisisti, in quo certe iam tibi dicere non licebit cum clarissimis viris causam cum clarissimis viris causam P 2 B Σ G (§ 13): cum clarissimi viri causam P 1 : cum clarissimi viri causa Madv. fort. recte tuam esse coniunctam, postulatusne sis lege Licinia et Iunia? edixeritne C. Memmius praetor ex ea lege ut adesses die tricensimo tricensimo P 1 : tricesimo rell. ? cum is dies venisset, fecerisne quod in hac re publica non modo factum antea numquam est, sed est sed PB Σ G : sed Garatoni, Madv. in omni memoria est memoria est Lamb. : mem. sit ( ex memoriast) codd. omnino inauditum? appellarisne tribunos plebis ne causam diceres—levius dixi; quamquam id ipsum esset et novum et non ferendum—sed appellarisne nominatim pestem illius anni, furiam patriae, tempestatem rei publicae, Clodium Clodium secl. Bake . qui tamen cum iure, cum more, cum potestate iudicium impedire non posset, rediit ad illam vim et furorem suum, ducemque se militibus tuis praebuit. in quo ne quid a me a me s. l. P 2 dictum in te potius putes quam abs te esse quaesitum, nullum onus imponam mihi testimoni: quae mihi test. quae mihi s. l. P 2 brevi tempore ex eodem isto loco video esse dicenda servabo, teque non arguam, sed, ut in ceteris rebus feci, rogabo. 
34	quaero ex te, Vatini, num quis in hac civitate post urbem conditam tribunos plebis appellarit ne causam diceret? num quis reus in tribunal sui quaesitoris quaestoris Schol. escenderit escenderit Ang. Maius : ascenderit PBG all. ( Verr. iv, § 51): exciderit Schol. eumque vi deturbarit, subsellia dissiparit, urnas deiecerit deiecerit Schol. : delegerit P rell. , eas denique omnis res in iudicio disturbando commiserit, quarum rerum causa iudicia sunt constituta? sciasne tum fugisse Memmium, accusatores esse tuos de tuis tuorumque manibus ereptos, iudices quaestionum de proximis tribunalibus esse depulsos, in foro, luce, inspectante populo Romano quaestionem, magistratus, morem maiorum, leges, iudices, reum, poenam esse sublatam? haec omnia sciasne diligentia C. Memmi publicis tabulis esse notata atque testata? atque illud etiam quaero, cum cum Ald. : quod codd. , postea quam es postulatus, ex legatione redieris,—ne quis te iudicia defugere arbitretur arbitretur codd. : arbitraretur edd. ,— teque, cum tibi utrum velles liceret, dictitaris causam dicere maluisse, qui consentaneum fuerit, cum legationis perfugio uti noluisses, appellatione improbissima te ad auxilium nefarium confugisse? 
35	et quoniam legationis tuae facta mentio est, volo volo etiam Hks audire de te quo tandem senatus consulto legatus sis. de gestu intellego quid respondeas: tua lege, dicis. esne igitur patriae certissimus parricida? spectarasne spectarasne ks : spectarisne P rell. id, ut patres conscripti ex re publica funditus tollerentur? ne hoc quidem senatui relinquebas, quod nemo umquam ademit, ut legati ex eius ordinis auctoritate legarentur? adeone tibi sordidum consilium publicum visum est, adeo adflictus senatus, adeo misera et prostrata res publica ut non nuntios pacis ac belli, non oratores oratores Schol. : curatores P rell. , non interpretes, non bellici consili auctores, non ministros muneris provincialis senatus more maiorum deligere posset posset edd. : possit codd. ? 
36	eripueras senatui provinciae decernendae potestatem, imperatoris deligendi iudicium, aerari dispensationem: quae numquam sibi populus Romanus appetivit, qui numquam sibi p. r. ... numquam suppl. s. l. P 2 senatui senatui scripsi : a senatu Madv. : aut codd. : ut tu Orell. auct. Kays. : ad se Muell. auferre codd. : transferre Mueller (numquam haec a summi con. gub. auferre Angelius ) summi consili gubernationem auferre conatus est. age , factum est horum aliquid in aliis: raro, sed tamen factum est ut populus deligeret imperatorem: quis legatos umquam audivit sine senatus consulto? ante te nemo, post continuo fecit idem idem fecit Schol. in duobus prodigiis rei publicae Clodius; quo etiam maiore es malo mactandus, quod non solum facto tuo sed etiam exemplo rem publicam vulnerasti, neque tantum ipse es improbus sed etiam alios docere voluisti. ob hasce omnis res sciasne te severissimorum hominum Sabinorum, fortissimorum virorum Marsorum et Paelignorum, tribulium tuorum, iudicio notatum, nec post Romam conditam praeter te tribulem quemquam quemquam quem PBG all. : neminem Schol. tribum Sergiam perdidisse? 
37	atque illud etiam audire de te de te Orelli : te P rell. praeter G 2 (ex te): a te ed. R. : de te audire cod. Fris ab Halmio collatus cupio, qua re, cum ego legem de ambitu tulerim ex senatus consulto, tulerim sine vi, tulerim salvis salvis salutis PB Σ G auspiciis, tulerim salva lege Aelia et Fufia, tu eam esse legem non putes, praesertim cum ego legibus tuis, quoquo modo latae sunt sint Hks , paream; cum mea lex dilucide vetet biennio qvo qvis petat petitvrvsve sit gladiatores dare nisi ex testamento praestitvta die , quae tanta in te sit amentia ut in ipsa petitione gladiatores audeas dare? num quem putes illius tui certissimi gladiatoris similem tribunum plebis posse posse ed. Hervag. : esse codd. reperiri qui se interponat quo minus reus mea lege fias fias Lamb. : fiat codd. ? 
38	ac si haec omnia contemnis ac despicis, quod ita tibi persuaseris, ut palam dictitas, te dis hominibusque invitis amore in te incredibili quodam C. Caesaris omnia quae velis consecuturum, ecquid audieris, ecquisnam tibi dixerit C. Caesarem nuper nuper om. Schol. Aquileiae, cum de quibusdam esset mentio facta, dixisse se post dixisse add. Baiter C. Alfium praeteritum permoleste tulisse, quod in homine summam fidem probitatemque cognosset, graviterque etiam se ferre praetorem aliquem esse factum qui a suis rationibus dissensisset; tum quaesisse quendam, de Vatinio quem ad modum ferret; illum illum Schol. : ipsum (ipse) codd. respondisse Vatinium in tribunatu gratis nihil fecisse; qui omnia in pecunia posuisset honore animo aequo carere debere. 
39	quod si ipse, qui te suae dignitatis augendae causa, periculo tuo, nullo suo delicto, ferri praecipitem est facile passus, tamen te omni honore indignissimum iudicat, si te vicini, si adfines, si tribules ita oderunt ut repulsam tuam triumphum suum duxerint, si nemo aspicit quin ingemescat ingemescat P 1 : ingemiscat rell. ( Sest. § 146) , nemo mentionem facit quin exsecretur, si vitant, fugiunt, audire de te nolunt, cum viderunt, tamquam auspicium malum detestantur, si cognati respuunt, tribules exsecrantur, vicini metuunt, adfines erubescunt, strumae denique ab ore improbo demigrarunt et aliis iam se locis conlocarunt, si es odium publicum populi, senatus, universorum hominum rusticanorum urbanorum add. post rusticanorum Madvig, improb. Zielinsk. : rusticanorum om. Hs ,—quid est quam ob rem praeturam potius exoptes quam mortem, praesertim cum popularem te velis esse neque ulla re populo gratius facere possis? 
40	sed ut aliquando audiamus quam copiose mihi ad rogata respondeas, concludam iam interrogationem meam teque in extremo pauca de ipsa causa rogabo. quaero quae tanta in te vanitas, tanta levitas fuerit ut in hoc iudicio T. Annium isdem verbis laudares quibus eum verbis laudare et boni viri et boni cives consuerunt, cum in eundem nuper ab eadem illa taeterrima furia productus ad populum cupidissime falsum testimonium dixeris? an erit haec optio et potestas tua, ut, cum Clodianas operas et facinerosorum facinerosorum P : facinoros. B rell. ( Cf. Sest. § 81) hominum et perditorum manum videris, Milonem dicas, id quod in contione dixisti, gladiatoribus et bestiariis obsedisse rem publicam: cum autem ad talis viros veneris, non audeas civem singulari virtute, fide, constantia vituperare? 
41	sed cum T. Annium tanto opere laudes et clarissimo viro non nullam laudatione tua labeculam adspergas—in illorum enim numero mavult T. Annius esse qui a te vituperantur: verum tamen quaero verum tamen quaero Lamb. : verum etiamen quaero P 1 : verum etiam in quaero P 2 B Σ : verum etiam inquiro (quaero k ) G 2 k , cum in in om. Schol. re publica administranda T. Annio cum P. Sestio consiliorum omnium omnium om. Schol. societas fuerit —id quod non solum bonorum, verum etiam improborum iudicio declaratum est; est enim reus uterque ob eandem causam et eodem crimine, alter die dicta ab eo quem tu unum improbiorem esse quam te non non add. ed. Hervag. numquam soles confiteri, alter tuis consiliis, illo tamen adiuvante—quaero qui possis eos quos crimine coniungis testimonio diiungere? extremum illud est quod mihi abs te responderi velim, cum multa in Albinovanum de praevaricatione diceres, dixerisne nec tibi placuisse nec oportuisse Sestium de vi reum fieri? quavis lege, quovis crimine accusandum potius fuisse? etiam illud dixeris, causam Milonis, fortissimi viri, coniunctam cum hoc existimari? quae pro me a Sestio facta sint, bonis esse grata? non coarguo inconstantiam orationis ac testimoni tui—quas enim huius actiones probatas bonis esse dicis, in eas plurimis verbis testimonium dixisti; quicum autem autem PB Σ : hoc G ( Sest. § 138; Balb. § 41) eius causam periculumque coniungis coniungis edd. : coniungas PBG Σ , eum summis laudibus extulisti: sed hoc quaero, num P. Sestium, qua lege accusandum omnino fuisse negas, ea lege condemnari putes oportere? aut, si te in testimonio consuli noles, ne quid tibi auctoritatis a me tributum esse videatur, dixerisne in eum testimonium de vi quem negaris negaveris Schol. ( Sest. § 61) reum omnino de vi fieri debuisse? 
