5.43	quis tum nobis, quis populo Romano obtulit hunc divinum adulescentem deus? qui, cum omnia ad perniciem nostram pestifero illi civi paterent, subito praeter spem omnium exortus prius confecit exercitum quem furori M. Antoni opponeret quam quisquam hoc eum cogitare suspicaretur. Magni honores habiti Cn. Pompeio, cum esset adulescens, et quidem iure. subvenit enim enim ed. R : etiam V rei publicae, sed aetate multo robustior et militum ducem quaerentium studio paratior paratior Poggius : partior V : paratiore Halm et in alio genere belli. non enim omnibus Sullae causa grata. declarat multitudo proscriptorum, tot municipiorum maximae calamitates.
5.44	Caesar autem annis multis minor veteranos cupientis iam requiescere armavit; eam complexus est causam quae esset senatui, quae populo, quae cunctae Italiae, quae dis hominibusque hominibusque Faernus : omnibusque V gratissima. et Pompeius ad L. Sullae maximum imperium victoremque exercitum accessit: Caesar se ad neminem adiunxit, ipse princeps exercitus faciendi et praesidi comparandi fuit. ille ille Ferrarius : ille in V adversariorum partibus agrum Picenum habuit inimicum: hic ex Antoni amicis sed amicioribus libertatis libertati ed. R contra Antonium confecit exercitum. illius opibus Sulla regnavit: huius praesidio Antoni dominatus oppressus est.
5.45	demus igitur imperium Caesari sine quo res militaris administrari, teneri exercitus, bellum geri non potest: sit pro praetore sit pro praetore Ferrarius : et pro pop. R. V eo iure quo qui optimo. qui honos quamquam est magnus illi aetati illi aetati Poggius : illa aetati V : illa aetate Graevius , tamen ad necessitatem rerum gerendarum, non solum ad dignitatem valet. itaque illa quaeramus quae vix hodierno die consequemur. sed saepe spero fore huius adulescentis ornandi ornandi coni. Müller : hortandi honorandi V1 (-que add. V2 ): honorandi Halm et nobis et populo Romano potestatem; 
5.46	hoc autem tempore ita censeo decernendum: ‘quod C. Caesar, Gai filius, pontifex, pro praetore, summo rei publicae tempore milites veteranos ad libertatem populi Romani cohortatus sit eosque conscripserit, quodque legio Martia quartaque quartaque Poggius : q. quarta V : atque quarta Halm summo studio optimoque in rem publicam consensu C. Caesare duce et auctore rem publicam, libertatem populi Romani defendant, defenderint, et quod C. Caesar pro praetore Galliae provinciae cum exercitu subsidio profectus sit, equites, sagittarios, elephantos in suam populique Romani potestatem redegerit, difficillimoque rei publicae tempore saluti dignitatique populi Romani subvenerit, ob eas causas senatui placere, C. Caesarem, Gai filium, pontificem, pro praetore, senatorem esse sententiamque loco praetorio praetorio Naugerius (1): pr. Poggius : populi R. V : quaestorio Nipperdey dicere, eiusque rationem, quemcumque magistratum magistratum Faernus : mac V petet petet V : appetet V2 peteret Schütz , ita haberi ut haberi per leges ut haberi per leges Faernus : per ut haberi leges V : prout haberi lege Orelli liceret, si anno superiore quaestor quaestor V : praetor Vrsinus fuisset.’ quid est enim, 
5.47	patres conscripti, cur eum non quam primum amplissimos honores capere cupiamus? legibus enim annalibus cum grandiorem aetatem ad consulatum constituebant, adulescentiae temeritatem verebantur: C. Caesar ineunte aetate docuit ab excellenti eximiaque virtute progressum aetatis exspectari non oportere. itaque maiores nostri veteres illi admodum antiqui leges annalis non habebant, quas multis post annis attulit ambitio, ut gradus essent esset Mommsen petitionis inter aequalis. ita saepe magna indoles virtutis, prius quam rei publicae prodesse potuisset, exstincta est est Faernus : sunt V .
5.48	at vero apud antiquos Rulli, Decii, Corvini Corvi Pighius multique alii, recentiore autem memoria superior Africanus, T. Flamininus Flaminius V, Cus. : corr. Faernus admodum adulescentes consules facti tantas res gesserunt ut populi Romani imperium auxerint populus Romanus ... auxerit V, Cus. : corr. Poggius , nomen ornarint ornarit Cus. . quid ? Macedo Alexander, cum ab ineunte aetate res maximas gerere coepisset, nonne tertio et tertio et xxx V tricesimo anno mortem obiit? quae est aetas nostris legibus decem annis minor quam consularis. ex quo iudicari potest virtutis virtutis V2 : virtus V1, Cus. esse quam aetatis cursum celeriorem. nam quod ei qui Caesari invident simulant se timere, ne ne Poggius : non V verendum quidem est ut tenere se possit, ut moderari, ne honoribus nostris elatus intemperantius suis opibus utatur.
5.49	ea natura rerum est, patres conscripti, ut qui sensum verae gloriae ceperit quique se ab senatu, ab equitibus Romanis populoque Romano universo senserit civem carum carum Ferrarius : clarum V ( cf. 1. 35) haberi salutaremque rei publicae, nihil cum hac gloria comparandum putet. Vtinam C. Caesari, patri dico, contigisset adulescenti ut esset senatui atque optimo cuique carissimus clarissimus Cus. ! quod cum consequi neglexisset, omnem vim ingeni, quae summa fuit in illo, in populari levitate consumpsit. itaque cum respectum ad senatum et ad bonos non haberet, eam sibi viam ipse patefecit ad opes suas amplificandas quam virtus liberi populi ferre non posset. eius autem fili longissime diversa ratio est: qui cum omnibus carus carus suppl. Muretus est, tum optimo cuique carissimus. in hoc spes libertatis posita est; ab hoc accepta iam salus; huic summi honores et exquiruntur et parati sunt.
5.50	cuius igitur singularem prudentiam admiramur, eius stultitiam timemus? quid enim stultius quam inutilem potentiam, invidiosas opes, cupiditatem dominandi praecipitem et lubricam anteferre verae, gravi, solidae gloriae? an hoc vidit puer: si aetate processerit, non videbit? ‘ at est quibusdam inimicus clarissimis atque optimis civibus.’ nullus iste timor esse debet. omnis Caesar inimicitias rei publicae condonavit; hanc sibi iudicem constituit, hanc moderatricem omnium consiliorum consiliorum suppl. Halm hoc loco ( cf. x. 20 et 23), ante omnium Faernus atque factorum. ita enim ita enim ut enim V : ita enim animatus coni. Müller ad rem publicam accessit ut eam confirmaret, non ut everteret. omnis habeo cognitos sensus adulescentis. nihil est illi re publica carius, nihil vestra auctoritate gravius, nihil bonorum virorum iudicio optatius, nihil vera gloria dulcius.
5.51	quam ob rem ab eo non modo nihil timere sed maiora et meliora exspectare debetis, neque in eo qui ad D. Brutum obsidione liberandum profectus sit timere ne memoria maneat domestici doloris quae plus apud eum possit quam salus civitatis. audeo audeo Halm : audebo V ( sed -ebo in ras. m. 2) etiam obligare fidem meam, patres conscripti, vobis populoque Romano reique publicae; quod profecto, cum me nulla vis cogeret, facere non auderem pertimesceremque in maxima re periculosam opinionem temeritatis post temeritatis aliquid intercidisse putat Ernesti, velut nisi eum plane perspectum haberem . promitto , recipio, spondeo, patres conscripti, C. Caesarem talem semper fore civem qualis hodie sit sit est coni. Halm qualemque eum maxime velle esse et optare debemus.
5.52	quae cum ita sint, de Caesare satis hoc tempore dictum habebo. nec vero de L. Egnatuleio, fortissimo et constantissimo civi amicissimoque rei publicae, silendum arbitror; sed tribuendum testimonium virtutis egregiae, quod is legionem quartam ad Caesarem adduxerit, quae praesidio consulibus, senatui populoque Romano reique publicae esset: ob eam causam placere uti L. Egnatuleio triennio triennium V : corr. Lambinus ante legitimum tempus magistratus magistratus Poggius : magna V : magistratum Halm petere, capere, gerere liceat. in quo, patres conscripti, non tantum commodum tribuitur L. Egnatuleio quantus honos: in tali enim re satis est nominari.
5.53	de exercitu autem C. Caesaris ita censeo decernendum: ‘senatui placere, militibus veteranis qui Caesaris pontificis pro praetore pro praetore suppl. Lambinus auctoritatem secuti libertatem populi Romani auctoritatem ... Romani suppl. Garatom ex iii. 37 auctoritatemque huius ordinis defenderint atque defendant ipsis ipsis coni. Müller : iis V liberisque eorum militiae vacationem esse, utique C. Pansa A. Hirtius consules, alter ambove alter ambove ( ita Poggius ) si eis videretur Vrsinus Poggium secutus : aa. uesieu V1 : aa. designati V2 , si eis videretur, cognoscerent qui ager eis coloniis esset quo milites veterani deducti essent, qui contra legem Iuliam possideretur, ut is militibus veteranis divideretur; de agro Campano separatim cognoscerent inirentque rationem de commodis militum veteranorum augendis, legionique Martiae et legioni quartae et eis militibus qui de legione secunda, tricesima quinta ad C. Pansam A. Hirtium consules venissent suaque nomina edidissent, quod eis auctoritas senatus populique Romani libertas carissima sit et fuerit, vacationem militiae ipsis liberisque eorum esse placere extra tumultum Gallicum Italicumque: easque legiones bello confecto missas fieri placere; quantamque pecuniam militibus earum legionum in singulos C. Caesar, pontifex, pro praetore pro praetore d : populo Romano V : del. Poggius pollicitus sit, tantam dari placere; utique C. Pansa A. Hirtius consules, alter ambove, si eis videretur, rationem agri haberent qui sine iniuria privatorum dividi posset haberent ... posset Schütz : habent ... possit V : habeant ... possit Poggius , eisque militibus, legioni Martiae et legioni quartae ita darent, adsignarent ut quibus militibus amplissime dati, adsignati essent.’ dixi ad ea omnia, consules, de quibus rettulistis: quae si erunt sine mora matureque decreta, facilius apparabitis ea quae tempus et necessitas flagitat. celeritate autem opus est: qua si essemus usi, bellum, ut saepe dixi, nullum haberemus.
6.1	audita vobis esse arbitror, Quirites, quae sint acta in senatu, quae fuerit cuiusque sententia. res enim ex Kalendis Ianuariis agitata paulo ante confecta est, minus quidem illa illa quidem coni. Müller severe quam decuit, non tamen omnino dissolute. mora est adlata bello, non causa sublata. quam ob rem, quod quaesivit ex me P. Apuleius, homo et multis officiis mihi et summa familiaritate coniunctus et vobis amicissimus, ita respondebo ut ea quibus non interfuistis nosse possitis. causa fortissimis optimisque consulibus Kalendis Ianuariis de re publica primum referendi fuit ex eo quod a. d. a. d. suppl. Orelli xiii . Kalendas Ianuarias senatus me auctore decrevit.
6.2	eo die primum, Quirites, fundamenta sunt iacta sunt iacta Garatoni : sunt iacta sunt V : iacta sunt Poggius rei publicae: fuit enim longo intervallo ita liber senatus ut vos aliquando liberi essetis. quo quidem tempore, etiam si ille dies vitae finem mihi adlaturus esset, satis magnum ceperam fructum, cum vos universi una mente atque voce iterum a me conservatam esse rem publicam conclamastis. hoc vestro iudicio tanto tamque praeclaro excitatus ita Kalendis Ianuariis veni in senatum ut meminissem quam personam impositam a vobis sustinerem. itaque bellum nefarium inlatum rei publicae cum viderem, nullam moram interponendam insequendi M. Antonium M. Antoni coni. Müller putavi, hominemque audacissimum qui multis nefariis rebus ante commissis hoc tempore imperatorem populi Romani oppugnaret, coloniam vestram fidissimam fortissimamque obsideret, bello censui persequendum: tumultum esse decrevi decerni ed. R ; iustitium edici, saga sumi dixi placere, quo omnes acrius graviusque incumberent ad ulciscendas rei publicae iniurias, si omnia gravissimi belli insignia suscepta a senatu viderent.
6.3	itaque haec sententia, Quirites Quirites Faernus : quam V , sic per triduum valuit ut, quamquam discessio facta non esset non esset fort. non est ( variam lectionem non est add. V1 post dies) , tamen praeter paucos omnes homines omnes V mihi adsensuri viderentur. hodierno autem die spe nescio qua eis obiecta die, spe nescio qua eis obiecta Jeep (pacis pro eis Bücheler ): dies non est pene. scio quaeis obiectarem V : die nescio qua obiecta re Poggius remissior senatus fuit. nam plures eam sententiam secuti sunt ut, quantum senatus auctoritas vesterque vestraeque V : corr. Poggius consensus apud Antonium valiturus esset, per legatos experiremur. intellego , Quirites, a vobis hanc sententiam repudiari, neque iniuria. ad quem enim legatos? ad eumne qui pecunia publica dissipata atque effusa per vim et contra auspicia impositis rei publicae legibus, fugata contione, obsesso senatu, ad opprimendam rem publicam Brundisio legiones arcessierit accerserit V : cf. Neue iii. p. 393 ; ab eis relictus cum latronum manu in Galliam inruperit, Brutum oppugnet, Mutinam circumsedeat? quae vobis potest cum hoc gladiatore condicionis, aequitatis, legationis esse communitas?
6.4	quamquam , Quirites, non est illa legatio, sed denuntiatio denuntiatione V : corr. Poggius belli, nisi paruerit: ita enim est decretum ut si legati ad Hannibalem mitterentur. mittuntur enim qui nuntient denuntient Pluygers ne oppugnet consulem designatum, ne Mutinam obsideat, ne provinciam depopuletur, ne dilectus habeat, sit in senatus populique Romani potestate. facile vero huic denuntiationi parebit, ut in patrum conscriptorum atque in vestra potestate sit qui in sua numquam fuerit! quid enim enim om. Cus. ille umquam arbitrio suo suo om. Cus. fecit? semper eo tractus est est Halm : et V quo libido rapuit, quo levitas, quo furor, quo vinolentia violentia codd. Ferrarii ( cf. § 6 et ii. 68) ; semper eum duo dissimilia genera tenuerunt, lenonum et latronum; ita domesticis stupris, forensibus parricidiis delectatur ut mulieri citius avarissimae paruerit quam senatui populoque Romano.
6.5	itaque , quod paulo ante feci in senatu, faciam apud vos. testificor , denuntio, ante praedico nihil M. Antonium eorum quae sunt legatis mandata facturum; vastaturum agros, Mutinam obsessurum, dilectus qua possit habiturum. is est enim ille qui semper senatus iudicium et auctoritatem, semper voluntatem vestram potestatemque contempserit. an ille id faciat quod paulo ante decretum est, ut exercitum citra flumen Rubiconem Rubiconem in mg. hic habet V, sed infra § 10, ubi hic locus iterum legitur, in textu , qui finis est Galliae, educeret, dum ne propius urbem Romam cc milia admoveret? huic denuntiationi ille pareat, ille se fluvio Rubicone et et Faernus : om. V in ras. cc milibus circumscriptum esse patiatur?
6.6	non is est Antonius; nam si esset, non commisisset ut ei senatus tamquam Hannibali initio belli Punici denuntiaret ne oppugnaret Saguntum. quod vero ita avocatur a Mutina ut ab urbe tamquam pestifera flamma arceatur, quam habet ignominiam, quod iudicium senatus! quid, quod a senatu dantur mandata legatis ut D. Brutum milites que militesque Poggius : que V eius adeant eisque demonstrent summa suma V in rem publicam merita beneficiaque eorum grata esse senatui populoque Romano eisque eam rem magnae laudi magnoque honori fore? passurumne censetis Antonium introire Mutinam legatos, exire inde tuto? numquam patietur, mihi credite. Novi violentiam violentiam Naugerius (1): vinolentiam V , novi impudentiam, novi audaciam.
6.7	nec vero de illo sicut de homine aliquo debemus, sed ut de importunissima belua cogitare. quae cum ita sint, non omnino dissolutum est quod decrevit senatus: habet atrocitatis aliquid legatio: utinam nihil haberet morae! nam cum plerisque in rebus gerendis tarditas et procrastinatio odiosa est, tum hoc bellum indiget celeritatis. succurrendum est D. Bruto, omnes undique copiae conligendae; moram exhibere ullam moram exhibere ullam Vrsinus : horam exhibere nullam V : curam exhibere nullam Hirschfelder : horam eximere nullam Budaeus in tali cive liberando sine scelere non possumus.
6.8	an ille non potuit, si Antonium consulem, si Galliam Antoni provinciam iudicasset, legiones Antonio et provinciam tradere, domum redire, triumphare, primus in hoc ordine, quoad magistratum iniret, sententiam dicere?
6.9	quid negoti fuit? sed cum se Brutum esse meminisset vestraeque libertati natum, non otio suo, quid egit aliud nisi ut paene corpore suo Gallia prohiberet Antonium? ad hunc utrum legatos an legiones ire oportebat? sed praeterita omittamus: properent legati, quod video esse facturos; vos saga parate. est enim ita decretum ut, si ille auctoritati senatus senatu V : senati coni. Halm non paruisset, ad saga iretur. Ibitur; non parebit: nos amissos tot dies rei gerendae queremur. non metuo, Quirites Quirites Poggius : quam V , ne, cum audierit Antonius, me hoc et in senatu et in contione confirmasse, numquam illum futurum in senatus potestate, refellendi mei causa, ut ego nihil vidisse videar, vertat se et senatui pareat. numquam faciet; non invidebit huic meae gloriae; malet me sapientem a vobis quam se modestum existimari.
6.10	quid ? ipse si velit, num etiam Lucium fratrem passurum arbitramur? nuper quidem dicitur ad Tibur, ut opinor, cum ei labare M. Antonius videretur, mortem fratri esse minitatus. etiamne ab hoc myrmillone Asiatico senatus mandata, legatorum verba audientur? nec enim secerni a fratre poterit, tanta praesertim auctoritate. nam hic inter illos Africanus est: pluris habetur quam L. Trebellius, pluris quam T. Plancus In V post Plancius ( sic ) legitur in ras. uidete quan decertum est, tum ex § 5 repet. ut exercitum ... pareat ( del. m. 2). Voc. decertum = decretum (§ 5): ceterae corruptelae ex ante ( cf. § 5) et quidem ( quod l. 3 ante qui inserui ) ortae sunt (te + an = ante, uide + qu = quidem, cf. viii. 5) quam Extitius Faernus ( cf. xiii. 28): cum (tum V2 ) exiluerit V , quam Extitius, adolescens nobilis. Plancum quidem, qui omnibus sententiis maximo vestro plausu condemnatus nescio quo modo se coniecit in turbam atque ita maestus rediit ut retractus, non reversus videretur, sic contemnit tamquam si illi aqua et igni interdictum sit: aliquando negat ei locum esse oportere in curia qui incenderit curiam.
6.11	nam Trebellium valde iam diligit: oderat tum, cum ille tabulis novis adversabatur; iam fert in oculis, postea quam ipsum Trebellium Trebellium del. Orelli vidit sine tabulis novis salvum esse non posse. audisse enim vos arbitror, Quirites, quod etiam videre potuistis, cotidie sponsores et creditores L. Trebelli convenire. O fide Fide Pluygers : fides V !—hoc hoc hinc Poggius enim opinor Trebellium sumpsisse cognomen—quae potest esse maior fides quam fraudare creditores, domo profugere, propter aes alienum ire ad arma? Vbi plausus ille in triumpho est, saepe ludis, ubi aedilitas delata summo studio bonorum? quis est qui hunc non casu existimet recte fecisse, nequitia sceleste nequitia est scelere (= scelestere) V : corr. Nipperdey .
6.12	sed redeo ad amores deliciasque vestras, L. Antonium, qui vos omnis in fidem suam recepit. negatis ? num quisnam est vestrum qui tribum non habeat? certe nemo. atqui illum quinque et triginta tribus patronum adoptarunt. rursus reclamatis? aspicite illam a sinistra equestrem statuam inauratam, in qua quid inscriptum est? ‘ Qvinqve et triginta tribvs patrono. ’ populi Romani igitur est patronus L. Antonius. malam quidem illi pestem! clamori enim vestro adsentior. non modo hic latro quem clientem habere nemo velit sed quis umquam tantis opibus, tantis rebus gestis fuit qui se populi Romani victoris dominique omnium gentium patronum dicere auderet?
6.13	in foro L. Antoni statuam videmus, sicut illam Q. Tremuli Tremuli Beroaldus : Tremelli V , qui Hernicos devicit, ante Castoris. O impudentiam incredibilem! tantumne sibi sumpsit, quia Mylasis myrmillo Thraecem iugulavit, familiarem suum? quonam modo istum ferre possemus, si in hoc foro spectantibus vobis depugnasset? sed haec una statua. altera ab ab suppl. ed. Cratandrina equitibus Romanis equo publico: qui item ascribunt, ‘ patrono .’ quem umquam iste ordo patronum adoptavit? si quemquam, debuit me. sed me omitto; quem censorem, quem imperatorem? agrum eis divisit. O sordidos qui acceperint acceperint Ernesti : acceperunt V , improbum qui dederit dedit Zielinski !
6.14	statuerunt etiam tribuni militares qui in exercitu Caesaris bis bis Garatoni : duobus V : iterum Orelli fuerunt. quis est iste ordo? multi fuerunt multis in legionibus per tot annos. Eis quoque divisit Semurium Remurium Ferrarius . campus Martius restabat, nisi prius cum fratre fugisset. sed haec agrorum adsignatio paulo ante, Quirites, L. Caesaris, clarissimi viri et praestantissimi senatoris, sententia dissoluta est: huic enim adsensi vii virum acta sustulimus. iacent beneficia Nuculae; friget patronus Antonius. nam possessores animo aequiore discedent: nullam impensam fecerant; nondum instruxerant, partim quia non confidebant, partim quia non habebant.
6.15	sed illa statua palmaris de qua, si meliora tempora essent, non possem sine risu dicere: L. Antonio a Iano medio patrono. itane ? iam itane? Iam Halm : ita in eam V : itane Gellius i. 16. 5 Ianus medius in L. Antoni clientela est est Gellius : sit V ? quis umquam qui umquam V1 et Macrobius i. 5. 5 in illo Iano inventus est qui L. Antonio mille nummum ferret expensum? sed nimis multa de nugis: ad causam bellumque redeamus; quamquam non alienum fuit personas quasdam a vobis recognosci, ut quibuscum bellum gereretur possetis taciti cogitare. ego autem vos hortor, Quirites, ut, etiam si melius aliud fuit, tamen legatorum reditum exspectetis animo aequo. celeritas detracta de causa est; boni tamen aliquid accessit ad causam.
6.16	cum enim legati renuntiarint quod certe renuntiabunt, non in vestra potestate, non in senatus esse Antonium, quis erit tam improbus civis qui illum civem habendum putet? nunc enim sunt pauci illi quidem, sed tamen plures quam re publica dignum est, qui ita loquantur: ‘ ne legatos quidem exspectabimus?’ istam certe vocem simulationemque clementiae extorquebit istis res ipsa publica fort. ipsa res publica ( clausulae gratia ) . quo etiam, ut confitear vobis, Quirites, minus hodierno die contendi, minus laboravi, ut mihi senatus adsentiens tumultum decerneret, saga sumi iuberet. malui viginti diebus post sententiam meam laudari ab omnibus quam a paucis hodie vituperari.
6.17	quapropter , Quirites, exspectate legatorum reditum et paucorum dierum molestiam devorate. qui cum redierint, si pacem adferent, cupidum me; si bellum, providum iudicatote. an ego ego fort. ante cogitem transponendum ( clausulae gratia ) non provideam meis civibus, non dies noctesque de vestra libertate, de rei publicae salute cogitem? quid enim non debeo vobis, Quirites, quem vos a se ortum hominibus nobilissimis omnibus honoribus praetulistis? an ingratus sum? quis minus? qui partis honoribus eosdem in foro gessi labores quos petendis. rudis in re publica? quis exercitatior exercitatior Poggius : excitatior V ? qui viginti iam annos bellum geram cum impiis civibus. quam ob rem.
6.18	Quirites, consilio quantum potero, labore plus paene quam potero, excubabo vigilaboque pro vobis. etenim quis est civis, praesertim hoc gradu quo me vos esse voluistis, tam oblitus benefici vestri, tam vestri tam om. Cus. immemor patriae, tam tam om. Cus. dignitati Cobet : dignitatis V inimicus dignitati suae quem non excitet, non inflammet tantus vester iste consensus? multas magnasque habui consul contiones, multis interfui: nullam umquam umquam hic rursus pergunt D vidi tantam quanta nunc vestrum vestra nst, Reid ( cf. iv. 1) est. Vnum sentitis omnes, unum studetis, M. Antoni conatus conatus Poggius : conatur V : conatum D avertere a re publica, furorem exstinguere, opprimere audaciam. idem volunt omnes ordines; eodem incumbunt municipia, coloniae, cuncta Italia. itaque senatum bene sua sponte firmum firmiorem vestra auctoritate fecistis.
6.19	venit tempus, Quirites Quirites om. D , serius omnino quam dignum populo Romano fuit, sed tamen dignum re p. fuisset tamen D ita maturum ut differri iam hora horam o, ut voluit Graevius non possit. fuit aliquis fatalis casus, ut ita dicam, quem tulimus, quoquo modo ferendus fuit: nunc si quis erit, erit voluntarius. populum Romanum servire fas non est, quem di immortales omnibus gentibus gentibus om. D imperare voluerunt. res in extremum est adducta discrimen; de libertate decernitur. aut vincatis oportet, Quirites, quod profecto et pietate vestra et tanta concordia consequemini consequamini V , aut quidvis potius quam serviatis. Aliae nationes servitutem pati possunt, populi Romani est res est D propria libertas.
7.1	parvis de rebus sed fortasse necessariis consulimur, patres conscripti. de Appia via et de Moneta consul, de Lupercis tribunus plebis refert. quarum rerum etsi facilis explicatio videtur, tamen animus aberrat a sententia suspensus curis suspensus a curis Nonius p. 386 maioribus. adducta est enim, patres conscripti, res in maximum periculum et in extremum paene discrimen. non sine causa legatorum istam istam om. V missionem semper timui, numquam probavi: quorum reditus quid sit adlaturus ignoro; exspectatio quidem quantum adferat languoris animis quis non videt? non enim se tenent ei qui senatum dolent ad auctoritatis pristinae spem revirescere reviviscere D , coniunctum huic ordini populum Romanum, conspirantem Italiam, paratos exercitus, expeditos duces.
7.2	iam nunc fingunt responsa Antoni eaque defendunt. Alii postulare illum ut omnes exercitus dimittantur. scilicet legatos ad eum misimus, non ut pareret et dicto et dicto V : edicto D audiens esset huic ordini, sed ut condiciones ferret, leges imponeret leges imponeret om. D , reserare nos exteris gentibus Italiam iuberet, se praesertim incolumi a quo maius periculum quam ab ullis nationibus extimescendum est.
