2.93	Vbi est septiens miliens quod est in est in V : in D tabulis quae sunt ad Opis Opis patebat D ? funestae illius quidem pecuniae, sed tamen quae nos quae nos post redd. hab. D , si eis quorum erat non redderetur, a tributis posset vindicare. tu autem quadringentiens sestertium quod Idibus Martiis debuisti quonam modo ante Kalendas Aprilis debere desisti ubi est ... desisti post § 96 acta defendimus transposuit Nägelsbach ? sunt ea quidem innumerabilia sunt ea ... defendimus (§ 96) om. D : ante sunt ea hab. V ( e § 97) quid ego de commentaris Caesaris infinitos quiden numerabilibus cyrigraphis Caesaris loquar ( sic ) quae a tuis a tuis Faernus : ad ius V : a diversis Poggius emebantur non insciente te, sed unum egregium de rege Deiotaro, populi Romani amicissimo, decretum in Capitolio fixum: quo proposito nemo erat qui in ipso dolore risum posset continere.
2.94	quis enim cuiquam inimicior quam Deiotaro Caesar? aeque atque huic ordini, ut equestri, ut Massiliensibus, ut omnibus quibus rem publicam populi Romani caram esse sentiebat. igitur is igitur V2 a quo vivo nec praesens nec absens rex Deiotarus quicquam aequi boni impetravit impetravit Poggius : imperavit V , apud mortuum apud eum mortuum Ernest gratiosus Vbaldinus : gratus V factus est gratiosus. compellarat hospitem praesens, computarat pecuniam pecuniam impetrarat add. V, ego delevi, videtur varia lectio e l. 2 migrasse (computarat, pecuniam imperarat Poggius ) , in eius tetrarchia tetrarchiam Poggius unum ex Graecis comitibus suis conlocarat, Armeniam abstulerat a senatu datam. haec vivus eripuit, reddit reddidit Poggius mortuus.
2.95	at quibus verbis? modo aequum sibi videri, modo non iniquum. mira verborum complexio! at ille numquam—semper enim absenti adfui Deiotaro— quicquam sibi quod nos pro illo postularemus aequum dixit videri. syngrapha sesterti centiens per legatos, viros bonos, sed timidos et imperitos, sine nostra sine nostra Muretus : sinestra V : sine sua Poggius : sine Sexti Ferrarius ( cf. Att. xvi. 3.6) , sine reliquorum hospitum regis sententia facta in gynaecio est est Halm : et V : del. Poggius , quo in loco plurimae res venierunt et veneunt. qua ex syngrapha quid sis acturus meditere censeo: rex enim ipse sua sponte, nullis commentariis Caesaris, simul atque audivit eius interitum, suo Marte res suas recuperavit.
2.96	sciebat homo sapiens ius semper hoc fuisse ut, quae tyranni eripuissent, ea tyrannis interfectis ei quibus erepta essent recuperarent. nemo igitur iure iure Poggius : iureis V consultus, ne iste quidem, qui tibi uni est iure consultus, per quem haec agis, ex ista syngrapha deberi dicet dicet Halm : dicit V pro eis rebus quae erant ante syngrapham recuperatae. non enim a te emit, sed prius quam tu suum sibi venderes ipse possedit. ille vir fuit; nos quidem contemnendi qui auctorem actorem Koch odimus, acta defendimus.
2.97	quid ego de commentariis infinitis, quid de innumerabilibus chirographis loquar? quorum etiam institores institores Pantagathus : imitatores VD sunt qui ea tamquam gladiatorum libellos palam venditent. itaque tanti acervi nummorum apud istum construuntur ut iam expendantur, non numerentur pecuniae. at quam caeca avaritia est! nuper fixa tabula est qua civitates locupletissimae Cretensium vectigalibus vectigalibus om D liberantur, statuiturque ne post M. Brutum pro consule pro consule Halm : pro cons. (cos. V ) codd. sit Creta provincia. tu mentis mentis es V2D compos, tu non constringendus? an an Naugerius (1): in codd., fort. num Caesaris decreto Creta post M. Bruti decessum potuit liberari, cum Creta nihil ad Brutum Caesare vivo pertineret? at huius venditione decreti—ne nihil actum putetis—provinciam Cretam perdidistis. omnino nemo ullius rei fuit emptor cui defuerit defuit V hic venditor.
2.98	et de exsulibus legem quam fixisti Caesar tulit? nullius insector calamitatem: tantum queror, primum eorum reditus inquinatos inquinatos aequatos Camerarius quorum causam Caesar dissimilem dissimilem Caesar D iudicarit; deinde nescio cur non reliquis reliquis non D idem tribuas: neque enim plus quam tres aut quattuor reliqui sunt. qui simili in calamitate sunt calamitate sunt Faernus : calamitates at V : calamitate fuerint D , cur tua misericordia non simili fruuntur, cur eos habes in loco patrui? de quo ferre, cum de reliquis ferres, noluisti: quem etiam ad censuram petendam impulisti, eamque petitionem comparasti quae et risus hominum et querelas moveret. cur autem ea comitia non habuisti?
2.99	an quia an quia D : aut qua V fulmen sin. D tribunus plebis sinistrum fulmen nuntiabat? cum cum om. cns tua quid interest, nulla auspicia sunt; cum cum om. D tuorum, tum fis sis D religiosus. quid ? eundem in vii viratu septem viratu codd., ita fere semper, sed v. 33, vii. virum hab. V eui Madvig : cũ V : quem D nonne destituisti? intervenit enim cui metuisti, credo, ne salvo capite negare non posses. omnibus eum contumeliis onerasti quem patris loco, si ulla in te pietas esset, colere debebas. filiam eius, sororem tuam, eiecisti, alia condicione quaesita et ante perspecta. non est satis: probri insimulasti pudicissimam feminam. quid est quod addi possit? contentus eo non fuisti: frequentissimo senatu Kalendis Ianuariis sedente patruo hanc tibi esse cum Dolabella causam odi dicere ausus es ausus dicere es D quod ab eo sorori et uxori tuae stuprum esse oblatum oblatum esse ns, ed. R comperisses. quis interpretari potest, impudentiorne qui in senatu, an improbior qui in Dolabellam, an impurior qui patre patre D et Priscian. K. ii. p. 93: patruo V, Cus. audiente, an crudelior qui in illam miseram tam spurce, tam impie dixeris.
2.100	sed ad chirographa redeamus. quae tua tua post fuit habent D fuit cognitio? Acta enim Caesaris pacis causa confirmata sunt a senatu: quae quidem Caesar egisset, non ea quae quaeque V egisse gessisse V Caesarem dixisset Antonius. Vnde ista erumpunt, quo auctore proferuntur? si sunt falsa, cur probantur? si vera, cur veneunt? at sic placuerat ut ex ut ex D : om. V : ut Muretus Kalendis Iuniis de Caesaris actis cum consilio cognosceretis. quod fuit consilium, quem umquam convocasti advocasti D , quas Kalendas Iunias exspectasti? an eas ad quas te peragratis veteranorum coloniis stipatum armis rettulisti? O praeclaram illam percursationem tuam mense Aprili atque Maio, tum cum etiam Capuam coloniam coloniam om. D deducere conatus es! quem ad modum illinc abieris illinc abieris Faernus : illĩ cauieris V : illam adieris D vel potius paene non abieris abieris Faernus : habueris V : adieris D scimus.
2.101	cui tu urbi minitaris. Vtinam conere, ut aliquando illud ‘paene’ tollatur! at quam nobilis est tua nobilitata sit tua D illa peregrinatio! quid prandiorum apparatus, quid furiosam vinolentiam tuam proferam? tua ista detrimenta sunt, illa nostra: agrum Campanum, qui cum de vectigalibus eximebatur ut militibus daretur, tamen infligi magnum rei publicae volnus putabamus, hunc tu compransoribus tuis et conlusoribus dividebas. mimos dico et mimas, patres conscripti, in agro in agro P C D Campano conlocatos. quid iam querar queror V de agro Leontino? quoniam quidem hae quondam arationes Campana et Leontina Campani et Leontini D : tria verba abesse malim in populi Romani patrimonio grandiferae grandifacere D et fructuosae ferebantur. Medico tria milia iugerum: quid, si quid si V1 : quasi V2D te sanasset sanum fecisset D ? rhetori duo: quid, si te quid si te quidiste V1 : quid si c : quasiste V2 : quasi nst disertum facere potuisset.
2.102	sed ad iter Italiamque redeamus. deduxisti coloniam Casilinum, quo Caesar ante deduxerat. consuluisti me per litteras de Capua tu quidem, sed idem de Casilino respondissem respondisset V : possesne ubi colonia esset, eo coloniam novam iure deducere. negavi in eam coloniam quae esset quae est D auspicato deducta, dum esset incolumis, coloniam novam iure deduci: colonos novos ascribi posse rescripsi. tu autem insolentia elatus omni auspiciorum iure turbato Casilinum coloniam deduxisti, quo erat paucis annis ante deducta, ut vexillum tolleres tolleres V, Schol. Cruq. ad Hor. Od. i. 16. 21: videres D , ut aratrum ut aratr. Vc : et aratr. nst, Schol. Cruq. circumduceres; cuius quidem vomere portam Capuae paene perstrinxisti, ut florentis coloniae territorium minueretur.
2.103	ab hac perturbatione religionum advolas in M. Varronis, sanctissimi atque integerrimi viri, fundum Casinatem. quo iure, quo ore? ‘ eodem ,’ inquies ‘quo in heredum L. Rubri, quo in heredum L. Turseli praedia, quo in reliquas innumerabilis possessiones.’ et si ab hasta, valeat hasta valeat hasta om. D , valeant tabulae, modo Caesaris, non tuae, quibus debuisti, non quibus tu te tute te D liberavisti. Varronis quidem Casinatem fundum quis venisse dicit, quis hastam istius venditionis vidit, quis vocem praeconis audivit? misisse te tè om. V dicis Alexandream qui emeret a Caesare; ipsum enim exspectare magnum fuit.
2.104	quis vero audivit umquam—nullius autem salus curae pluribus fuit— de fortunis Varronis rem ullam esse detractam? quid ? si quid si D : quod V etiam scripsit ad te Caesar ut redderes, quid satis potest dici de tanta impudentia? Remove gladios parumper illos quos videmus: iam intelleges aliam causam esse hastae Caesaris, aliam confidentiae et temeritatis tuae. non enim te dominus modo illis sedibus aedibus Pluygers sed quivis amicus, vicinus vicinus variam lectionem vicinus in mg. archetypi fuisse arbitror : cf. l. 22 et ad xiv. 13 , hospes, procurator arcebit. at quam multos dies in ea villa turpissime es es V : est ct : om. ns perbacchatus! ab hora tertia bibebatur, ludebatur, vomebatur. O tecta ipsa misera, ‘quam dispari domino'—quamquam quo modo iste dominus—sed tamen quam ab a D dispari tenebantur! studiorum enim suorum M. M. om. V1 Varro voluit illud illud V : esse s : esse illud cnt, fort. recte , non libidinum deversorium.
2.105	quae in illa villa antea ante D dicebantur, quae cogitabantur quae cogitabantur om. D , quae litteris mandabantur! iura populi Romani, monumenta maiorum, omnis sapientiae ratio omnisque doctrinae doctrina D . at vero te inquilino —non enim domino—personabant omnia vocibus ebriorum, natabant pavimenta vino, madebant parietes, ingenui pueri cum meritoriis, scorta inter matres familias versabantur. Casino Casilino D salutatum veniebant, Aquino, Interamna: admissus est nemo. iure id quidem; in homine enim turpissimo obsolefiebant obsolefiebant V : obsolefaciebant c : obsolebant nst dignitatis insignia.
2.106	cum inde Romam proficiscens ad Aquinum accederet, obviam ei processit, ut est frequens municipium, magna sane multitudo. at iste operta lectica latus per oppidum est est per oppidum D ut mortuus. stulte Aquinates: sed tamen in via habitabant. quid Anagnini? qui , cum essent devii devii V : devia ei c : devii (-via t ) obviam ei nst , descenderunt ut istum, tamquam si esset consul consul V2D : colem V1 : consulem Faernus , salutarent. incredibile dictu dictum V : dictu est Ferrarius , sed sed cú uinus add. V : et simul unũ cinus add c, et sermulcinus add. t : simul add. ns : sum vicinus Madvig ( corruptelas ex uicinus ortas esse arbitror, cf. ad l. 1 et xiv. 13) inter omnis constabat neminem esse resalutatum, praesertim cum duos secum Anagninos haberet, mustelam et Laconem, quorum alter gladiorum gladiatorum D est princeps, alter poculorum.
2.107	quid ego illas istius minas contumeliasque commemorem quibus invectus est in Sidicinos, vexavit Puteolanos, quod C. Cassium et et V : quod D Brutos patronos adoptassent? Magno quidem studio, iudicio, benevolentia, caritate, non, ut te et Basilum, vi et armis, et alios vestri similis quos clientis nemo habere velit, non modo illorum cliens esse esse illorum cliens D . interea dum tu abes, qui dies ille conlegae tui fuit fuit om. D quod tu D , cum illud quod venerari solebas bustum in foro evertit? qua re tibi nuntiata, ut constabat inter eos qui una fuerunt concidisti. quid evenerit postea nescio—metum credo valuisse et arma—conlegam quidem de caelo detraxisti effecistique et fecisti quae D non tu quidem etiam nunc ut similis ut sit similis D tui, sed certe ut dissimilis esset sui.
2.108	qui vero inde reditus reditus inde D Romam, quae perturbatio totius urbis! memineramus Cinnam L. Cinam V nimis potentem, Sullam postea dominantem, modo Caesarem regnantem videramus. erant fortasse gladii, sed sed V : sed ita c : sed tamen nst absconditi nec ita multi. ista vero quae et quanta barbaria est! agmine quadrato cum gladiis sequuntur; scutorum lecticas scutati milites, lecticas ns portari videmus. atque his quidem iam inveteratis, patres conscripti, consuetudine obduruimus. Kalendis Iuniis cum in senatum, ut erat constitutum, venire vellemus, metu perterriti repente diffugimus.
2.109	at iste, qui senatu non egeret, neque desideravit quemquam et et ( del. n2 ) D : est V : sed Halm potius discessu nostro laetatus est statimque illa mirabilia facinora effecit. qui chirographa Caesaris defendisset lucri sui causa, is leges Caesaris easque praeclaras, ut rem publicam concutere posset, evertit. numerum annorum provinciis prorogavit; idemque, cum actorum Caesaris defensor esse deberet, et in publicis publicis Vns : publ. actis ct et in privatis rebus acta Caesaris rescidit. in publicis nihil est lege gravius; in privatis firmissimum est testamentum. leges alias sine promulgatione sustulit, alias ut tolleret promulgavit. testamentum inritum fecit, quod etiam infimis civibus semper obtentum est. signa , tabulas, quas populo Caesar una cum hortis legavit, eas hic partim in hortos Pompei deportavit, partim in villam Scipionis.
2.110	et tu in Caesaris memoria diligens, tu illum amas mortuum? quem is honorem maiorem consecutus erat quam ut haberet pulvinar, simulacrum, fastigium, flaminem? est ergo flamen, ut Iovi, ut Marti, ut Quirino, sic divo Iulio M. Antonius? quid igitur cessas? cur non inauguraris inauguraris Halm : inauguraras V : inaugurare D ? sume diem, vide qui te inauguret: conlegae sumus; nemo negabit. O detestabilem hominem, sive quod eo quod V tyranni tyranni D : Caesaris V sacerdos es es ẽ V2 in ras. : est D sive quod mortui! quaero deinceps num hodiernus dies qui sit ignores? nescis heri quartum in circo diem ludorum Romanorum fuisse? te autem ipsum ad populum tulisse ut quintus praeterea dies Caesari tribueretur? cur non sumus praetextati? cur honorem Caesaris tua lege datum deseri patimur? an supplicationes addendo diem die coni. Müller contaminari passus es, pulvinaria noluisti contaminari noluisti V ? aut undique religionem tolle aut usque aut usque nst : aut ad usque V : actusque c quaque conserva.
2.111	quaeris quaeres D placeatne mihi pulvinar esse, fastigium, flaminem. mihi vero nihil istorum placet: sed tu qui acta Caesaris defendis quid potes dicere cur alia defendas, alia non cures? Nisi forte vis fateri te omnia quaestu tuo, non illius dignitate metiri. quid ad haec tandem? exspecto enim eloquentiam eloquentiam tuam unus cod. Halmii . disertissimum cognovi avum tuum, at te etiam apertiorem in dicendo. ille numquam nudus est contionatus: tuum hominis simplicis pectus vidimus. respondebisne ad haec, aut omnino hiscere audebis? ecquid reperies ex tam longa oratione mea cui te respondere posse confidas? sed praeterita omittamus.
2.112	hunc hunc post diem add. D unum diem, unum, inquam, hodiernum diem, hoc punctum temporis, quo loquor, defende, si potes. cur armatorum corona senatus saeptus est, cur me tui satellites cum gladiis audiunt, cur valvae Concordiae non patent, cur homines omnium gentium maxime barbaros, Ituraeos Ituraeos del. O. Müller , cum sagittis deducis in forum? praesidi sui causa se facere dicit. non nonne D igitur miliens perire est melius quam in sua civitate sine armatorum praesidio non posse vivere? sed nullum est istuc, mihi crede, praesidium: caritate te te om. D et benevolentia civium saeptum oportet esse, non armis.
2.113	eripiet et et Vc : om. nst extorquebit tibi ista populus Romanus, utinam salvis nobis! sed quoquo modo nobiscum egeris, dum istis consiliis uteris, non potes, mihi crede, esse diuturnus. etenim ista tua minime avara coniunx quam ego sine contumelia describo nimium diu debet populo Romano tertiam pensionem. habet populus Romanus ad quos gubernacula rei publicae rei p. D deferat: qui ubicumque terrarum sunt, ibi omne est rei publicae praesidium vel potius ipsa res publica, quae se adhuc tantum modo ulta ulta b : vita Vt : victa ns est, nondum recuperavit. habet quidem certe res publica adulescentis nobilissimos paratos defensores. quam volent illi cedant otio consulentes; tamen a re publica revocabuntur. et nomen pacis dulce est et ipsa res salutaris; sed inter pacem et servitutem plurimum interest. pax est tranquilla libertas, servitus postremum malorum omnium, non modo bello sed morte etiam repellendum repellenda Isid. Origg. ii. 29. 13 .
2.114	quod si se ipsos illi nostri liberatores e conspectu nostro abstulerunt, at exemplum facti reliquerunt. illi quod nemo fecerat fecerunt. Tarquinium Brutus bello est persecutus, qui tum rex fuit cum esse Romae Romae Muretus : Roma te V (-ae. tę. V2 ): Romae regem D licebat; Sp. Cassius, Sp. Maelius, M. Manlius propter suspicionem regni appetendi sunt necati: hi primum primum V : primi D cum gladiis non in regnum appetentem, sed in regnantem impetum fecerunt. quod cum ipsum factum per se praeclarum est atque divinum est atque div. V : atque div. est D , tum expositum ad imitandum est est V : si n1s2 : sit c : sic n2 : sed s1: om. t , praesertim cum illi eam gloriam consecuti sint quae vix caelo capi posse videatur. etsi enim satis in ipsa conscientia pulcherrimi facti fructus erat, tamen mortali mortali mortali immortali V : om. D immortalitatem non arbitror arbitror esse V ( malo numero ) contemnendam.
2.115	recordare igitur igitur om. D illum, M. Antoni, diem quo dictaturam sustulisti; pone ante oculos laetitiam senatus populique Romani; confer cum hac nundinatione hac nundinatione Lambinus (hac immani nund. A. Augustinus ): hac in manum latione V : nũmatione D tua tuorumque: tum intelleges quantum inter laudem et lucrum laudem et lucrum D : lucrum et laudem V ( peiore numero ) intersit. sed nimirum, ut quidam morbo aliquo et sensus stupore suavitatem cibi non sentiunt, sic libidinosi, avari, facinerosi verae laudis gustatum gustatum Vc : gustum nst non habent. sed si te laus adlicere ad recte faciendum non potest, ne metus quidem a foedissimis factis potest avocare? iudicia non metuis: si propter innocentiam, laudo; sin propter vim, non intellegis, qui isto modo iudicia non timeat, ei quid intellegeris qui ... et quid V1 : intellegis ei qui ... quid V2D : corr. Muretus timendum sit?
2.116	quod si non metuis viros fortis egregiosque civis, quod a corpore tuo prohibentur armis, tui te, mihi crede, diutius non ferent. quae est autem vita vita Vc : multas nst dies et noctes timere timere ct : timer V1 : timeri V2ns a suis? Nisi vero aut maioribus habes beneficiis obligatos quam ille quosdam habuit ex eis a quibus est interfectus, aut tu es ulla re cum eo eo V : illo D comparandus. fuit in illo ingenium, ratio, memoria, litterae, cura litterae, cura Vc : litteratura nst , cogitatio, diligentia; res bello gesserat, quamvis rei publicae calamitosas, at tamen magnas; multos annos regnare meditatus, magno labore, magnis magnis D : magmultis V1 : multis V2 periculis quod cogitarat cogitabat V effecerat; muneribus, monumentis, congiariis, epulis multitudinem imperitam delenierat delenierat Garatoni : deleniebat V : lenierat D ; suos praemiis, adversarios clementiae specie devinxerat. quid multa? attulerat quid ... attulerat om. V1 iam liberae civitati partim metu partim patientia consuetudinem serviendi.
2.117	cum illo ego te dominandi cupiditate conferre possum, ceteris vero rebus nullo modo comparandus es es comparandus D . sed ex plurimis malis quae ab illo rei publicae sunt inusta hoc tamen boni est boni est V2D : bonis et V1 : boni exstitit Koch quod didicit iam populus Romanus quantum cuique crederet, quibus se committeret, a quibus caveret. haec non haec igitur non D cogitas, neque neque V : nec D ( ita l. 11) intellegis satis esse viris fortibus didicisse quam sit re re om. D pulchrum, beneficio gratum, fama gloriosum tyrannum occidere? an an V : et D , cum illum homines non tulerint, te ferent?
2.118	certatim posthac, mihi crede, ad hoc opus curretur neque occasionis tarditas exspectabitur. respice , quaeso, aliquando rem publicam, M. Antoni, quibus respice ... quibus D : respice quaeso aliquibus V med. omissis : respice quaeso aliquando quibus Halm : resipisce q. a. q. Seidler ortus sis, non quibuscum vivas considera: mecum, ut voles ut voles D : utivles V : uti voles Halm cum re p. redi D : redi cum re publica in gratiam. sed de te tu tu ipse D videris; ego de me ipse ipse V : ipso cns : ipse ipso t profitebor. defendi rem publicam adulescens, non deseram deseram sextimescam tuos V1 ( e coll. mea ) med. omissis, unde extimescam coni. Nohl senex: contempsi Catilinae gladios, non pertimescam tuos. quin etiam corpus libenter obtulerim, si repraesentari morte mea libertas civitatis potest, ut aliquando dolor populi Romani pariat quod iam diu parturit parturii D ! etenim si abhinc annos prope viginti hoc ipso in templo negavi posse mortem immaturam esse consulari, quanto verius nunc nunc Vc : non nt : om. s negabo seni? mihi vero, patres conscripti, iam etiam optanda mors est, perfuncto rebus eis quas adeptus sum quasque gessi. duo modo haec opto, unum ut adeptus ... unum, ut om. V1 moriens populum Romanum liberum relinquam—hoc mihi maius ab dis immortalibus dari nihil potest—alterum ut ita cuique eveniat ut de re publica quisque mereatur.
3.1	serius omnino, patres conscripti, quam tempus tempus om. V1 rei publicae postulabat postulabat Manutius : postulabatvit V1 : postulavit V2D , aliquando tamen convocati sumus; quod flagitabam equidem cotidie, quippe cum bellum nefarium contra aras et focos, contra vitam fortunasque nostras ab homine profligato ac perdito non comparari, sed geri iam viderem. exspectantur Kalendae Ianuariae, quas non exspectat Antonius qui in provinciam D. Bruti D. om. V1 , summi et singularis viri, cum exercitu impetum facere conatur; ex qua se instructum et paratum ad urbem venturum esse minitatur.
3.2	quae est igitur exspectatio aut quae vel minimi minima D dilatio temporis? quamquam enim adsunt Kalendae Ianuariae, tamen breve tempus longum est imparatis. dies enim adfert vel vel V : et D nisi D : nihil V : si nihil Halm hora potius, nisi provisum est, magnas saepe clades; certus autem dies non ut sacrificiis sacrificiis Halm : sacrificii VD consiliis V : consilii D , sic consiliis exspectari solet. quod si aut Kalendae Ianuariae fuissent eo die quo primum ex urbe fugit Antonius, aut eae eae Halm : ae V : hae D non essent exspectatae, bellum iam nullum haberemus. auctoritate enim senatus consensuque populi Romani facile hominis amentis fregissemus audaciam. quod confido equidem consules designatos, simul simul ac D ut magistratum inierint, esse facturos; sunt enim optimo animo, summo consilio, singulari concordia. mea mea D : ea V autem festinatio non victoriae solum avida est sed sed om. V etiam celeritatis.
3.3	quo enim usque tantum bellum, tam crudele, tam nefarium privatis consiliis propulsabitur? cur non quam primum publica accedit auctoritas? C. Caesar adulescens, paene potius puer, incredibili ac divina quadam mente atque virtute, cum cum (c in ras. ) V1 : tum cum V2 : tunc cum D maxime furor arderet Antoni cumque eius a Brundisio crudelis et pestifer reditus timeretur, nec postulantibus nec cogitantibus, ne ne Lambinus : nec codd. opinantibus D optantibus quidem nobis, quia non posse fieri fieri posse non D videbatur, firmissimum exercitum ex ex om. D invicto genere veteranorum militum comparavit patrimoniumque suum effudit: quamquam non sum usus sumus usi D eo verbo quo debui debui V : decuit D ; non enim effudit: in salute rei in rei (re) p. salute V ( malo numero ) publicae conlocavit.
3.4	cui quamquam gratia referri tanta non potest quanta debetur, habenda tamen est tanta tamen est tanta Vs : tamen tanta est cnt quantam maximam animi nostri capere possunt. quis enim est tam ignarus rerum, tam nihil de re publica cogitans qui hoc non intellegat, si M. Antonius a Brundisio cum eis eis ed. R : his VD copiis quas se habiturum putabat putaverat D , Romam, ut minabatur, venire potuisset, nullum genus eum crudelitatis praeteriturum fuisse? quippe qui in hospitis tectis Brundisi fortissimos viros optimosque civis cives optimos D iugulari iusserit iussit D ; quorum ante pedes eius morientium sanguine os uxoris respersum esse constabat. hac ille crudelitate imbutus, cum multo bonis bonis nobis Christ omnibus omnibus Vn2 : hominibus cett. veniret iratior quam illis fuerat quos trucidarat, cui tandem nostrum vestrum D aut cui omnino bono pepercisset?
3.5	qua peste privato consilio rem p. privato consilio D rem publicam—neque enim fieri potuit aliter—Caesar liberavit: qui nisi in hac re publica natus esset, rem publicam scelere Antoni nullam haberemus. sic enim perspicio, sic iudico, nisi unus adulescens illius furentis impetus crudelissimosque conatus cohibuisset, rem publicam funditus interituram fuisse. cui quidem hodierno die, patres conscripti—nunc enim primum ita convenimus ut illius illius Vc : de illius nst beneficio possemus ea ea om. D quae sentiremus libere dicere— tribuenda est auctoritas, ut rem publicam non modo a se susceptam sed etiam a nobis commendatam possit defendere. nec vero de legione Martia.
