11.24	quod quidem eo vehementius tibi laborandum est quia in eandem cadere suspicionem conlega, vir clarissimus, non potest. nihil horum scit, nihil suspicatur; bellum gerit, in acie stat, de sanguine et de spiritu decertat; ante provinciam sibi decretam audiet quam potuerit tempus ei rei datum suspicari. vereor ne exercitus quoque nostri qui non dilectus necessitate, sed voluntariis studiis se ad rem publicam contulerunt tardentur animis, si quicquam aliud a nobis nisi de instanti bello cogitatum putabunt. quod si provinciae consulibus expetendae videntur, sicut saepe multis a multis Halm clarissimis viris expetitae sunt, reddite prius nobis Brutum, lumen et decus civitatis; qui ita conservandus est ut id id illud Ernesti signum quod de de v : om. cett. caelo delapsum Vestae custodiis continetur tenetur v ; quo salvo salvi sumus futuri. tunc tunc Ferrarius : hunc codd. vel in caelum vos vos hoc loco Nonius p. 407: ante umeris habet b : om. nst , si fieri potuerit potuerit l et Nonius : poterit bnst , umeris nostris tollemus; provincias certe dignissimas vobis deligemus; nunc quod agitur agamus. agitur autem liberine vivamus an mortem obeamus, quae certe servituti anteponenda est.
11.25	quid ? si etiam tarditatem adfert ista sententia ad Dolabellam persequendum? quando enim veniet consul? an id exspectamus quoad ne quoad ne Christ : quo ante t : quo ne (nec b ) bs vestigium quidem Asiae civitatum atque urbium relinquatur? at mittent aliquem de suo numero. valde mihi probari potest qui paulo ante clarissimo viro privato imperium extra ordinem non dedi. at hominem dignum mittent. num P. Servilio digniorem? at eum quidem civitas non habet. quod ergo ipse nemini putavi putavi Madvig : putat codd. dandum, ne a senatu quidem, id ego unius iudicio delatum comprobem?
11.26	expedito nobis homine et parato, patres conscripti, opus est et eo qui imperium legitimum habeat, qui praeterea auctoritatem, nomen, exercitum, perspectum animum in re publica liberanda. quis igitur is est? aut M. Brutus aut C. Cassius aut uterque. decernerem plane, sicut multa ‘consules, alter ambove consules, alter ambove n, ut voluit Müller : consulib; alter ambosve t : cõs. alterum ambosve bs : in consulibus, alterum ambosve Halm ,’ ni Brutum conligassemus in Graecia et eius auxilium ad Italiam vergere quam ad Asiam maluissemus; non ut ex acie ex acie Rau : ex ea acie codd. : eo ex acie Ferrarius respectum haberemus, sed ut ea ea supplevi ( hoc loco, cf. l. 26) ipsa acies subsidium haberet etiam transmarinum. praeterea , patres conscripti, M. Brutum retinet etiam nunc C. Antonius, qui tenet Apolloniam, magnam urbem et gravem; tenet, opinor, Byllidem, tenet Amantiam, instat Epiro, urget Oricum, habet aliquot cohortis, habet equitatum. hinc si Brutus erit traductus ad aliud bellum, Graeciam certe amiserimus. est autem etiam de Brundisio atque illa ora Italiae providendum. quamquam miror tam diu morari Antonium; solet enim ipse accipere manicas nec diutius obsidionis metum iste Orelli sustinere. quod quod quem coni. Halm si confecerit Brutus et intellexerit plus se rei publicae profuturum, si Dolabellam persequatur quam si in Graecia maneat, aget ipse per sese, ut adhuc quoque fecit, neque in tot incendiis quibus confestim succurrendum est exspectabit senatum.
11.27	nam et Brutus et Cassius multis iam in rebus ipse sibi senatus fuit ipsi sibi senatus fuerunt coni. Halm . necesse est enim in tanta conversione et perturbatione omnium rerum conversione et perturbatione omnium rerum codd. Ferrarii : concursatione (-cursione t ) perturbationum rerum D temporibus potius parere quam moribus. nec enim nunc primum aut Brutus aut Cassius salutem libertatemque patriae legem sanctissimam et morem optimum iudicavit. itaque si ad nos nihil referretur de Dolabella persequendo, tamen ego pro decreto putarem, cum essent tales virtute, auctoritate, nobilitate ei summi ei summi scripsi : summi codd. : summa ( vel supra tali) Faernus viri quorum alterius iam nobis notus esset exercitus, alterius auditus. num igitur Brutus exspectavit decreta nostra, cum studia nosset? neque enim est in provinciam suam Cretam profectus: in Macedoniam alienam advolavit; omnia sua putavit quae vos vestra esse velitis; legiones conscripsit novas, excepit veteres; equitatum ad se abduxit Dolabellae atque eum nondum tanto parricidio oblitum oblitum obstrictum mg. Crat., cf. §§ 14, 29 hostem sua sententia iudicavit. nam ni ita esset, quo iure equitatum a a n2s : om. bn1t consule abduceret?
11.28	quid ? C. Cassius, pari magnitudine animi et consili praeditus, nonne eo ex Italia consilio profectus est ut prohiberet Syria Dolabellam? qua lege, quo iure? eo quod Iuppiter ipse sanxit, ut omnia quae rei publicae salutaria essent legitima et iusta haberentur. est enim lex nihil aliud nisi recta et et Poggius : etiam D a numine deorum tracta ratio, imperans honesta, prohibens contraria. huic igitur legi paruit Cassius, cum est in Syriam profectus, alienam provinciam, si homines legibus scriptis uterentur, eis vero oppressis suam suam ed. R : sua codd. lege naturae.
11.29	sed ut ea vestra quoque auctoritate firmetur ea... firmetur Ferrarius : ex... firmetur codd. : ea... firmentur Bake , censeo: cum P. Dolabella quique eius crudelissimi et taeterrimi facinoris ministri, socii, adiutores fuerunt hostes populi Romani a senatu iudicati sint sunt D : corr. Poggius , cumque senatus P. Dolabellam bello persequendum censuerit, ut is qui omnia deorum hominumque iura novo, inaudito, inexpiabili scelere polluerit nefarioque se patriae parricidio obstrinxerit poenas dis hominibusque meritas debitasque persolvat, 
11.30	senatui placere C. Cassium pro consule provinciam Syriam obtinere, ut qui optimo iure eam provinciam obtinuerit, eum a Q. Marcio eum a Q. bt ; eumque a ( om. a n1s ) ns Crispo pro consule, L. Statio Statio Ferrarius : stato b : statu st : statilio n Murco pro consule, A. Allieno A. n, Ferrarius : at s : ab bt legato exercitus exercitus ns : exercitum bt accipere, eosque ei tradere, cumque eis copiis et si quas praeterea paraverit bello P. Dolabellam terra marique persequi. eius belli gerendi causa quibus ei videatur navis, nautas, pecuniam ceteraque quae ceteraque quae n2 : ceteraque n1s1t : cetera quae s2 : ceteraque omnia, quae b ad id bellum gerendum pertineant, ut imperandi in Syria, Asia, Bithynia, Ponto ius potestatemque habeat, utique, quamcumque in provinciam eius belli gerendi causa advenerit, ibi maius imperium C. Cassi pro consule sit quam eius erit qui eam provinciam tum obtinebit, cum C.
11.31	Cassius pro consule in eam provinciam venerit; regem Deiotarum patrem et regem Deiotarum filium, si, ut multis bellis saepe numero imperium populi Romani iuverint, item C. Cassium pro consule copiis suis opibusque iuvissent, senatui populoque Romano gratum esse facturos. itemque si ceteri reges, tetrarchae dynastaeque fecissent, senatum populumque Romanum eorum offici non immemorem futurum. Vtique utque ns C. Pansa A. Hirtius consules, alter ambove, si eis videretur, re publica recuperata de provinciis consularibus, praetoriis, ad hunc ordinem primo quoque tempore referant ferant codd. : corr. Naugerius (1) . interea provinciae ab eis a a b : om. nst quibus obtinentur obtineantur quoad cuique ex senatus consulto successum sit.
11.32	hoc senatus consulto ardentem inflammabitis et armatum armabitis Cassium; nec enim animum eius potestis ignorare nec copias. animus is est is est bt : ipse ns : fort. ipsius est quem videtis vidistis Ferrarius ; copiae quas audistis post audistis aliquid intercidisse putat Madvig, velut primum legiones Q. Marci, deinde L. Stati , fortes et constantes fortis et constantis Ferrarius viri, qui ne vivo quidem Trebonio Dolabellae latrocinium in Syriam penetrare sivissent sivisset cod. Amst., et codd. Ferrarii . Allienus, familiaris et necessarius meus, post interitum Treboni profecto ne profecto ne Christ : profectione t : profectus ne bns dici quidem se legatum Dolabellae volet. est Q. Caecili Bassi, privati illius quidem, sed fortis et praeclari viri, robustus et victor exercitus.
11.33	Deiotari regis et patris et fili et magnus et nostro more institutus exercitus; summa in filio spes, summa ingeni indoles, summa virtus summa virtus d : summaque v D ( cf. Zielinski p. 215) . quid de patre dicam? cuius benevolentia in benevolentia in s : -tiã n : -tia bt populum Romanum est ipsius aequalis aetati; qui non solum socius imperatorum nostrorum fuit in bellis verum etiam dux copiarum suarum. quae de illo viro Sulla, quae Murena, quae Servilius, quae Lucullus, quam ornate, quam honorifice, quam graviter saepe in senatu praedicaverunt? quid de Cn.
11.34	Pompeio loquar loquor t ? qui unum Deiotarum in toto orbe terrarum ex animo amicum vereque benevolum, unum fidelem populo Romano iudicavit. fuimus imperatores ego et M. Bibulus in propinquis finitimisque provinciis: ab eodem rege adiuti sumus et equitatu et pedestribus copiis. secutum est hoc acerbissimum et calamitosissimum civile bellum in quo quid faciendum Deiotaro, quid omnino rectius fuerit dicere non est necesse, praesertim cum contra ac Deiotarus sensit victoria belli iudicarit diiudicarit Halm . quo in bello si fuit error, communis ei fuit cum senatu; sin recta sententia, ne victa quidem causa vituperanda est. ad has copias accedent alii reges, etiam dilectus accedent.
11.35	neque vero classes deerunt: tanti Tyrii Cassium faciunt, tantum tantum Ferrarius : tanti codd. eius in Syria nomen atque Phoenice est. paratum habet imperatorem C. Cassium, patres conscripti, res publica contra Dolabellam nec paratum solum sed peritum atque fortem. magnas ille res gessit ante Bibuli, summi viri, adventum, cum Parthorum nobilissimos duces maximas copias cum Pacori nobilissimi ducis magnas copias cod. Ursini fudit Syriamque immani Parthorum impetu liberavit. maximam eius et singularem laudem praetermitto; cuius enim praedicatio nondum omnibus grata est, hanc memoriae potius quam vocis testimonio conservemus.
11.36	animadverti , patres conscripti, exaudivi exaudivi Pluygers : exaudi rui t ( ex -dirvi ortum ): exauditu b : exornari ns : et audio videri Madvig etiam nimium a me Brutum Brutum Cassium add. t : nimium Cassium add. bns, del. Halm ornari; Cassio vero sententia mea dominatum et principatum dari. quos ego orno? nempe eos qui ipsi sunt ornamenta rei publicae. quid ? D. Brutum nonne omnibus sententiis semper ornavi? num igitur reprehenditis reprehendistis Ernesti ? an Antonios potius ornarem ornem Kayser Romani codd. Ferrarii : p. r. mei , non modo suarum familiarum sed Romani nominis probra atque dedecora? an Censorinum ornem ornarem coni. Halm in bello hostem, in pace sectorem? an cetera ex eodem latrocinio naufragia conligam? ego vero istos oti, concordiae, legum, iudiciorum, libertatis inimicos tantum abest ut ornem ut effici non possit quin eos tam oderim quam rem publicam diligo.
11.37	' vide ,’ inquit ‘ne veteranos offendas:’ hoc enim vel maxime exaudio. ego autem veteranos tueri debeo, sed eos quibus sed eos quibus n : sed iis quibus s : q iis quos quibus t : ẽ quod iis quos quibus b. An eos quidem quibus? sanitas est; certe timere non debeo. Eos vero veteranos qui pro re publica arma ceperunt secutique sunt C. Caesarem auctorem auctorem (-e b ) bt : auctoritatem (-te s ) ns beneficiorum paternorum, hodieque rem publicam defendunt vitae suae periculo vitae suae periculo Halm ( cf. § 4): video epericulo t : magno per. b : cum magno per. ns , non tueri solum sed etiam commodis augere debeo. qui autem quiescunt, ut septima, ut octava legio, in magna gloria et laude ponendos puto. comites vero Antoni qui, postquam beneficia Caesaris comederunt, consulem designatum obsident, huic urbi ferro ignique minitantur, Saxae se et Cafoni tradiderunt ad facinus praedamque natis, num quis est qui tuendos putet? ergo aut boni sunt quos etiam ornare, aut quieti quos conservare debemus, aut impii quorum contra furorem bellum et iusta arma cepimus.
11.38	quorum igitur veteranorum animos ne offendamus veremur? eorumne qui D. Brutum obsidione cupiunt liberare? quibus cum Bruti salus cara sit, qui possunt Cassi nomen odisse? an eorum qui utrisque armis vacant? non vereor ne acerbus cuiquam cuiquam scripsi : civis quisquam codd. ( e quisquam, credo, ortum ): nuntius cuiquam Madvig : Cassi honos cuiquam coni. Müller istorum sit qui otio delectantur. Tertio vero generi non militum veteranorum, sed importunissimorum hostium cupio quam acerbissimum dolorem inurere. quamquam , patres conscripti, quousque sententias dicemus veteranorum arbitratu? quod eorum tantum fastidium est, quae tanta adrogantia ut ad arbitrium illorum imperatores etiam deligamus delig. s : dilig. bnt ?
11.39	ego autem —dicendum est enim, patres conscripti, quod sentio—non tam veteranos metuendos intuendos Poggius nobis arbitror quam quid tirones milites, flos Italiae, quid novae legiones ad liberandam patriam paratissimae, quid cuncta Italia de vestra gravitate sentiat. nihil enim semper floret; aetas succedit aetati: diu legiones Caesaris viguerunt; nunc vigent Pansae, vigent Hirti, vigent Caesaris fili, vigent Planci; vincunt numero, vincunt aetatibus; nimirum etiam auctoritate vincunt. id enim bellum gerunt quod ab omnibus gentibus comprobatur. itaque his praemia promissa sunt, illis persoluta. fruantur illi suis illi suis ed. Gryph. (1550): illi sues t : illis vel ns : illis b , persolvantur his quae spopondimus. id enim deos immortalis spero aequissimum iudicare.
11.40	quae cum ita sint, eam quam dixi sententiam vobis, patres conscripti, censeo comprobandam.
12.1	etsi minime decere videtur, patres conscripti, falli, decipi, errare eum cui vos maximis saepe de rebus adsentiamini assentiabamini t , consolor me tamen quoniam vobiscum pariter et una cum sapientissimo consule erravi. nam cum duo consulares spem honestae pacis nobis attulissent, quod erant familiares M. Antoni, quod domestici, nosse aliquod eius volnus quod nobis ignotum esset videbantur. apud alterum uxor, liberi; alter cotidie litteras mittere, accipere, aperte favere Antonio.
12.2	hi subito hortari ad pacem, quod iam diu non fecissent, non sine causa videbantur. accessit consul hortator. at qui consul! si prudentiam quaerimus, qui minime falli posset; si virtutem, qui nullam pacem probaret nisi cum cedente cum cedente Jeep : concedente (-i b ) bt : cedente n1sv : cedente hoste n2 atque victo; si magnitudinem animi, qui praeferret mortem servituti. vos autem, patres conscripti, non tam immemores vestrorum gravissimorum decretorum videbamini quam spe adlata deditionis quam amici pacem appellare mallent appellare mallent n, ut correxit Scala : appellarem (-ent b ) alieni rell. de imponendis, non accipiendis legibus cogitare. auxerat autem meam quidem spem, credo item vestram, quod domum Antoni adflictam maestitia audiebam, lamentari uxorem post uxorem lacunam statuit Ernesti . hic etiam fautores Antoni quorum in voltu habitant oculi mei tristiores videbam.
12.3	quod si non ita est, cur a Pisone et Caleno potissimum, cur hoc tempore, cur tam improviso, cur tam repente pacis est facta mentio? negat Piso scire se, negat audisse quicquam; negat Calenus rem ullam novam adlatam esse. atque id nunc negant, postea quam nos pacificatoria legatione implicatos putant. quid ergo opus est novo consilio, si in re nihil omnino novi est? decepti decepti, decepti bv , inquam, sumus, patres conscripti: Antoni est acta causa ab amicis eius, non publica. quod videbam equidem sed quasi per caliginem: praestrinxerat praestrinxerat st (-ant t ): perstrinx. bnv aciem animi D. Bruti salus. quod si in bello dari vicarii solerent, libenter me ut D. Brutus emitteretur pro illo includi paterer. atque atqui Naugerius (2) hac voce Q.
12.4	Fufi capti sumus: ‘ ne si a Mutina quidem recesserit, audiemus Antonium, ne si in senatus quidem potestate potestate v : potestatem cett. futurum se dixerit?’ durum videbatur: itaque fracti sumus, cessimus. recedit recedet tv igitur a Mutina? ‘ nescio .’ paret senatui? ‘ credo ,’ inquit Calenus ‘sed ita ut teneat dignitatem.’ valde hercules vobis laborandum est, patres conscripti, ut vestram dignitatem amittatis, quae maxima est; Antoni, quae neque est ulla neque esse potest, retineatis, ut eam per vos reciperet quam per se perdidit. si iacens vobiscum aliquid ageret, audirem fortasse: quamquam—sed hoc malo dicere, audirem: stanti resistendum est aut concedenda una cum dignitate libertas. at non est integrum: constituta legatio est.
12.5	quid autem non integrum est sapienti quod restitui potest? cuiusvis hominis est errare; nullius nisi insipientis perseverare in errore in errore perseverare tv . posteriores enim cogitationes, ut aiunt, sapientiores solent esse. discussa est illa caligo quam paulo ante dixi; diluxit, patet, videmus omnia, neque per nos solum, sed admonemur a nostris. attendistis paulo ante praestantissimi viri quae esset oratio. ‘ maestam ’ inquit ‘domum offendi, coniugem, liberos. admirabantur boni viri, accusabant amici quod spe pacis legationem suscepissem.’ nec mirum, P. Servili: tuis enim severissimis severissimis Gulielmius : verissimis codd. gravissimisque sententiis omni est non dico dignitate sed etiam spe salutis spoliatus Antonius.
12.6	ad eum ire te legatum quis non miraretur miretur s, ut voluit Ernesti ? de me experior: cuius idem consilium quod tuum sentio quam reprehendatur. nos reprehendimur soli? quid ? vir fortissimus Pansa sine causa paulo ante tam accurate locutus est tam diu? quid egit nisi uti falsam proditionis a se suspicionem depelleret? Vnde autem ista suspicio est? ex pacis patrocinio repentino quod subito suscepit eodem captus errore quo nos.
12.7	quod si est erratum, patres conscripti, spe falsa atque fallaci, redeamus in viam. optimus est portus paenitenti mutatio consili. quid enim potest, per deos immortalis! rei publicae prodesse nostra legatio? prodesse dico? quid si etiam obfutura est? obfutura ? quid si iam nocuit atque obfuit? an vos acerrimam illam et fortissimam populi Romani libertatis recuperandae cupiditatem non imminutam ac debilitatam debilitatam s2v : delibatam cett. putatis legatione pacis audita? quid municipia censetis? quid colonias? quid cunctam Italiam? futuram eodem studio quo contra commune incendium exarserat exarserit t ? an non putamus fore ut eos paeniteat professos esse et prae se tulisse odium in Antonium qui pecunias polliciti sunt, qui arma, qui se totos et animis et corporibus in salutem rei publicae contulerunt? quem ad modum nostrum hoc consilium Capua probabit, quae temporibus his Roma altera est? illa impios civis iudicavit, eiecit, exclusit. illi illi, illi bv , inquam, urbi fortissime conanti e manibus est ereptus Antonius.
12.8	quid ? legionum nostrarum nervos nonne his consiliis incidimus? quis est enim qui ad bellum inflammato animo futurus sit spe pacis oblata? ipsa illa Martia caelestis et divina legio hoc nuntio languescet et mollietur atque illud pulcherrimum pulcherrimum Martium add. codd., del. Manutius nomen amittet: excident gladii, fluent arma de manibus. senatum enim secuta non arbitrabitur se graviore graviori ns odio debere esse in Antonium quam senatum. pudet huius legionis, pudet quartae quae pari virtute nostram auctoritatem probans non ut consulem et imperatorem suum, sed ut hostem et oppugnatorem patriae reliquit Antonium; pudet optimi exercitus qui coniunctus est ex duobus, qui iam lustratus, qui profectus ad Mutinam est; qui si pacis, id est timoris nostri, nomen audierit, ut non referat pedem, insistet sistet Gulielmius certe.
12.9	quid quis s enim revocante et receptui canente senatu properet dimicare? quid autem hoc iniustius quam nos inscientibus eis qui bellum gerunt de pace decernere? nec solum inscientibus sed etiam invitis? an vos A. Hirtium, praeclarissimum consulem, C. Caesarem et C. Muretus , deorum beneficio natum ad haec tempora, quorum epistulas spem victoriae declarantis in manu teneo, pacem velle censetis? vincere illi expetunt pacisque dulcissimum et pulcherrimum nomen non pactione, sed victoria concupiverunt. quid ? Galliam quo tandem animo hanc rem audituram putatis? illa enim huius belli propulsandi, administrandi, sustinendi principatum tenet. Gallia D. Bruti nutum ipsum, ne dicam imperium, secuta armis, viris, pecunia belli principia firmavit; eadem crudelitati M. Antoni suum totum corpus obiecit; exhauritur, vastatur, uritur: omnis uritur, omnis s, Ferrarius : uritur omnis. n, ed. R aequo animo belli patitur iniurias iniurias Ferrarius : iniuriam codd. , dum modo repellat periculum servitutis.
12.10	et ut omittam reliquas partis Galliae—nam sunt omnes pares— Patavini alios excluserunt, alios eiecerunt missos ab Antonio, pecunia, militibus, et, quod maxime deerat, armis nostros duces adiuverunt. fecerunt idem reliqui qui quondam in eadem causa erant et propter multorum annorum iniurias alienati a senatu putabantur: quos minime mirum est communicata cum eis iis ns, Halm : is t : his b re publica fidelis esse esse Poggius : om. D , qui etiam expertes eius fidem suam semper praestiterunt. his igitur omnibus victoriam sperantibus pacis nomen adferemus, id est desperationem victoriae?
12.11	quid si ne ne b : non cett. potest quidem ulla esse pax? quae enim est condicio pacis in qua ei cum quo pacem facias nihil concedi potest? multis rebus a nobis est est om. tv invitatus ad pacem Antonius: bellum tamen maluit. Missi legati repugnante me, sed tamen missi; delata mandata: non paruit. denuntiatum est ne Brutum obsideret, a Mutina discederet: oppugnavit etiam vehementius. et ad eum legatos de pace mittemus qui pacis nuntios repudiavit? verecundioremne coram putamus in postulando fore quam fuerit tum cum misit mandata ad senatum? atqui tum ea petebat quae videbantur videbantur om. tv improba omnino sed tamen aliquo modo posse concedi; nondum erat vestris tam gravibus gravibus b1 : gravissimis cett. tamque multis iudiciis ignominiisque concisus conscissus v : nunc ea petit quae dare nullo modo possumus, nisi prius volumus bello nos victos confiteri.
12.12	senatus consulta falsa delata ab eo iudicavimus: num ea vera possumus iudicare -sumus iudicare hic rursus incipit V ( cf. ad xi. 17) ? leges statuimus per vim et contra auspicia latas eisque nec populum nec plebem teneri: num eas restitui posse censetis? sestertium septiens miliens avertisse Antonium pecuniae publicae iudicavistis: num fraude poterit carere peculatus? immunitates ab eo civitatibus civitates D , sacerdotia, regna venierunt: num figentur rursus eae tabulae quas vos decretis vestris refixistis? quod si ea quae decrevimus obruere volumus volumus om. V1 , num etiam memoriam rerum delere possumus? quando enim obliviscetur ulla posteritas cuius scelere in hac vestitus foeditate fuerimus? Vt centurionum legionis Martiae Brundisi profusus sanguis eluatur eluatur bn2 : elevatur V : eluitur n1stv , num elui elui V : ęui t : eius cett. praedicatio crudelitatis potest? Vt media praeteream, quae vetustas tollet operum circum circa D Mutinam taetra monumenta munimenta D , sceleris indicia latrocinique vestigia?
12.13	huic igitur importuno atque impuro parricidae quid habemus, per deos immortalis! quod remittamus? an Galliam ultimam et exercitum? quid est aliud non pacem facere, sed differre bellum, nec solum propagare bellum sed concedere etiam victoriam? an ille non vicerit, si si om. V quacumque condicione in hanc urbem cum suis venerit? armis armis venerit D nunc omnia tenemus; auctoritate valemus plurimum; absunt tot perditi cives, nefarium secuti ducem; tamen eorum ora sermonesque qui in urbe ex eo numero relicti sunt ferre non possumus. quid censetis, cum tot uno tempore inruperint, nos arma posuerimus, illi non deposuerint, nonne nos nostris consiliis victos in perpetuum fore?
12.14	ponite ante oculos M. Antonium consularem; sperantem consulatum Lucium adiungite; supplete ceteros neque nostri ordinis solum honores et imperia meditantis: nolite ne Tirones quidem Numisios et Numisios et Faernus : numisioste V : nũmisios et nt : nonmusios sed s : nomisios b mustelas Seios Seios V1bt : Seiosve cett. contemnere. cum eis facta pax non erit pax, sed pactio servitutis. L. Pisonis, amplissimi viri, praeclara vox a te non solum in hoc ordine, Pansa, sed etiam in contione iure laudata est. excessurum se ex Italia dixit, deos penatis et sedes patrias relicturum, si—quod di omen averterint averterint Faernus : averterit V : averterent bv : avertent t : avertant ns !—rem publicam oppressisset Antonius.
12.15	quaero igitur a te, L. Piso, nonne oppressam rem publicam putes, si tot tam impii, tam audaces, tam facinerosi recepti sint? quos nondum tantis parricidiis contaminatos vix ferebamus, hos nunc omni scelere coopertos coopertos bs : copertos V : opertos t tolerabilis censes civitati fore? aut isto tuo, mihi crede, consilio erit utendum, ut cedamus, abeamus, vitam inopem et vagam persequamur, aut cervices latronibus dandae atque in patria cadendum est est om. D . Vbi sunt, C. Pansa, illae cohortationes pulcherrimae tuae quibus a te excitatus senatus, inflammatus populus Romanus non solum audivit sed etiam didicit nihil esse homini Romano foedius servitute?
12.16	idcircone saga sumpsimus, arma cepimus, iuventutem omnem ex tota Italia excussimus excussimus V et Nonius p. 300: excivimus D ut V : et tv : ut de bns , ut exercitu florentissimo et maximo legati ad pacem mitterentur? si accipiendam, cur non rogamur? si si... rogamur si: hoc colon hoc loco omissum post admiscear in quo ne inserunt D postulandam, quid timemus? in hac ego legatione sim aut ad id consilium admiscear admiscear Poggius : admiscearis D (admis ceteris V med. omissis ) in quo ne si dissensero quidem a ceteris sciturus sciturus Poggius : siciturus V : siiturus D populus Romanus sit? ita fiet ut si quid remissum aut concessum sit, meo semper periculo peccet Antonius, cum ei peccandi potestas a me concessa videatur.
