1.1	ante quam de re publica, patres conscripti, dicam ea quae dicenda hoc tempore arbitror, exponam vobis breviter consilium et profectionis et reversionis meae. ego cum sperarem aliquando ad vestrum consilium auctoritatemque rem publicam esse revocatam, manendum mihi statuebam quasi in vigilia quadam consulari ac senatoria. nec vero usquam discedebam nec a re publica deiciebam oculos ex eo die quo in aedem telluris convocati sumus. in quo templo, quantum in me fuit, ieci fundamenta pacis Atheniensiumque renovavi renovavi Vns : revocavi ct vetus exemplum; Graecum etiam verbum usurpavi quo tum in sedandis discordiis usa erat discordiis usa erat V : discordaverat c : discordiis erat t : discors erat ns civitas illa, atque omnem memoriam discordiarum oblivione sempiterna delendam censui.
1.2	praeclara tum oratio M. Antoni, egregia etiam voluntas; pax denique per eum et per liberos eius cum praestantissimis civibus confirmata est. atque his principiis reliqua consentiebant. ad deliberationes eas quas habebat domi de re publica principes civitatis adhibebat; ad hunc ordinem res optimas deferebat referebat Reid ; nihil tum nisi quod erat notum omnibus nisi... omnibus om. D in C. Caesaris commentariis reperiebatur reperiebat Kraffert ; summa constantia summa cum dignitate constantia D ad ea quae quaesita erant respondebat nullae respondebat om. D : nullas respondebat Wesenberg .
1.3	num qui exsules restituti? Vnum aiebat, praeterea neminem. num immunitates datae? ‘ nullae ’ respondebat. adsentiri etiam nos Ser. Sulpicio, clarissimo viro, voluit, ne qua tabula post Idus Martias ullius decreti Caesaris aut benefici figeretur. multa praetereo eaque praeclara ea quae clara sunt D ; ad singulare enim M. Antoni factum festinat oratio. dictaturam , quae iam vim iam vim Vt : vim iam cns regiae potestatis possederat Hirschfelder obsederat, funditus ex re publica sustulit; de qua qua VD : qua re cod. Amst. ut voluit Klussmann : quo Stangl ne sententias quidem diximus. scriptum senatus consultum quod fieri vellet attulit, quo recitato auctoritatem eius summo studio secuti sumus eique amplissimis verbis per senatus consultum gratias egimus.
1.4	lux quaedam videbatur oblata non modo regno, quod pertuleramus, sed etiam regni timore sublato, magnumque pignus ab eo rei publicae datum, se liberam civitatem esse velle, cum dictatoris nomen, quod saepe iustum fuisset, propter perpetuae dictaturae recentem memoriam funditus ex re publica sustulisset.
1.5	liberatus periculo caedis paucis post diebus senatus; uncus impactus est fugitivo illi qui in Mari nomen invaserat. atque haec omnia communiter cum conlega; alia porro propria Dolabellae quae, nisi conlega afuisset, credo eis futura fuisse communia. nam cum serperet in urbe urbem Vns infinitum malum idque manaret in dies latius, idemque bustum in foro facerent qui illam insepultam sepulturam effecerant, et cotidie magis magisque perditi homines cum sui suis codd. ( cf. ii. 2; iii 18): corr. Angelius similibus servis tectis ac templis urbis minarentur minitarentur V ( cf. Zielinski, Philol. 1906, p. 614) , talis animadversio fuit Dolabellae cum in audacis sceleratosque servos, tum in impuros et nefarios liberos, talisque eversio illius exsecratae columnae ut mihi mirum videatur tam valde reliquum tempus ab illo uno die dissensisse.
1.6	ecce enim Kalendis Iuniis, quibus ut adessemus edixerant edixerat t , mutata omnia: nihil per senatum, multa et magna per populum et absente populo et invito. consules designati negabant se audere in senatum venire; patriae liberatores urbe carebant ea cuius a cervicibus iugum servile deiecerant, quos tamen ipsi consules in contionibus in cont. V : et in cont. D et in omni sermone laudabant. veterani qui appellabantur qui appellabantur Vns : qui appellantur ct : om. Arusianus K. vii. p. 488: del. Jordan : appellabantur transponit post habebant Hirschfelder ( del. qui) , quibus hic ordo diligentissime caverat caverant ( sup. l. timebant) V : timebat, caverat t , non ad conservationem earum rerum quas habebant, sed ad spem novarum praedarum incitabantur. quae cum audire mallem quam videre haberemque ius legationis liberum, ea mente discessi ut adessem Kalendis Ianuariis, quod initium senatus cogendi fore videbatur.
1.7	exposui , patres conscripti, profectionis consilium: nunc reversionis, quae plus admirationis habet, breviter exponam. cum Brundisium iterque illud quod tritum in Graeciam est non sine causa vitavissem, Kalendis Sextilibus veni Syracusas, quod ab ea urbe ab urbe ea D transmissio in Graeciam laudabatur: quae tamen urbs mihi coniunctissima plus una me nocte cupiens retinere non potuit. veritus sum ne meus repentinus ad meos necessarios adventus suspicionis aliquid adferret, si essem commoratus. cum autem me ex Sicilia ad Leucopetram, quod est promunturium agri Regini, venti detulissent, ab eo loco conscendi ut transmitterem; nec ita multum provectus reiectus austro transmitteremus austro V1 med. omissis : nec ita multum si coniuctus proiectus add. V2 sum in eum ipsum locum unde conscenderam.
1.8	Cumque intempesta nox esset mansissemque in villa P. Valeri, comitis et familiaris mei, postridieque apud eundem ventum exspectans manerem, municipes Regini complures ad me venerunt, ex eis quidam Roma recentes: a quibus primum accipio M. Antoni M. om. V contionem, quae mihi ita placuit ut ea lecta de reversione primum coeperim cogitare. nec ita multo post edictum Bruti adfertur et Cassi, quod quidem mihi, fortasse quod eos plus etiam rei publicae quam familiaritatis gratia diligo, plenum aequitatis videbatur. addebant praeterea—fit enim plerumque ut ei qui boni quid volunt adferre adfingant aliquid quo faciant id quod quo cs : quod Vnt nuntiant laetius—rem conventuram: Kalendis Kalendis Sextilibus (Sex. V ) add. codd., del. Madvig : Kal. Sept. Halm senatum frequentem senatum frequentem om. V1 fore; Antonium, repudiatis malis suasoribus, remissis provinciis Galliis, ad auctoritatem senatus esse rediturum.
1.9	tum vero tanta sum cupiditate incensus ad reditum ut mihi nulli neque remi neque venti satis facerent, non quo me ad tempus occursurum non putarem non ante putarem om. D : del. Bake , sed ne tardius quam cuperem rei publicae gratularer. atque ego celeriter Veliam devectus Brutum vidi: quanto meo dolore non dico. turpe mihi ipsi videbatur in eam urbem me audere reverti ex qua Brutus cederet, et ibi velle tuto esse ubi ille non posset non posset om. V1 : non esset coni. Halm . neque vero illum similiter atque ipse eram commotum esse vidi. erectus enim maximi ac ac V : atque ns : et ct pulcherrimi facti sui conscientia nihil de suo casu, multa de vestro querebatur.
1.10	exque ex quo D eo primum cognovi quae Kalendis Sextilibus in senatu fuisset L. Pisonis oratio: qui quamquam parum erat—id enim ipsum a Bruto audieram—a quibus debuerat adiutus, tamen et Bruti testimonio—quo quid potest esse gravius?—et omnium praedicatione quos postea vidi magnam mihi videbatur gloriam consecutus. hunc igitur ut sequerer properavi quem quem om. V1 : q. V2 praesentes non sunt secuti, non ut proficerem aliquid—nec enim neque enim D, et Gellius xiii. 1 sperabam id nec praestare poteram—sed ut, si quid mihi humanitus accidisset—multa autem impendere videntur videntur V et Gellius : videbantur D praeter naturam etiam etiam V et Gellius : om. D tamen V : om. D et Gellius praeterque fatum—huius tamen diei vocem testem rei publicae relinquerem meae perpetuae erga se voluntatis.
1.11	quoniam utriusque consili causam, patres conscripti, probatam vobis esse confido confido etiam V , prius quam de re publica dicere 5–8 quaerar hs (= hic supple ) de hesterna in senatum tam acerbe V1 med. omissis incipio, pauca querar de hesterna M. Antoni M. om. V2 iniuria: cui sum amicus, idque me non nullo eius officio debere esse prae me semper tuli. quid tandem erat causae cur die hesterno in senatum die hesterno in sen. Halm ( e vestigiis cod. V ): in sen. hesterno die D tam acerbe cogerer? solusne aberam, an non saepe minus frequentes fuistis, an ea res agebatur ut etiam aegrotos deferri deferre V oporteret? Hannibal, credo, erat ad portas aut de Pyrrhi pace agebatur, ad quam causam etiam Appium illum et caecum et senem delatum esse memoriae proditum est.
1.12	de supplicationibus referebatur, quo in genere senatores deesse non solent. coguntur enim non pignoribus, sed eorum de quorum quorum de D honore agitur gratia; quod idem fit, cum de triumpho refertur. ita sine cura consules sunt ut paene liberum sit senatori non adesse. qui cum mihi mos notus esset cumque e via languerem et mihimet displicerem, misi pro amicitia qui hoc ei diceret hoc ediceret D . at ille vobis audientibus cum fabris se audientibus... se om. V1 domum meam venturum esse dixit. nimis iracunde hoc quidem et valde intemperanter. cuius enim malefici tanta tanta om. D ista poena est ut dicere in hoc ordine auderet se publicis operis disturbaturum publice ex senatus sententia aedificatam domum? quis autem umquam tanto damno senatorem coegit? aut quid est ultra pignus aut multam? quod si scisset quam sententiam dicturus essem, remisisset aliquid profecto de severitate cogendi.
1.13	an me censetis, patres conscripti, quod vos inviti secuti estis, decreturum fuisse, ut parentalia cum supplicationibus miscerentur, ut inexpiabiles religiones in rem publicam inducerentur, ut decernerentur supplicationes mortuo mortuorum D ? nihil dico cui cui c : cui’ n : qui Vst . fuerit ille L. Brutus L. Brutus Bruuius V (ui = Lu.) qui et ipse dominatu regio rem publicam liberavit et ad similem virtutem et simile factum stirpem iam prope in iam prope in V : in prope ns : prope in c : in t quingentesimum annum propagavit: adduci tamen non possem ut quemquam mortuum coniungerem cum deorum deorum om. V immortalium religione; ut, cuius sepulcrum usquam usquam h : nusquam cett. exstet ubi parentetur, ei publice supplicetur. ego vero eam sententiam dixissem dixissem P. C. D ut me adversus populum Romanum, si qui si qui Vns : si quis c : si quid t accidisset gravior rei publicae casus, si bellum, si morbus, si fames, facile possem defendere; quae partim iam sunt, partim timeo ne impendeant. sed hoc ignoscant di immortales velim et populo Romano qui id non probat, et huic ordini qui decrevit invitus.
1.14	quid ? de reliquis rei publicae malis licetne dicere? mihi vero dicere mihi. Verum cns : mihi dicere verum t licet et semper licebit dignitatem tueri, mortem contemnere. potestas modo veniendi in hunc locum sit: dicendi periculum non recuso. atque utinam, patres conscripti, Kalendis Sextilibus adesse potuissem! non quo profici potuerit aliquid, sed ne unus modo consularis, quod tum accidit accidit V , dignus illo honore, dignus re publica inveniretur. qua quidem ex re magnum accipio dolorem, homines amplissimis populi Romani beneficiis usos L. Pisonem ducem optimae sententiae non secutos. idcircone nos populus Romanus consules fecit ut in altissimo altissimo amplissimoque V2 gradu dignitatis locati rem publicam pro nihilo haberemus? non modo voce nemo L. Pisoni Pisoni Vn2s : Pisonis cett. consulari consulari V cn2s2, ed. R : consularis n1s1t sed ne voltu quidem adsensus est.
1.15	quae , malum, est ista voluntaria servitus? fuerit quaedam necessaria; neque ego hoc ab omnibus eis desidero qui sententiam consulari loco dicunt. Alia causa est eorum quorum silentio ignosco; alia eorum, quorum vocem requiro. quos quidem doleo in suspicionem populo Romano venire non metu non metu D : non modo metus V , quod ipsum esset turpe, sed alium alia de causa deesse dignitati suae. qua re primum maximas gratias et ago et habeo et habeo et ago D Pisoni L. Pisoni D , qui non quid efficere posset in re publica cogitavit, sed quid quisquam post quid add Reid facere ipse deberet. deinde a vobis, patres conscripti, peto ut, etiam si sequi minus audebitis orationem atque auctoritatem meam, benigne me tamen, ut fecistis adhuc fecistis adhuc D : adhuc fecistis V ( peiore numero ) , audiatis.
1.16	primum igitur acta Caesaris servanda censeo, non quo probem—quis enim enim cam V id quidem potest?—sed quia rationem habendam maxime arbitror pacis atque oti. vellem adesset M. Antonius adesset M. Halm : adessem V : adesset D , modo sine advocatis—sed, ut opinor, licet ei minus valere, quod mihi heri per illum non licuit licuit V2 : om. V1 : licebat D doceret om. V1 —doceret me vel potius vos, patres conscripti, quem ad modum ipse Caesaris acta defenderet. an in commentariolis et chirographis et libellis se uno auctore prolatis, ne ac ne D prolatis quidem sed tantum modo dictis, acta Caesaris firma erunt: quae ille in aes incidit, in quo populi iussa perpetuasque leges esse voluit, pro nihilo habebuntur?
1.17	equidem existimo nihil tam esse in actis Caesaris quam leges Caesaris. an , si cui quid ille promisit, id erit fixum quod idem facere non non facere Muretus potuit? ut multis multa promissa non fecit: quae tamen multo plura illo mortuo reperta sunt quam a vivo beneficia per omnis annos tributa et data. sed ea non muto, non moveo: summo studio illius praeclara summo etiam studio praeclara illius D acta defendo. pecunia utinam ad Opis ad Opis Vc : ad opes n1s : ad opus n2t maneret! cruenta illa quidem, sed his temporibus, quoniam eis quorum est non redditur, necessaria. quamquam ea quoque sit effusa, si ita in actis fuit.
1.18	ecquid est quod tam proprie dici possit actum eius qui togatus in re publica cum potestate imperioque versatus sit quam lex? quaere acta Gracchi: leges Semproniae proferentur; quaere Sullae: Corneliae Cornelii V2 . quid ? Pompei Cn Pompei D tertius consulatus in quibus actis constitit? nempe nempe V2D et Victorinus de defin ed. Stangl p. 31: om. V1 in legibus. de Caesare a Caesare D ipso si quaereres quidnam egisset in urbe et in toga toga cn2 : togam Vn1 : tota s : totam t , leges multas responderet se et praeclaras tulisse, chirographa vero aut mutaret aut non daret aut, si dedisset, non istas res in actis suis duceret. sed haec ipsa ea ipsa D concedo; quibusdam etiam in rebus etiam in rebus Vc : in rebus etiam nst coniveo; in maximis vero rebus, id est in legibus in legibus c et Victorinus p. 32: om. in cett. , acta Caesaris dissolvi ferendum non puto.
1.19	quae lex melior, utilior, optima etiam re publica saepius flagitata quam ne praetoriae provinciae plus quam annum neve neve Vc : neu nst plus quam biennium consulares obtinerentur? hac lege sublata videnturne vobis posse posse om. D Caesaris acta servari? quid ? lege ea lege D quae promulgata est de tertia decuria decuria iudicum D nonne omnes iudiciariae leges Caesaris dissolvuntur? et vos acta Caesaris defenditis qui leges eius evertitis evertistis ct ? Nisi forte, si quid memoriae causa rettulit retulit V1D in libellum, id numerabitur in actis et, quamvis iniquum et inutile sit, defendetur: quod ad populum centuriatis comitiis tulit, id in actis Caesaris non habebitur.
1.20	at quae est est om. V ista tertia decuria? ‘ centurionum ’ inquit. quid ? isti ordini iudicatus lege Iulia, etiam ante Pompeia etiamne Pompeia D , Aurelia non patebat? ‘ census praefiniebatur,’ inquit. non centurioni quidem solum sed equiti etiam Romano; itaque viri fortissimi atque honestissimi honestissimi atque fortissimi D qui ordines duxerunt res et iudicant et iudicaverunt. ‘ non quaero’ inquit ‘istos: quicumque ordinem duxit, iudicet.’ at si ferretis quicumque equo meruisset, quod est lautius laudatius D , nemini probaretis; in iudice enim spectari et fortuna debet et dignitas. ‘ non quaero’ inquit ‘ista: addo etiam iudices manipularis ex legione alaudarum . aliter enim nostri negant posse se salvos esse.’ O contumeliosum honorem eis quos ad iudicandum nec opinantis vocatis! hic enim est legis index ut ut ii t : uti V : ut hi cns ei res res om. D in tertia decuria iudicent qui libere iudicare non audeant. in quo quantus error est, di immortales! eorum qui istam legem excogitaverunt! Vt enim quisque sordidissimus videbitur, ita libentissime severitate iudicandi sordis suas eluet laborabitque ut honestis decuriis potius dignus videatur quam in turpem iure coniectus.
1.21	altera promulgata lex est ut et ut et V : ut D maiestatis Halm : maiestates V : de maiestate D de vi et maiestatis damnati ad populum provocent, si velint. haec haec haec cum t : haecum cn1s1 utrum tandem lex est an legum omnium dissolutio? quis est enim hodie cuius intersit istam legem manere manere V : venire D : valere Orelli istis legibus D ? nemo reus est legibus illis, nemo quem futurum putemus. armis enim gesta numquam profecto in iudicium vocabuntur. ‘ at res popularis ad res populares (-is V2 ) codd. : corr. Naugerius (1) .’ Vtinam quidem aliquid velletis esse esse del. Eberhard populare! omnes enim iam cives de rei publicae salute una et mente et voce consentiunt. quae est igitur ista cupiditas legis eius ferendae quae turpitudinem summam habeat, gratiam nullam? quid enim turpius quam qui maiestatem populi Romani minuerit per vim, eum damnatum iudicio ad eam ipsam vim reverti propter quam sit iure damnatus?
1.22	sed quid plura de lege disputo? quasi vero id agatur ut quisquam provocet: id agitur, id fertur ne quis omnino umquam istis legibus reus fiat. quis enim aut accusator tam amens reperietur qui reo condemnato obici se obici se D : obicere V1 : obicere se V2 multitudini conductae velit, aut iudex qui reum damnare audeat, ut ipse ad operas mercennarias statim protrahatur? non igitur provocatio ista lege datur, sed duae maxime salutares leges quaestionesque tolluntur. quid est aliud hortari adhortari D adulescentis ut turbulenti, ut seditiosi, ut perniciosi cives velint esse? quam autem ad pestem ad rei p. pestem D furor tribunicius impelli non poterit his duabus quaestionibus de vi et maiestate de vi et maiestate V : de vi et de maiestate D, del. Cobet ( peiore numero ) sublatis?
1.23	quid , quod obrogatur legibus Caesaris, quae iubent ei qui de vi itemque ei qui itemque ei qui D et Arusian. K. vii. p. 469: itemque V maiestatis damnatus sit aqua et igni interdici? quibus cum provocatio datur, nonne acta Caesaris rescinduntur? quae quidem ego, patres conscripti, qui illa numquam probavi, tamen tamen om. D ita conservanda concordiae causa arbitratus sum ut non modo, quas vivus leges Caesar Caesar leges D tulisset, infirmandas hoc tempore non putarem, sed ne illas quidem quas post mortem Caesaris prolatas esse et fixas videtis.
1.24	de exsilio reducti a mortuo a mortuo om. ns ; civitas data non solum singulis sed nationibus et provinciis universis a mortuo; immunitatibus infinitis sublata vectigalia a mortuo. ergo haec uno, verum verum V : viro D optimo auctore domo prolata defendimus: eas leges quas ipse nobis nobis nouos V1 : vobis Naugerius (1) inspectantibus recitavit, pronuntiavit, tulit, quibus latis gloriabatur eisque legibus rem publicam contineri continere D putabat, de provinciis, de iudiciis, eas, inquam, Caesaris leges nos qui defendimus acta Caesaris evertendas vertendas D putamus putamus Vc : putabimus nt : putavimus s ?
1.25	ac de his tamen legibus quae promulgatae sunt saltem queri possumus: de eis quae iam latae dicuntur ne illud illud om. V1 : id Halm sine ulla V : nulla D quidem licuit. illae enim sine ulla promulgatione latae sunt ante quam scriptae. quaero autem quid sit cur aut ego aut quisquam vestrum, patres conscripti, bonis tribunis plebi plebi V1 : plebis (pl.) V2D leges malas metuat. paratos habemus qui intercedant; paratos qui rem publicam religione defendant: vacui metu esse debemus. ‘ quas tu mihi’ inquit ‘intercessiones, quas religiones?’ eas scilicet quibus rei publicae salus continetur. ‘ neglegimus ista et nimis antiqua ac stulta ducimus: forum saepietur; omnes claudentur aditus; armati in praesidiis multis locis conlocabuntur.’ quid tum?
1.26	quod ita erit gestum, id lex erit? et in aes incidi iubebitis, credo, illa legitima: consules populum iure rogaverunt —hocine a hoc enim a V2D maioribus accepimus ius rogandi?— populusque iure scivit. qui populus? isne qui exclusus est? quo iure? an eo quod vi et armis omne sublatum est? atque haec atque ego haec (haec ego n ) D dico de futuris, quod est amicorum ante dicere ea quae vitari possint: quae si facta non erunt, refelletur oratio mea. loquor de legibus promulgatis, de quibus est integrum vobis, demonstro vitia: tollite! denuntio vim: arma removete vim: arma removete ed. R ( ita cns ): vim arma, removete Poggius !
1.27	irasci quidem vos mihi, Dolabella, pro re publica dicenti non oportebit oportebat V1 . quamquam te quidem id facturum non arbitror—novi novi enim D facilitatem tuam—conlegam tuum aiunt in hac sua fortuna quae bona ipsi videtur—mihi, ne gravius quippiam dicam, avorum et avunculi sui consulatum si imitaretur, fortunatior videretur—sed eum iracundum audio esse esse om. D factum. video autem quam sit odiosum habere eundem iratum eundem D iratum et armatum, cum tanta praesertim gladiorum sit impunitas: sed proponam ius, ut opinor, aequum, quod M. Antonium non arbitror repudiaturum. ego , si quid in vitam eius aut in mores cum contumelia dixero, quo minus mihi inimicissimus sit non recusabo; sin sin V : si D consuetudinem meam quam in re publica semper habui quam in re p. semper habui om. V1 tenuero, id est si libere quae sentiam de re publica dixero, primum deprecor ne irascatur; deinde, si hoc non impetro, peto ut sic irascatur ut civi. armis utatur, si ita necesse est, ut dicit, sui defendendi causa: eis qui pro re publica quae ipsis visa erunt dixerint ista arma ne noceant. quid hac postulatione dici potest aequius?
1.28	quod si, ut mihi a quibusdam eius familiaribus dictum est, omnis eum quae habetur contra voluntatem eius oratio graviter offendit, etiam si nulla inest contumelia, feremus amici naturam. sed idem illi ita mecum loquuntur mecum locuntur V : mecum D : ‘non idem tibi adversario Caesaris licebit quod Pisoni socero,’ et simul admonent quiddam quod cavebimus: ‘nec erit iustior in senatum non veniendi morbi causa quam mortis..
1.29	sed per deos immortalis!—te enim intuens, Dolabella, qui es mihi carissimus qui es mihi carissimus om. V1 , non possum de utriusque vestrum errore de ... errore D : errorem V reticere. credo enim vos nobilis homines magna quaedam spectantis non pecuniam, ut quidam nimis creduli suspicantur, quae semper ab amplissimo quoque clarissimoque contempta est, non opes violentas et populo Romano minime ferendam potentiam, sed caritatem civium et gloriam concupivisse. est autem est autem V1 : ea est autem V2ct : ea autem est ns gloria laus et laus V2D : fort. est autem gloria ea laus recte factorum magnorumque in rem publicam fama fama c et Isidorus Origg. ii. 30. 2 ( cf. Marc. 26; de Invent. ii. 166): om. cett. meritorum, quae cum optimi cuiusque, tum etiam multitudinis testimonio comprobatur.
1.30	dicerem , Dolabella, qui recte factorum fructus esset, nisi te praeter ceteros praeter ceteros om. D paulisper esse expertum viderem. quem potes recordari in vita inluxisse tibi diem laetiorem quam cum expiato foro, dissipato concursu impiorum, principibus sceleris poena adfectis, urbe incendio et caedis metu liberata urbe incendio et caedis metu liberata V2 ( cf. Fam. ix. 14. 8): om. V1D te domum recepisti? cuius ordinis, cuius generis, cuius denique fortunae studia tum laudi et gratulationi tuae se non obtulerunt obtulerunt ct : tulerunt V : optarent ns ? quin mihi etiam, quo auctore te in his rebus uti arbitrabantur, et gratias boni viri agebant et tuo nomine gratulabantur. recordare , quaeso, Dolabella, consensum illum theatri, cum omnes earum rerum obliti propter quas fuerant tibi offensi significarent significarent Vt : significar~t c : significaverunt ns se se om. V beneficio novo memoriam veteris doloris abiecisse.
1.31	hanc tu, P. Dolabella,— magno loquor cum dolore—hanc tu, inquam, potuisti aequo animo tantam dignitatem deponere? tu te D autem, M. Antoni, —absentem enim enim om. D appello—unum illum diem quo in aede telluris senatus fuit non omnibus his mensibus quibus te quidam multum a me dissentientes beatum putant anteponis? quae fuit oratio oratio tua Muretus de concordia! quanto metu senatus senatus Ernesti : veteranis V1 : veteri s : veter v : cetera n : veterani V2ct, del. Manutius ( corruptelas e varia lectione ad veteris § 30 in mg. archetypi posita ortas esse arbitror, cf. Deiot. 24) , quanta sollicitudine civitas tum a te liberata est cum conlegam tuum cum collegam tuum V : tum collegam t : tu collegam c : tuum collegam ns , depositis inimicitiis, oblitus auspiciorum a te ipso augure populi Romani nuntiatorum auspiciorum ... nuntiatorum Faernus : auspiciorum a te ipso augure pronuntiate V1 (-ante V2 ): auspicia te ipso augure nuntiante D , illo primum primo D die conlegam tibi esse voluisti; cum cum Halm : K. (R. s ) D : om. V tuus parvus filius in Capitolium a te missus pacis obses fuit!
1.32	quo senatus die laetior, quo populus Romanus populus Rom. om. V1 ? qui quidem nulla in contione umquam frequentior fuit. tum denique liberati per viros fortissimos videbamur, quia, ut illi voluerant, libertatem pax consequebatur. proximo proximo del. Eberhard , altero altero del. Cobet , tertio, denique reliquis consecutis diebus non intermittebas quasi donum aliquod cotidie adferre rei publicae; maximum autem illud quod dictaturae nomen sustulisti. haec inusta est a te, a te, inquam, mortuo Caesari nota ad ignominiam sempiternam. Vt enim propter unius M. Manli scelus decreto gentis Manliae neminem patricium Manlium Marcum Marcum suppl. Gulielmius vocari licet, sic tu propter unius dictatoris odium nomen dictatoris funditus sustulisti.
