145	morem homini gessi et tamen idcirco feci — neque enim id semper facere debemus — quod videbam per se ipsam causam sine lege copiosissime posse defendi. videbam in hac defensione qua iam sum usus plus dignitatis, in illa qua me hic uti noluit minus laboris futurum. quod si nihil aliud esset esset fuisset Sy2 a actum nisi ut hanc causam obtineremus obtineremus P S b 2a: obtinerem M m , lege recitata perorassem. neque me illa oratio commovet commovet P : commoveret M m a , quod ait Attius indignum esse facinus, si senator iudicio quempiam quempiam P Sy2 a: quemquam M m circumvenerit, legibus eum teneri; si eques Romanus hoc idem fecerit, non teneri. 
146	Vt tibi sibi Sy2 a concedam hoc indignum esse quod cuius modi sit iam videro, tu mihi concedas necesse est multo esse indignius in ea civitate quae legibus contineatur contineatur P Sy2 a: teneatur M m discedi ab ab P : a M m a legibus. hoc enim vinculum est huius dignitatis qua fruimur in re publica, hoc fundamentum libertatis, hic fons aequitatis; mens et animus et consilium et sententia civitatis posita est in legibus. Vt corpora nostra sine mente, sic sic ita Quintil. v. 11. 25 civitas sine lege suis partibus ut ut om. S Bs ( contra Quintil. ) nervis ac sanguine et et sanguine P ( contra Quintil. ) membris uti non potest. legum ministri magistratus, legum et legum S B y2 a interpretes iudices, legum denique legum denique M m a: LEGIB. NIQ. P : legibus denique Baiter idcirco omnes servi sumus servi sumus M m a: servimus P ut liberi esse possimus. 
147	quid est, Q. Quinto Naso, cur tu in isto loco sedeas? quae vis est qua abs te hi iudices iudices hi S tali dignitate praediti coerceantur? vos autem, iudices, quam ob rem ex tanta multitudine civium tam pauci de hominum fortunis sententiam fertis? quo iure Attius quae voluit dixit? cur mihi tam diu potestas dicendi datur? quid sibi autem illi illi om. S a scribae, quid lictores, quid ceteri quos apparere huic quaestioni video volunt? opinor haec omnia lege fieri totumque hoc iudicium, ut ante ante P S a: antea M m dixi, quasi mente quadam regi legis et administrari. quid ergo ergo P Sy2 a: ergo est M m ? haec quaestio sola ita gubernatur? quid M. Marci Plaetori et et om. a C. Flamini inter sicarios, quid C. Gaii Orchivi peculatus, quid mea de pecuniis repetundis, quid C. Gaii Aquili apud quem nunc de ambitu de ambitu M m : ambitu S : ambitus y2 a causa dicitur, quid reliquae quaestiones? circumspicite omnis rei publicae partis; omnia legum imperio et praescripto fieri videbitis. 
148	si quis quis s a: qui S Mb y apud me, T. Titi Atti T. Acci, te S a: te, T. Acci M m , te reum velit facere, clames te lege pecuniarum repetundarum non teneri; neque haec tua recusatio confessio sit captae pecuniae sed laboris et et S a: sed M m periculi non legitimi declinatio. nunc quid agatur et quid abs te iuris constituatur vide. iubet lex ea, qua ea in qua S lege haec quaestio constituta est, iudicem quaestionis, hoc est Q. Quintum Voconium coniunctum post iudicibus add. y2 , ante cum b2s , cum eis iudicibus qui ei obvenerint — vos appellat, iudices — quaerere de veneno. in quem quaerere? infinitum est. Quicumque fecerit, vendiderit, emerit emerit om a , habuerit, dederit. quid eadem lex statim adiungit? recita. Deque eius capite quaerito. cuius ? qui coierit coierit coegerit S , convenerit? non ita est. quid quid quid id Sy2 s ergo est? dic. Qui tribunus militum legionibus quattuor primis, quive quaestor quaestor S : quaestores cett. , tribunus plebis — deinceps deinceps deinde S a omnis magistratus nominavit — quive in senatu sententiam dixit, dixerit. quid tum quid tum S M : qui tum m a ? Qui eorum coiit, coierit, convenit, convenerit quo quis iudicio publico condemnaretur condemnetur S . ' qui eorum'? quorum? videlicet qui supra scripti sunt. quid intersit intersit a a: interest M m utro modo scriptum sit, etsi est apertum, ipsa tamen lex nos ipsa tamen lex nos S a: tamen ipsa lex ( add. nos b 2) M m docet. Vbi enim omnis mortalis adligat, ita loquitur: ' Qui venenum malum fecit, fecerit. ' omnes viri, mulieres, liberi, servi in iudicium vocantur. si idem idem a a: item M m de coitione voluisset, adiunxisset: ' Quive coierit. ' nunc ita est: Deque eius capite quaerito qui magistratum habuerit quive quive in M s : inve b y t : in s in senatu sententiam dixerit, qui eorum coiit, coierit. num is est Cluentius? 
149	certe non est. quis ergo est Cluentius? qui tamen defendi causam suam lege noluit noluit S t : nolit cett. . itaque abicio legem, morem Cluentio gero. tibi tamen, Atti, pauca quae ab huius causa seiuncta sunt respondebo. est enim quiddam in hac causa quod Cluentius ad se, est aliquid quod ego ad me putem pertinere. hic sua putat interesse se se om. S a re ipsa et gesto negotio, non lege defendi; ego autem mea existimo interesse me nulla in disputatione ab Attio videri esse superatum. non enim mihi haec causa sola dicenda est dicenda est hinc defic.M s usque ad quae tunc §154, lac. supplet S in pag. dimidiata, supplem. in textu hab. b xy a ; omnibus hic labor meus propositus est quicumque hac facultate defensionis contenti esse possunt. nolo quemquam eorum qui adsunt existimare me quae de lege ab Attio dicta sunt sint S mg. , si reticuerim, comprobare. quam ob rem, Cluenti, de te tibi obsequor; neque ego ego enim t legem recito neque hoc loco pro te dico, sed ea quae a a (ad y1 ) me desiderari b 1 xy1 : te a me desiderari S b 2: te a me desiderare y2 a me desiderari arbitror non relinquam.
150	iniquum tibi videtur, Atti, esse non isdem legibus omnis teneri. primum , ut id iniquissimum esse confitear, eius modi est ut commutatis eis eis eos S : fort. ideo opus sit legibus, non ut his quae sunt non pareamus. deinde quis umquam hoc senator recusavit ne recusavit ne Baiter : accusavit ut codd. , cum cum quo Lambinus altiorem gradum dignitatis beneficio populi Romani esset consecutus, eo se putaret durioribus legum condicionibus uti oportere? quam multa sunt commoda quibus caremus, quam multa molesta et et S a: ac b xy difficilia quae subimus! atque haec omnia tamen tamen S , Lambinus : tantum cett. honoris et amplitudinis commodo compensantur. converte nunc ad equestrem ordinem atque in ceteros ordines easdem vitae condiciones; non perferent. putant enim minus multos sibi laqueos legum et condicionum ac iudiciorum propositos esse oportere qui summum qui in summum plures dett. locum civitatis aut non potuerunt ascendere aut non petiverunt. 
151	atque ut omittam leges alias omnis quibus nos tenemur, ceteri autem sunt ordines liberati, hanc ipsam legem: ' ne quis iudicio circumveniretur ,' C. Gaius Gracchus tulit; eam legem pro plebe, non in plebem tulit. postea L. Lucius Sulla, homo a populi causa remotissimus, tamen, cum eius rei quaestionem hac ipsa lege constitueret qua vos hoc tempore iudicatis, populum Romanum quem ab hoc genere liberum acceperat adligare novo quaestionis genere ausus non est. quod si fieri posse existimasset, pro illo odio quod habuit in equestrem ordinem nihil fecisset libentius quam omnem illam acerbitatem proscriptionis suae qua est usus qua est usus Manutius : questus codd. in veteres iudices in hanc unam quaestionem contulisset obtulisset b1 y1 . 
152	nec nunc quicquam agitur — mihi credite, iudices, et prospicite id quod providendum est — nisi ut equites Romani equites Romani codd. Lambini : eques R. S b1 xy1 : equester ordo b2 y2 a in huiusce legis periculum concludantur concludantur codd. Lambini : concludatur Sy2 a : includatur b xy1 ; neque hoc agitur ab omnibus sed a paucis. nam ei senatores qui se facile tuentur integritate et innocentia, quales, ut vere vere b y2 : vero cett. dicam, vos estis et ceteri qui sine cupiditate vixerunt, equites ordini senatorio dignitate proximos, concordia coniunctissimos esse cupiunt; sed ei qui sese volunt posse omnia neque praeterea quicquam esse aut in homine ullo aut in ordine, hoc uno metu se putant equites Romanos in potestatem suam potestatem suam Manutius : potestate sua codd. sit Lambinus : est codd. redacturos, si constitutum sit ut de eis qui rem iudicarint iudicarint Manutius : iudicarent codd. huiusce modi iudicia fieri possint. vident enim auctoritatem huius ordinis confirmari, vident iudicia comprobari; hoc metu proposito evellere se aculeum severitatis vestrae posse confidunt. 
153	quis enim de homine audeat paulo maioribus opibus praedito vere et fortiter iudicare, cum videat sibi de eo quod coierit aut consenserit causam esse dicendam? O viros fortis, equites Romanos, qui homini clarissimo ac potentissimo, M. Marco Druso, tribuno plebis, restiterunt restiterunt b2 y2 a : restituerunt (-u- S ) cett. , cum cum ed. Hervag. : quam cum codd. ille nihil aliud ageret cum illa cuncta quae tum erat nobilitate tum erat nobilitate ed. Hervag. : tum (cum S ) erant nobilitatis codd. , nisi ut ei qui ut ii qui b2, Halm : uti qui g2 , Manutius : utique cett. rem iudicassent huiusce modi quaestionibus in iudicium vocarentur! tum C. Gaius Flavius tum Müller : tunc codd. pusio , Cn. Gnaeus Titinius, C. Gaius Maecenas, illa robora populi Romani, ceterique eiusdem eiusdem Klotz : eiuscemodi (huiusce - b y ) codd. ordinis non fecerunt idem quod nunc Cluentius, ut aliquid culpae suscipere se putarent recusando, sed apertissime repugnarunt, cum et recusarent et recusarent Manutius : haec recusarent codd. : haec reputarent Madvig et palam fortissime atque honestissime dicerent, se potuisse iudicio populi Romani in amplissimum locum pervenire, si sua studia ad honores petendos conferre voluissent. sese vidisse in ea vita qualis splendor inesset, quanta ornamenta, quae dignitas; quae se non contempsisse sed ordine suo patrumque suorum contentos fuisse et vitam illam tranquillam et quietam, remotam a procellis invidiarum et huiusce modi iudiciorum sequi maluisse. 
154	aut sibi ad honores petendos aetatem integram restitui oportere aut, quoniam id non posset, eam condicionem vitae quam secuti secuti Angelius : secum codd. petitionem reliquissent manere. iniquum esse eos qui honorum ornamenta propter periculorum multitudinem praetermisissent populi beneficiis esse privatos, iudiciorum novorum periculis non carere. senatorem hoc queri non posse, propterea quod ea condicione proposita petere coepisset quodque permulta essent ornamenta quibus eam mitigare molestiam posset, locus, auctoritas, domi splendor, apud splendor apud splendore S B exteras nationes nomen et gratia, toga toga Naugerius : toga et codd. praetexta, sella curulis, insignia, fasces, exercitus, imperia, provinciae; quibus in rebus cum summa cum summa b1 x : consumma Sy1 t : summum b y2 s recte factis maiores nostri praemia tum praemia tum Orelli : premixtum S b1 xy t : praemium b2 y2 s plura peccatis pericula proposita esse voluerunt. illi non hoc recusabant ne ea ne ea S a : ea ne b xy lege accusarentur qua nunc habitus accusatur, quae tunc tunc S a : tum M m erat Sempronia, nunc est Cornelia — intellegebant enim ea lege equestrem ordinem non teneri — sed ne nova lege adligarentur laborabant. 
155	habitus ne hoc quidem umquam recusavit quo minus vel ea ea ex S a lege rationem vitae suae redderet qua non teneretur teneretur M m : tenetur S a . quae si vobis condicio placet, omnes id agamus ut haec quam primum in omnis ordines quaestio perferatur. interea quidem, per deos immortalis! quoniam omnia commoda nostra, iura, libertatem, salutem denique legibus obtinemus, a legibus non recedamus, simul et illud quam sit iniquum cogitemus, populum Romanum aliud nunc agere, vobis rem remque Sy2 since M m : se sine a a: ipsum sine Manutius publicam et fortunas suas commisisse, sine cura esse, non metuere ne lege ea quam numquam ipse iusserit et quaestione qua se solutum liberumque esse arbitretur arbitretur S a: arbitraretur M m per paucos iudices astringatur. 
156	agit enim sic causam T. Titus Attius, adulescens bonus et disertus, omnis civis legibus teneri omnibus; vos vos (ius) auditis et attenditis S : vos attenditis et auditis cett. auditis et attenditis silentio, sicut facere debetis. A. Aulus Cluentius, eques Romanus, causam dicit causam dicit eques Rom. a ea lege, qua lege qua lege M m : qua S a senatores et ei qui magistratum habuerunt soli tenentur; mihi per eum recusare et in arce legis praesidia constituere defensionis meae non licet. si obtinuerit causam Cluentius, sicuti vestra aequitate nixi confidimus, omnes existimabunt, id quod erit, obtinuisse propter innocentiam, quoniam ita defensus sit; in lege autem quam attingere noluerit praesidi nil fuisse. 
157	hic nunc est quiddam quoddam a quod ad me pertineat, de quo ante dixi, quod ego populo Romano praestare debeam, quoniam is meae vitae vitae meae a status est ut omnis mihi cura et et S a: atque M m opera posita sit in hominum periculis defendendis. video quanta et quam periculosa et quam infinita quaestio temptetur ab accusatoribus, cum eam legem quae in nostrum ordinem scripta sit in populum Romanum transferre conentur. qua in lege est: ' qui coierit ,' quod quam late pateat videtis. ' convenerit '; aeque incertum et infinitum incertum et infinitum S a: infinitum et incertum M m est. ' consenserit '; hoc vero cum infinitum tum obscurum et occultum occultum S a: occultum est M m . ' falsumve testimonium dixerit '; quis de plebe Romana testimonium dixit dixerit S a umquam cui non hoc periculum T. Tito Attio auctore paratum esse videatis? nam dicturum quidem certe, si hoc iudicium plebi Romanae propositum sit, neminem umquam esse confirmo. 
158	sed hoc polliceor omnibus, si cui forte hac lege negotium facessetur facesseret s qui lege non teneatur, si is uti me defensore voluerit, me eius causam legis praesidio defensurum et vel his iudicibus vel horum similibus facillime probaturum, et omni me defensione usurum esse legis, qua nunc ut utar ab eo cuius voluntati mihi obtemperandum est non conceditur. non enim debeo dubitare, iudices, quin, si qua ad vos causa eius modi delata sit eius qui lege non teneatur, etiam si is invidiosus aut multis offensus esse videatur, etiam si eum oderitis, etiam si inviti absoluturi sitis, tamen absolvatis et religioni potius vestrae religionibus vestris (nostris s) S a quam odio pareatis. 
159	est enim sapientis iudicis iudicis meminisse se hominem add. b2 y2 a (? S ) cogitare tantum sibi a populo Romano esse permissum quantum commissum sit et creditum, et non solum sibi potestatem datam verum etiam fidem habitam esse meminisse; posse quem oderit absolvere, quem non oderit condemnare, et semper non quid ipse velit sed quid lex et religio cogat cogat om. a cogitare; animadvertere qua lege reus citetur, de quo reo cognoscat, quae res in quaestione versetur. cum haec sunt videnda, tum vero illud est hominis magni, iudices, atque sapientis, cum illam iudicandi causa tabellam sumpserit, non se reputare solum esse reputare solum esse S a: putare esse solum M m nec nec S b : neque cett. sibi quodcumque concupierit licere, sed habere in consilio legem, religionem, aequitatem, fidem; libidinem autem, odium, invidiam, metum cupiditatesque omnis amovere maximique maximique Manutius : maximeque codd. aestimare conscientiam mentis suae quam ab dis immortalibus accepimus, quae a a S bs : ab cett. nobis divelli non potest; quae si optimorum consiliorum atque factorum testis in omni vita nobis erit, sine ullo metu et summa cum honestate vivemus. 
160	haec si T. Titus Attius aut cognovisset aut cogitasset, profecto ne conatus quidem esset dicere, id quod multis verbis egit, iudicem quod ei videatur statuere et non devinctum legibus esse oportere. quibus de rebus mihi pro Cluenti voluntate nimium, pro rei rei S a: rei publicae M m dignitate parum, pro vestra prudentia satis dixisse videor. reliqua perpauca sunt; quae quia vestrae quaestionis erant, idcirco illi statuerunt fingenda esse sibi fingenda esse sibi a ( S ?): sibi fingenda esse M m et proferenda ne omnium turpissimi reperirentur, si in iudicium nihil praeter invidiam attulissent. atque ut existimetis me necessario me necessario S a: necessario me M m de his rebus de quibus iam dixerim pluribus egisse verbis, attendite reliqua; profecto intellegetis ea quae paucis demonstrari potuerint potuerint S a: potuerunt M m brevissime esse defensa. 
161	Cn. Gnaeo Decidio Decidio b y a ( cf. C. I. L. 1187. 8): Decitio M : Decio s ( cf. Tac. Dial. 21) Samniti, ei qui proscriptus est, iniuriam in calamitate eius ab huius familia factam esse dixit dixit S a: dixisti M m : dixistis Manutius a nullo Bs . ab nullo ille liberalius quam a Cluentio tractatus est. huius illum opes in rebus eius incommodissimis sublevarunt, atque hoc cum ipse tum omnes eius amici necessariique omnes eius amici necessariique ( om. omnes s ) S M m : eius amici necessariique omnes a cognorunt. Anchari et Paceni pastoribus huius vilicos villicos S , Sylvius : villicum cett. vim et manus attulisse. cum quaedam in callibus callibus Ernesti : collibus M m a , ut solet, controversia pastorum esset orta, habiti vilici rem domini et privatam possessionem defenderunt. cum esset expostulatio facta, causa illis demonstrata sine iudicio controversiaque discessum est. 
162	P. Publii Aeli testamento propinquus exheredatus cum esset, heres hic alienior institutus est. P. Publius Aelius habiti merito fecit, neque hic in testamento faciendo interfuit, idque testamentum ab huius inimico Oppianico est obsignatum. Floro Floro S a: Florio M m legatum ex testamento infitiatum esse. non est ita; sed cum HS xxx XXX ] sexcenta triginta S scripta essent pro HS xxxx XXXX S : XXX M : CCC m a neque ei cautum satis cautum satis S a: satis cautum M m videretur, voluit eum aliquid acceptum referre liberalitati suae. primo deberi deberi M m : debere a negavit, post sine controversia solvit. Cei Cei Sy2 a: GN. M m cuiusdam Samnitis uxorem post bellum ab hoc esse repetitam. mulierem cum emisset a a S a: de M m sectoribus, quo tempore eam primum liberam esse audivit, sine iudicio reddidit Ceio Ceio a: Celo (-io m ) M m . 
163	Ennium esse quendam cuius bona teneat habitus . est hic Ennius egens quidam calumniator, mercennarius Oppianici, qui permultos annos quievit; deinde aliquando cum servis servis a: servi S : servo M m habiti furti egit, nuper ab ipso habito petere coepit. hic illo illo fort. in illo privato iudicio, mihi credite, vobis nobis ed. V isdem fortasse patronis calumniam non effugiet. atque etiam, ut nobis renuntiatur, hominem multorum hospitum hospitem S a , A. Aulum Bivium A. Bivium S Ms : A. Brivium b y : Ambivium t quendam, coponem de via Latina, subornatis qui sibi a Cluentio servisque eius in taberna sua manus adlatas esse dicat. quo de homine nihil etiam nunc dicere nobis est necesse. si invitaverit, id quod solet, sic hominem accipiemus ut moleste ferat se de via decessisse. 
164	habetis , iudices, quae in totam causam causam a a: vitam M m de moribus A. Auli Cluenti quem illi invidiosum esse reum volunt esse reum volunt S a: reum (re niti b2 y2 ) volunt esse M m annos octo meditati accusatores conlegerint collegerint S : collegerunt cett. , quam levia genere ipso, quam falsa re, quam brevia responsu responsu M s : responso a a: responsa b1 y1 ! cognoscite nunc id quod ad vestrum ius iurandum pertinet, quod vestri iudici est, quod vobis oneris imposuit ea lex qua coacti huc convenistis, de criminibus veneni, ut omnes intellegant quam paucis verbis haec causa perorari potuerit, et quam multa a me dicta sint quae ad huius voluntatem maxime, ad vestrum iudicium minime pertinerent. 
165	obiectum est C. Gaium Vibium C. om. a capacem Capacem M m : Capacum S : Cappadocem b2 y2 a ab hoc A. Aulo Cluentio veneno esse sublatum. opportune adest homo summa fide et omni virtute praeditus Pretorius S a , L. Lucius Plaetorius, senator qui illius Vibi hospes fuit et familiaris. apud hunc ille Romae habitavit, apud hunc aegrotavit, huius domi est mortuus. at at (aut M ) heres est Cluentius M s : om. b y a heres est Cluentius. intestatum dico esse esse dico S mortuum possessionemque eius bonorum ex edicto praetoris ex edicto praetoris y2 a (? S ): praetoris edicto M m huic illius sororis filio, adulescenti pudentissimo et in primis honesto, equiti Romano, datam, N. Numerio Cluentio quem videtis. 
166	alterum venefici crimen Oppianico huic adulescenti, cum eius in nuptiis more Larinatium multitudo hominum pranderet, venenum habiti consilio paratum; id cum daretur in mulso, Balbutium quendam, eius familiarem, intercepisse, bibisse, statimque esse mortuum. hoc ego si sic agerem tamquam mihi crimen esset diluendum, haec pluribus verbis verbis om. Quintil. ix. 2. 48 dicerem per per a a: om. M m quae nunc paucis percurrit oratio mea. 
167	quid umquam habitus in se admisit ut hoc tantum ab eo facinus non abhorrere videatur? quid autem magno opere Oppianicum metuebat, cum ille verbum omnino in hac ipsa causa nullum facere potuerit, huic autem accusatores viva matre viva matre S a: matre viva M m deesse non possint possint S a: possent M m ? id id S a: om. M m quod iam intellegetis. an ut de causa eius periculi nihil decederet, ad causam novum crimen accederet? quod autem tempus veneni dandi illo die, illa illa S a, Quintil. : in illa M m frequentia? per quem porro porro deinde Quintil. datum? unde sumptum? quae deinde interceptio poculi? cur non de integro autem datum? multa sunt quae dici possunt, sed non committam ut videar non dicendo voluisse dicere; res enim enim S a: enim iam M m se ipsa defendit defendit S a: defendat M m : defendet C. Stephanus . 
168	nego illum adulescentem quem statim epoto poculo mortuum esse dixistis omnino illo die esse mortuum. Magnum crimen crimen a a: om. M m et impudens mendacium! perspicite cetera. dico illum, cum ad illud prandium crudior venisset et, ut aetas illa illa om. S B fert, sibi tamen tamen ed. V : tum M m a non pepercisset, aliquot dies aegrotasse et ita esse mortuum. quis quis qui S huic rei testis est? idem qui sui luctus, pater; pater, inquam, illius adulescentis, quem quem ad (ad s ) quem S a propter animi dolorem pertenuis suspicio potuisset ex illo loco loco luctu Sylvius testem in A. Aulum Cluentium constituere, is hunc hunc M m : nunc S a suo testimonio sublevat; quod recita. tu autem, nisi molestum est, paulisper exsurge; perfer hunc dolorem commemorationis necessariae, in qua ego diutius non morabor quoniam, quod fuit viri optimi, fecisti ut ut S b y a : uti M s ne cui innocenti maeror tuus calamitatem et falsum crimen adferret adferret adderet S : adduceret s .
169	Vnum etiam mihi reliquum eius modi crimen est, iudices, ex quo illud perspicere possitis quod a me initio orationis meae dictum est, quicquid mali per hosce hosce S a: hos M m annos A. Aulus Cluentius viderit, quicquid hoc tempore habeat habeat M m : habuit S a: habuerit Klotz sollicitudinis ac negoti, id omne a matre esse conflatum. Oppianicum veneno necatum esse quod ei datum sit in pane per M. Marcum Asellium quendam, familiarem illius, idque habiti consilio factum esse dicitis. in quo primum illud quaero quae causa habito fuerit cur interficere Oppianicum vellet. inimicitias enim enim S a: enim inter ipsos M m fuisse confiteor; sed homines inimicos suos morte adfici volunt aut quod eos eos S a: om. M m metuunt aut quod oderunt. 
170	quo tandem igitur habitus metu adductus tantum in se facinus suscipere conatus est? quid erat quod iam Oppianicum poena adfectum pro maleficiis et eiectum e civitate quisquam timeret? quid metuebat? ne oppugnaretur a perdito, an ne accusaretur a damnato damnato Sy2 a : condemnato M m , an ne exsulis testimonio laederetur? si si S a: sin M m autem quod oderat habitus inimicum inimicum a a: om. M m , idcirco illum vita frui noluit, adeone erat stultus ut illam quam tum ille vivebat vitam esse arbitraretur, damnati, exsulis, deserti ab omnibus, quem propter animi importunitatem nemo recipere tecto, nemo adire adire Naugerius : audire M m , nemo adloqui, nemo aspicere aspicere S a: respicere M m vellet? 
171	huius igitur habitus vitae Habitus vitae S a: vitae Habitus M m invidebat? hunc si acerbe et penitus oderat, non eum quam diutissime vivere velle debebat? huic mortem maturabat inimicus, quod illi unum in malis erat perfugium calamitatis? qui si quid animi et et S a: ac M m virtutis habuisset, ut multi saepe fortes viri in eius modi dolore, mortem sibi ipse conscisset, huic quam ob rem id vellet inimicus offerre quod ipse sibi optare deberet? nam nunc quidem quid tandem illi mali mors attulit? nisi forte ineptiis ac ineptiis ac (atque b y ) M m : ineptis a ad S a: apud M m fabulis ducimur ut existimemus illum ad inferos impiorum supplicia perferre ac pluris illic offendisse inimicos quam hic reliquisse, a a M s : ab S : an b y a socrus, ab uxorum ab uxorum M m : an uxoris b2 y2 a , a fratris, a a fratris a M m : an fratris an ( om. an s ) b2 y2 a liberum Poenis actum esse praecipitem in sceleratorum sedem atque atque M m : ac S a regionem. quae si falsa sunt, id quod omnes intellegunt, quid ei tandem aliud aliud ( om. aliud b ) mors eripuit M m : mors eripuit aliud s : eripuit mors t eripuit mors praeter sensum doloris? 
172	age vero, per quem venenum per quem venenum S a: venenum per quem M m datum? per M. Asellium. quid huic cum habito ? nihil , atque adeo ideo S s , quod ille Oppianico familiarissime est usus, potius etiam simultas. Eine igitur quem sibi offensiorem, Oppianico familiarissimum sciebat esse, potissimum et scelus suum scelus suum S ba : suum scelus M sy et illius periculum committebat? cur igitur igitur a a: deinde M m tu qui pietate ad accusandum excitatus es hunc Asellium esse inultum tam diu sinis? cur non habiti exemplo usus es ut per illum qui attulisset venenum de hoc praeiudicaretur? 
