1	animum adverti animum adverti S s : animadverti cett. ( cf. Cael. 7) , iudices, omnem accusatoris orationem in duas divisam esse partis partis B y2 a: partes M m , quarum altera mihi niti et magno opere confidere videbatur videatur P invidia iam inveterata iudici Iuniani, altera alteram P S tantum modo consuetudinis causa timide et diffidenter attingere rationem venefici criminum, qua de re lege est haec quaestio constituta. itaque mihi certum est hanc eandem distributionem invidiae et criminum sic in defensione servare ut omnes intellegant nihil me nec subterfugere voluisse reticendo nec obscurare dicendo. 
2	sed cum considero quo modo mihi in utraque re sit elaborandum, altera pars et ea pars et ea P : pars est ( om. est s ) ea S M m a quae propria est iudici vestri et legitimae venefici quaestionis per mihi brevis et non magnae in dicendo contentionis fore videtur, altera autem quae procul ab ab P S bt : a M sy s iudicio remota est, quae contionibus seditiose concitatis accommodatior est quam tranquillis moderatisque iudiciis, perspicio quantum in agendo difficultatis et quantum laboris sit habitura. 
3	sed in hac in hac P S a: in hac tanta M m difficultate illa me res tamen, iudices, consolatur quod vos de criminibus sic audire consuestis ut eorum omnium omnium P : omnem M m a dissolutionem ab oratore quaeratis, ut non existimetis plus vos ad salutem reo largiri oportere quam quantum defensor purgandis criminibus consequi et dicendo probare potuerit. de invidia autem sic inter nos nos PBM : vos m a disceptare debetis ut non quid dicatur a nobis sed quid oporteat dici consideretis. agitur enim in criminibus A. Auli Cluenti proprium periculum, in invidia causa communis. quam ob rem alteram partem causae sic agemus ut vos doceamus, alteram sic ut oremus; in altera diligentia vestra nobis adiungenda est, in altera fides imploranda. nemo est enim qui invidiae sine vestro ac sine talium virorum subsidio possit resistere. 
4	equidem quod ad me attinet, quo me vertam nescio nescio iudices nescio Mart. Cap. ( Rhet. M. p. 478), Aquila Rom. ( Rhet. M. p. 25), contra Quintil. ix. 2.19 . negem fuisse illam illam om. Quintil. infamiam iudici corrupti? negem esse illam rem agitatam in contionibus, iactatam in iudiciis, commemoratam in senatu? evellam ex animis hominum tantam opinionem, tam penitus insitam, tam vetustam? non est non est non Quintil. ix. 3. 81 nostri ingeni, vestri auxili est, iudices, huius innocentiae sic in hac calamitosa fama quasi in aliqua perniciosissima flamma atque in communi incendio subvenire. 
5	etenim sicut aliis in locis parum firmamenti et parum virium veritas habet, sic in hoc loco falsa invidia imbecilla esse debet. dominetur in contionibus, iaceat in iudiciis; valeat in opinionibus ac sermonibus imperitorum, ab ingeniis prudentium repudietur; vehementis habeat repentinos impetus, spatio interposito et causa cognita consenescat; denique illa definitio iudiciorum aequorum quae nobis a maioribus tradita est retineatur, ut in iudiciis in iudiciis om. Quintil. ix. 3. 85 et sine invidia culpa plectatur et sine culpa invidia ponatur ponatur M m : puniatur b2 y2 a . 
6	quam ob rem a vobis, iudices, ante quam de ipsa causa dicere incipio, haec postulo, primum id quod aequissimum est ut ne quid huc huc M sy : huic S b y2 a praeiudicati praeiudicii B adferatis — etenim non modo auctoritatem sed etiam nomen iudicum amittemus, nisi hic ex ipsis causis iudicabimus, si si b2 y2 a: ac si M m ad causas iudicia iam facta domo deferemus; — deinde referemus S a si quam opinionem iam vestris mentibus comprehendistis, si eam ratio convellet, si oratio oratio a a: ratio M m labefactabit, si denique veritas extorquebit, ne repugnetis eamque animis vestris aut libentibus aut aequis remittatis; tum autem cum ego una quaque de re dicam et diluam, ne ipsi quae contraria sint sint P S s : sunt ( om. t ) cett. taciti cogitationi vestrae subiciatis sed ad sed ad sed S a extremum exspectetis meque meque P, Grillius ( Rhet. M. p. 599): me S a: et me M m meum dicendi ordinem servare patiamini; cum peroraro, tum peroraro tum Pb2 y2 s : perorabo tum S : per... tum t : peroraro M : peroratum fuerit (erit y ) b1 y1 : peroratum s si quid erit praeteritum animo animo a me mg. Ascens. (3) requiratis.
7	ego me, iudices, ad eam causam accedere quae iam per annos octo continuos ex contraria parte audiatur atque ipsa opinione opinionibus S t hominum tacita prope convicta atque damnata sit facile intellego; sed si qui si qui P S a: si quis M m mihi deus vestram ad me audiendum benivolentiam conciliarit, efficiam profecto ut intellegatis nihil esse homini tam timendum quam invidiam, nihil innocenti suscepta invidia tam optandum quam aequum iudicium, quod in hoc uno denique falsae infamiae finis aliqui aliqui S Mt : aliquis m s atque exitus reperiatur. quam ob rem magna me spes tenet, si quae quae S a: ea quae M m sunt in causa explicare atque omnia dicendo consequi potuero, hunc locum consessumque vestrum, quem illi horribilem A. Aulo Cluentio ac formidolosum fore putaverunt, eum tandem tandem tantundem S B eius fortunae miserae multumque iactatae portum ac perfugium futurum. 
8	tametsi permulta sunt quae mihi, ante quam de causa dico, de communibus invidiae periculis dicenda esse videantur, tamen ne diutius oratione mea suspensa exspectatio vestra teneatur adgrediar ad crimen cum illa deprecatione, iudices, qua mihi saepius utendum esse intellego, sic ut me audiatis, quasi hoc tempore haec causa primum dicatur, sicuti dicitur sicuti dicatur S a , non quasi saepe iam dicta et numquam probata sit. hodierno enim die primum veteris istius ipsius S a criminis diluendi potestas est data, ante hoc tempus error in hac causa atque invidia versata est. quam ob rem, dum multorum annorum accusationi breviter dilucideque respondeo, quaeso ut me, iudices, sicut sicut S a: sicuti M m facere instituistis, benigne attenteque audiatis.
9	corrupisse dicitur A. Aulus Cluentius iudicium pecunia, quo inimicum inimicum S a: inimicum suum M m innocentem, Statium Albium Abbium S , condemnaret. ostendam , iudices, primum, quoniam caput illius illius caput S a atrocitatis atque invidiae fuit innocentem pecunia circumventum, neminem umquam maioribus criminibus gravioribus testibus esse in iudicium vocatum; deinde ea de eo praeiudicia esse facta ab ipsis iudicibus a quibus condemnatus est ut non modo ab isdem sed ne ab aliis quidem ullis absolvi ullo modo posset. cum haec docuero, tum illud ostendam quod maxime requiri intellego iudicium illud pecunia esse temptatum non a Cluentio sed contra Cluentium, faciamque ut intellegatis in tota illa causa quid res ipsa tulerit, quid error adfinxerit, quid invidia conflarit. 
10	primum igitur illud est ex quo intellegi possit debuisse Cluentium magno opere causae confidere, quod certissimis criminibus et testibus fretus ad accusandum descenderit descendit coni. Müller . hoc loco faciendum mihi, iudices, est ut vobis breviter illa quibus Albius Albius M sy : Abbius S : Albinus bs est condemnatus crimina exponam. abs te peto, Oppianice, ut me invitum de patris tui causa dicere existimes adductum fide atque officio defensionis. etenim tibi si in praesentia praesentia S a: praesentia satis facere M m non potuero, tamen multae mihi ad satis faciendum reliquo tempore facultates dabuntur; Cluentio nisi nisi ni a nunc satis fecero, postea mihi satis faciendi potestas non erit. simul et illud quis est qui dubitare debeat contra damnatum et mortuum pro incolumi et pro et pro Mb2 y a: et b1 s vivo dicere? cum illi in quem dicitur damnatio omne ignominiae periculum iam abstulerit, mors vero etiam doloris; hic hic a a: huic M m autem pro quo dicimus dicimus S a: dicitur M m nihil possit offensionis accipere accipere a a: accedere M m sine acerbissimo animi sensu ac molestia molestia a a: dolore M m et sine summo dedecore vitae et turpitudine et turp. S a: ac turp. M m . 
11	atque ut intellegatis Cluentium non accusatorio animo, non ostentatione aliqua aut gloria adductum, sed nefariis iniuriis, cotidianis insidiis, proposito ante oculos vitae periculo nomen Oppianici detulisse, paulo longius exordium rei demonstrandae petam repetam Quintil. iv. 1. 79 ; quod quaeso, iudices, ne moleste patiamini; principiis enim cognitis multo facilius extrema intellegetis. A. Aulus Cluentius habitus fuit, pater huiusce, iudices, homo non solum municipi Larinatis ex quo erat sed etiam regionis illius et vicinitatis virtute, existimatione, nobilitate princeps princeps Ba, Quintil. iv. 2. 130: facile princeps M m . is cum esset mortuus Sulla et Pompeio consulibus, reliquit hunc annos xv natum, grandem autem et nubilem filiam quae brevi tempore post patris mortem nupsit A. Aulo Aurio Melino, consobrino suo, adulescenti in primis, ut tum habebatur, inter suos et honesto et nobili. cum essent eae eae s : hae (hec b ) M m nuptiae plenae dignitatis, 
12	plenae concordiae, repente est exorta mulieris importunae nefaria libido non solum dedecore verum etiam scelere coniuncta. nam Sassia, mater huius habiti — mater enim a me in omni causa in omni causa S a: nominis causa M m : om. Quintil. Declam. 388 , tametsi in hunc hostili odio et crudelitate est, mater, inquam, appellabitur, neque umquam illa ita de suo scelere et immanitate audiet ut naturae nomen amittat; quo enim est ipsum nomen amantius indulgentiusque maternum, hoc illius matris quae multos iam annos et nunc cum maxime filium interfectum cupit singulare scelus maiore odio dignum esse ducetis ducetis M m : iudicabitis y2 s (? S ) . ea igitur mater habiti , Melini illius adulescentis, generi sui, contra quam fas erat amore capta primo, neque id ipsum diu, quoquo modo poterat in illa cupiditate continebatur continebat a: se continebat Baiter ; deinde ita flagrare coepit amentia, sic inflammata ferri libidine ut eam non pudor non pudor S Ba : non pudor, non pudicitia M m , non pietas, non macula familiae, non hominum fama, non fili dolor, non filiae maeror a cupiditate revocaret. 
13	animum adulescentis nondum consilio ac ratione firmatum pellexit eis omnibus rebus quibus illa aetas capi ac deleniri potest. filia , quae non solum illo communi dolore muliebri in eius modi viri iniuriis angeretur sed nefarium matris paelicatum ferre non posset de quo ne queri quidem se sine scelere se sine scelere S a, Arusian. ( K. vii. 504): sine scelere se M m posse arbitraretur, ceteros sui tanti mali ignaros esse cupiebat; in huius amantissimi sui fratris manibus et gremio maerore et lacrimis consenescebat. 
14	ecce autem subitum divortium quod solacium malorum omnium fore videbatur! discedit a Melino Cluentia ut in tantis iniuriis non invita, ut ut m a: aut S : at M a viro non libenter. tum vero illa egregia ac ac M sy : et ba praeclara mater palam exsultare laetitia, triumphare triumphare Ba : ac triumphare M m gaudio coepit, victrix filiae non libidinis; diutius diutius S a: itaque diutius M m suspicionibus obscuris laedi famam suam noluit; lectum illum genialem quem biennio ante filiae suae nubenti straverat, in eadem domo sibi ornari et sterni expulsa atque exturbata filia iubet. nubit genero socrus nullis auspicibus, nullis auctoribus, funestis ominibus omnium.
15	O mulieris scelus incredibile et praeter hanc hanc causam ( post unam b 2) add. a a unam in omni vita inauditum! o libidinem effrenatam et indomitam! o audaciam singularem! nonne timuisse timuisse M m , Quintil. iv. 2. 105: timuisti a a , si minus vim deorum hominumque famam, at illam ipsam noctem facesque illas nuptialis, non limen cubiculi, non cubile filiae, non parietes denique ipsos superiorum testis nuptiarum? perfregit ac prostravit omnia cupiditate ac furore; vicit pudorem libido, timorem audacia, rationem amentia. 
16	tulit hoc commune dedecus dedecus S a: dedecus iam M m familiae, cognationis, nominis graviter filius; augebatur autem eius molestia cotidianis querimoniis et adsiduo fletu sororis; statuit tamen nihil sibi in tantis iniuriis ac tanto scelere matris gravius esse esse a a: om. M m faciendum quam ut illa illa S a: illa matre M m ne uteretur, ne quae ne quae Garatoni : nam quae S a: ne quam M m videre sine summo animi dolore non poterat, ea, si matre uteretur, non solum videre verum verum Sy2 a: sed M m etiam probare suo iudicio putaretur. 
17	initium quod huic cum matre fuerit simultatis audistis. pertinuisse hoc ad causam tum tum S b 2a: tunc M m cum reliqua cognoveritis intellegetis. nam illud me non praeterit, cuiuscumque modi cuiuscumque modi a a: cuiusmodicumque M m sit mater sit mater S a: mater sit M m , tamen in iudicio fili de turpitudine parentis dici vix oportere. non essem ad ullam causam idoneus, iudices, si hoc quod in communibus hominum sensibus atque in ipsa in ipsa M m : ipsa S a natura positum atque infixum est, id ego, qui ad hominum hominum s a: omnium b2 y2 : amici b 1: animum M y1 pericula defendenda defendenda a (? S ): depellenda M m adiungerer adiungerer b2 y2 a: adhiberer M m , non viderem; facile intellego non modo reticere homines parentum iniurias sed etiam animo aequo ferre oportere. sed ego ea quae ferri possunt ferenda, quae taceri tacenda esse arbitror. 
18	nihil in vita vidit calamitatis A. Aulus Cluentius, nullum periculum mortis adiit, nihil mali timuit quod non totum a matre esset conflatum et profectum. quae hoc tempore sileret omnia atque ea, si oblivione non posset, tamen taciturnitate sua tecta esse pateretur; sed vero sed vero Sy a: sed vere b 2: sed ea vero Mb 1 s sic agitur agitur Sy1 s : agit M s t : angitur b2 y2 ut prorsus reticere reticeri a (? S ) nullo modo possit. hoc enim ipsum iudicium, hoc periculum, illa accusatio, illa illa accusatio, illa scripsi : illa accusatio M s a: haec accusatio Lambinus : del. Gulielmius omnis testium copia quae futura est a matre initio est adornata, a matre hoc tempore instruitur atque omnibus eius opibus et copiis comparatur. ipsa denique nuper Larino huius opprimendi causa Romam advolavit; praesto est mulier audax, pecuniosa, crudelis, instituit accusatores, instruit testis, squalore huius et sordibus laetatur, exitium exoptat, sanguinem suum profundere omnem cupit, dum modo profusum huius ante videat. haec nisi omnia perspexeritis in causa, temere a nobis illam appellari putatote; sin sin P S a: sin autem M m erunt et aperta et nefaria, Cluentio ignoscere debebitis debebitis P : debetis M m a , quod haec a me dici patiatur; mihi ignoscere non deberetis, si tacerem.
19	nunc iam summatim exponam quibus criminibus Oppianicus damnatus sit ut et constantiam A. Auli Cluenti et rationem accusationis perspicere possitis. ac primum causa accusandi quae fuerit ostendam ut id ipsum A. Aulum Cluentium vi ac necessitate coactum fecisse videatis. 
20	cum manifesto venenum deprehendisset quod vir matris Oppianicus ei paravisset, et res non coniectura sed oculis et manibus et man. Sy a: ac man. Mb s teneretur teneretur M m : retineretur b2 y2 a , neque in causa ulla dubitatio posset possit S esse, accusavit Oppianicum; quam constanter et quam diligenter postea dicam; nunc hoc scire vos volui volui vos S a , nullam huic aliam accusandi causam fuisse nisi uti uti M sy : ut S ba propositum vitae periculum et cotidianas capitis insidias hac una ratione vitaret vitaret M m : evitaret S a: devitaret B . atque ut intellegatis eis iis Manutius : his M m a accusatum esse criminibus Oppianicum ut neque accusator timere timeret a neque reus sperare debuerit debuerit M m : potuerit S a , pauca vobis illius iudici crimina exponam; quibus cognitis nemo vestrum mirabitur illum diffidentem rebus suis ad Staienum Staienum P S b2 y2 : Stalenum M m : Scaienum a atque ad pecuniam confugisse. 
21	Larinas quaedam fuit Dinaea, socrus Oppianici, quae filios habuit M. Marcum et N. Numerium Aurios M. et N. Aurios P : M. Aurium et Numerium Aurium a a: M. et Num. Aurios M m et Cn. Gnaeum Magium Cn. Numerium a a, ita mox et filiam magiam nuptam Oppianico. M. Marcus Aurius adulescentulus bello Italico captus apud Asculum in Q. Quinti Sergi senatoris, eius qui inter sicarios damnatus est, manus incidit et apud eum fuit in ergastulo in ergastulo fuit P . N. autem Aurius, frater eius, mortuus est heredemque Cn. Gnaeum Magium fratrem fratrem Pa : fratrem suum M m reliquit. postea magia , uxor Oppianici, mortua est. postremo unus qui reliquus erat Dinaeae filius Cn. Gnaeus Magius est mortuus mortuus est S ba . is heredem fecit heredem fecit P S a: fecit heredem M m illum adulescentulum adolescentulum S b 2 s : adolescentem cett. Oppianicum, sororis suae filium, eumque partiri cum Dinaea matre iussit. interim venit interim venit intervenit S a index ad Dinaeam neque obscurus neque incertus qui nuntiaret ei filium eius, M. Marcum Aurium, vivere et in agro Gallico esse in servitute. 
22	mulier amissis liberis, cum unius reciperandi fili reciperandi filii P S a: filii reciperandi M m spes esset ostentata, omnis suos propinquos filique sui necessarios convocavit et ab eis flens petivit ut negotium susciperent, adulescentem investigarent, sibi restituerent eum filium quem tamen unum ex multis fortuna reliquum esse voluisset. haec cum agere instituisset, oppressa morbo est. itaque testamentum fecit eius modi ut illi filio HS HS P: om. M m a CCCC P : CCCLIII M m : quadraginta a a cccc milia legaret, heredem institueret eundem illum Oppianicum, nepotem suum; atque eis iis Garatoni : his M m a diebus paucis est mortua mortua est S a . propinqui tamen illi, quem ad modum viva Dinaea instituerant, ita mortua illa ad investigandum M. Marcum Aurium M. S a: om. M m cum eodem illo indice in agrum Gallicum profecti sunt.
23	interim Oppianicus ut erat, sicuti sicut S a multis ex ex multis P rebus reperietis, singulari scelere et audacia, per quendam Gallicanum, familiarem suum, primum illum indicem pecunia corrupit, deinde ipsum M. Aurium M. Balter: om. M m a non magna iactura facta tollendum interficiendumque curavit. illi autem qui erant ad propinquum investigandum et reciperandum profecti litteras Larinum ad Aurios, illius adulescentis adolescentis P S a: adolescentis propinquos M m suosque necessarios, mittunt sibi difficilem esse investigandi rationem, quod quod cum S b 2a intellegerent indicem ab Oppianico esse corruptum. quas litteras A. Aulus Aurius A. M sy : M. b : om. P S a , vir fortis et experiens et domi nobilis et M. illius Auri perpropinquus perpropinquus P Sy2 t : propinquus M m s , in foro palam multis multis P Sy2 a: om. M m audientibus, cum adesset Oppianicus, recitat et clarissima voce se nomen Oppianici, si interfectum M. Marcum Aurium esse esse P S a: om. M m comperisset, delaturum esse testatur. 
24	interim brevi tempore illi qui erant in agrum Gallicum in Galliam a profecti Larinum revertuntur; interfectum et interfectum Sy2 a esse M. Marcum Aurium nuntiant nuntiant S a: renuntiant M m . animi non solum propinquorum sed etiam omnium Larinatium odio Oppianici et illius adulescentis misericordia commoventur. itaque cum A. Aulus Aurius is cum A. Aurius is S : cum Maurius is P : cum Aurius is s : cum is t : cum A. Aurius M m qui antea denuntiarat clamore hominem ac minis insequi coepisset, Larino profugit et se in castra clarissimi viri, Q. Quinti Metelli, contulit. 
25	post illam autem fugam autem fugam S a: fugam autem M m sceleris et conscientiae testem numquam se iudiciis, numquam legibus numquam se... legibus om. a, del. Baiter , numquam inermem inermen S b y a: inermum M s inimicis se inimicis S a committere ausus est sed per illam L. Lucii Sullae vim atque victoriam Larinum in summo timore omnium cum armatis advolavit; quattuorviros quos municipes fecerant sustulit; se a Sulla et alios praeterea tris alios praetera tres ( om. praeterea b 1) M m : tres praeterea a factos esse dixit et ab eodem sibi esse imperatum ut A. A. Halm: om. M m a Aurium illum qui sibi delationem nominis et capitis periculum ostentarat, et alterum A. A. Mommsen: om. M m a Aurium et eius L. filium et Sex. Vibium quo sequestre in illo indice corrumpendo dicebatur esse usus, proscribendos interficiendosque curaret. itaque illis crudelissime interfectis non mediocri ab eo ceteri proscriptionis et mortis metu terrebantur tenebantur a . his rebus in causa iudicioque patefactis quis est qui illum absolvi potuisse arbitretur arbitretur Weiske : arbitraretur M m a ? atque haec parva sunt; cognoscite reliqua ut non aliquando condemnatum esse Oppianicum sed aliquam diu incolumem fuisse miremini. 
26	primum videte hominis audaciam. Sassiam in matrimonium ducere, habiti matrem — illam cuius virum A. A. om. S a Aurium occiderat — concupivit. Vtrum impudentior hic qui postulet, an crudelior illa, si nubat, difficile dictu est; sed tamen utriusque humanitatem constantiamque cognoscite. 
27	petit Oppianicus ut sibi Sassia nubat et id magno opere contendit. illa autem non admiratur audaciam, non impudentiam aspernatur, non denique illam Oppianici domum domum Sy : dextram s : om. Mb viri sui sanguine redundantem reformidat, sed quod haberet ille tris ille tres S a: tres ille M m filios, idcirco se ab eis nuptiis abhorrere respondit. Oppianicus, qui pecuniam Sassiae concupivisset, domo domo quoquo modo Orelli sibi quaerendum remedium existimavit ad eam moram quae nuptiis adferebatur. nam cum haberet ex Novia infantem filium, alter autem eius filius Papia Pappia S a natus Teani Teani Teano Bb2 y2 a, Arusianus ( K. vii. 455): Teani Apuli Mb 1 , quod abest ab ab M, Arusianus : a m a Larino xviii milia passuum, apud matrem educaretur, arcessit subito sine causa puerum Teano, quod facere nisi ludis publicis publicis om. a aut festis diebus antea non solebat. mater misera nihil misera nihil mali S a: nihil mali misera M m mali suspicans mittit. ille se Tarentum proficisci cum simulasset, eo ipso die puer, cum hora undecima in publico valens hora und. cum valens in publico a visus esset, ante noctem mortuus et postridie ante quam luceret combustus est. 
28	atque hunc tantum maerorem matri prius hominum rumor quam quisquam ex Oppianici familia nuntiavit. illa cum uno tempore audisset sibi non solum filium sed etiam exsequiarum munus ereptum, Larinum confestim exanimata venit et ibi de integro funus iam sepulto filio fecit. dies nondum decem intercesserant cum ille alter filius infans necatur. itaque nubit Oppianico continuo Sassia laetanti iam animo et spe optime optime S a: optima M m confirmato confirmata b 2 , nec mirum quae se non nuptialibus donis sed filiorum funeribus esse esse a a: om. M m delenitam videret. ita , quod ita quod b2 sy a: itaque S Mb 1: itaque quod Naugerius ( cf. §190) ceteri propter liberos pecuniae cupidiores solent esse esse solent S a , ille propter pecuniam liberos amittere iucundum esse duxit.
29	Sentio, iudices, vos pro vestra humanitate his tantis sceleribus breviter a me demonstratis vehementer esse commotos. quo tandem igitur animo fuisse illos arbitramini quibus his iis a de rebus non modo audiendum fuit verum etiam iudicandum? vos auditis de eo in quem iudices non estis, de eo quem non videtis, de eo quem odisse iam non potestis, de eo qui et naturae et legibus satis fecit, quem leges exsilio, natura morte multavit, auditis non non sine b2 y2 s ab inimico, auditis sine testibus, auditis cum ea quae copiosissime dici possunt breviter breviter S a: breviter a me M m strictimque dicuntur. illi audiebant de eo de quo eo de quo eo... quo B : eo quo a iurati sententias ferre debebant, de eo cuius praesentis nefarium et consceleratum voltum intuebantur, de eo quem omnes omnes a a: om. M m oderant propter audaciam, de eo quem omni supplicio dignum esse ducebant; audiebant ab accusatoribus, audiebant verba multorum testium, audiebant cum una quaque de re a P. Publio Cannutio, homine eloquentissimo, graviter et diu diceretur. 
30	et est quisquam qui, cum haec cognoverit, suspicari possit posset S a Oppianicum iudicio oppressum et circumventum esse innocentem? acervatim reliqua iam reliqua iam S Bs : iam reliqua cett. , iudices, dicam ut ad ea quae propiora propiora b 2 s : propriora S BMb 1 y huiusce huiusce S a: huius M m causae et adiunctiora sunt perveniam. vos , quaeso, memoria teneatis non mihi hoc esse propositum ut accusem Oppianicum mortuum sed, cum hoc persuadere vobis velim, iudicium ab hoc non esse corruptum, hoc uti initio ac fundamento defensionis, Oppianicum, hominem mortuum hominem S a sceleratissimum et nocentissimum, esse damnatum. qui uxori suae Cluentiae, quae amita huius habiti fuit fuisset S a , cum ipse poculum dedisset, subito illa in media potione exclamavit se maximo cum dolore emori emori S a: mori M m nec diutius vixit quam locuta est; nam in ipso sermone hoc et vociferatione mortua est. et ad hanc mortem mortem S a: mortem tam M m repentinam vocemque vocemque M y : vocesque b sy2 a morientis omnia praeterea quae solent esse indicia et vestigia veneni in illius mortuae corpore fuerunt. eodemque veneno C. Gaium Oppianicum fratrem necavit. 
31	neque est hoc satis; tametsi in ipso fraterno parricidio nullum scelus praetermissum videtur, tamen ut ad hoc nefarium facinus accederet aditum sibi aliis sceleribus ante munivit. nam cum esset gravida Auria, fratris uxor, et iam appropinquare partus putaretur putaretur a a: videretur M m , mulierem veneno interfecit ut una illud illud Sy a: illa Mb : cum illa s , Lambinus quod erat ex fratre conceptum necaretur. post fratrem adgressus est; qui sero iam exhausto illo poculo mortis mortis del. Gruter , cum et de suo et de uxoris interitu clamaret testamentumque mutare cuperet, in ipsa significatione huius voluntatis est mortuus. ita mulierem ne partu eius ab hereditate fraterna excluderetur necavit; fratris autem liberos prius vita privavit quam illi hanc a natura lucem lucem S a: propriam lucem M m accipere potuerunt; ut omnes intellegerent nihil ei clausum, nihil clausum nihil om. s 1 sanctum esse posse a a S a: om. M m cuius audacia fratris liberos ne materni quidem corporis custodiae tegere potuissent custodiae... potuissent S Ba : custodia... potuisset M m . 
