62	quod si hoc videtis quod iam hac omni oratione patefactum est, illo iudicio reum condemnari, praesertim ab isdem iudicibus qui duo praeiudicia fecissent, necesse fuisse, simul illud videatis necesse est, nullam accusatori accusatoris S a causam esse esse causam S a potuisse cur iudicium vellet corrumpere. quaero enim de de S s : abs cett. te, T. Tite Atti Atti Acci s ( duplici t hoc nomen scriptum est in P §147, in S §§149, 150, in B §149) , relictis iam ceteris argumentis omnibus, num Fabricios quoque innocentis condemnatos existimes, num etiam illa iudicia pecunia corrupta esse dicas, quibus in in a a: om. M m iudiciis alter a Staieno solo absolutus est, alter etiam ipse se condemnavit. age , si nocentes ages innocentis S a , cuius malefici? num quid praeter venenum quaesitum quo habitus necaretur obiectum est? num quid aliud in illis iudiciis versatum est praeter hasce insidias habito ab Oppianico per Fabricium Fabricium S a: Fabricios M m factas? nihil , nihil, inquam inquam s a: unquam Mb y exstat memoria S a: exstant memoriae M m , aliud, iudices, reperietis. exstat memoria, sunt tabulae publicae; redargue me, si mentior; testium dicta recita, doce in illorum iudiciis quid praeter hoc venenum Oppianici non modo in criminis sed in male dicti loco locum S a sit obiectum. 
63	multa dici possunt qua re ita necesse fuerit iudicari, sed ego occurram exspectationi vestrae, iudices. nam etsi etsi a a: si M m a vobis sic audior ut numquam benignius neque attentius quemquam auditum putem, tamen vocat me alio iam dudum tacita vestra exspectatio quae mihi obloqui videtur: ' quid ergo? negasne illud iudicium esse corruptum? corruptum esse S a ( contra Quintil. ix. 2. 51) ' non nego, sed ab hoc corruptum non esse confirmo. 'A quo igitur est corruptum?' opinor , primum, si incertum fuisset quisnam exitus illius iudici futurus esset, veri similius tamen esset eum potius corrupisse qui metuisset ne ipse condemnaretur quam illum ille a qui veritus esset ne alter absolveretur; deinde, cum esset non non S a: nemini M m dubium quid iudicari necesse esset, eum certe potius qui sibi aliqua aliqua M : alia m a ratione diffideret quam eum qui omni ratione confideret; postremo certe potius illum qui bis apud eos iudices offendisset quam eum qui bis causam bis causam S a: bis causam iis (his b ) Mb y : bis iis causam s , Baiter probavisset. 
64	Vnum quidem certe nemo erit tam inimicus inimicus a a, Quintil. v. 10. 68, Rufinian. Rhet. M. p. 42: iniquus M m Cluentio qui mihi non concedat, si constet corruptum illud esse iudicium iudicium esse S a ( contra Quintil. ) , aut ab habito aut ab Oppianico esse corruptum; si doceo non ab habito , vinco ab Oppianico; si ostendo ab Oppianico ab Oppianico om. S b 2a , purgo habitum . qua re, etsi satis docui rationem nullam huic corrumpendi iudici iudicii b 2 y2 a: om. M m fuisse, ex quo intellegitur ab Oppianico esse corruptum, tamen de illo ipso separatim cognoscite. atque ego illa non argumentabor quae sunt gravia vehementer, eum corrupisse qui in periculo fuerit, eum qui metuerit, eum qui spem salutis in alia ratione non habuerit, eum qui semper singulari fuerit audacia. multa sunt eius modi; verum cum habeam habes S a rem non dubiam sed apertam atque manifestam, enumeratio singulorum argumentorum non est necessaria. 
65	dico C. Gaio Aelio Staieno iudici pecuniam grandem Statium Albium ad corrumpendum iudicium dedisse. num quis negat? te , Oppianice, appello Oppianice, appello S a: appello, Oppianice M m , te, T. Tite Atti T. om. S a , quorum alter eloquentia damnationem illam, alter tacita pietate deplorat; audete negare ab Oppianico Staieno iudici pecuniam datam, negate negate semel hab. a , negate, inquam, meo meo S b 1a: in eo cett. loco. quid tacetis? an an S a: at M m negare non potestis quod repetistis, quod confessi estis, quod abstulistis? quo tandem igitur ore mentionem corrupti iudici facitis, cum ab ista parte iudici pecuniam ante iudicium datam, post iudicium ereptam esse fateamini? 
66	quonam igitur haec modo gesta sunt? repetam paulo altius, iudices, et omnia quae in diuturna obscuritate latuerunt sic aperiam ut ea cernere oculis videamini. vos quaeso, ut adhuc me attente audistis attente audistis attendistis (-itis B ) S B , item item M m : ut item S Ba quae reliqua sunt audiatis; profecto nihil a me dicetur quod non dignum hoc conventu et silentio, dignum vestris studiis atque auribus esse videatur. nam ut primum Oppianicus ex eo quod Scamander reus erat factus quid sibi impenderet coepit suspicari, statim se ad hominis egentis, audacis, in iudiciis corrumpendis exercitati, tum autem iudicis, Staieni familiaritatem applicavit statim se... applicavit M m : statim se... se applicavit a a: fort. statim sese... applicavit . ac primum Scamandro reo tantum donis muneribusque donis muneribusque Peterson : donis datis muneribusque M m : datis muneribus S a perfecerat profecerat Lambinus ut eo fautore fautore a a: auctore M m uteretur cupidiore quam fides iudicis postulabat. 
67	post autem cum esset esset M m : erat S a Scamander unius Staieni sententia absolutus sententia absolutus om. s , del. Garatoni , patronus autem Scamandri ne sua quidem sententia liberatus, acrioribus saluti suae remediis subveniendum putavit. tum ab tum ab S a: tum a M m Staieno, sicut ab homine ad excogitandum acutissimo, ad audendum impudentissimo, ad efficiendum acerrimo — haec enim ille et aliqua ex parte habebat et maiore ex parte se habere simulabat — auxilium capiti ac ac S a: et M m fortunis suis petere coepit. iam hoc non non s b 2 y2 a: om. Mb 1 y1 ignoratis, iudices, ut etiam bestiae fame monitae monitae a a, Ammianus Marcell. xiv. 2: dominante M m plerumque ad eum locum ubi pastae sunt aliquando sunt aliquando S a: aliquando sint M m revertantur. 
68	Staienus ille biennio ante cum cum Ascens. (2): quam M m a causam bonorum Safini Atellae recepisset, sescentis milibus nummum se iudicium corrupturum esse dixerat. quae cum accepisset a pupillo, suppressit iudicioque facto nec Safinio nec bonorum emptoribus reddidit. quam cum pecuniam profudisset et sibi nihil non modo ad cupiditates suas sed ne ad necessitatem quidem reliquisset, statuit ad easdem esse sibi praedas ac suppressiones iudicialis revertendum. itaque cum Oppianicum iam perditum et duobus iugulatum praeiudiciis videret, promissis suis eum suis eum S a: eum suis M m excitavit abiectum et simul saluti desperare vetuit. Oppianicus autem orare hominem coepit ut sibi rationem ostenderet iudici corrumpendi. 
69	ille autem autem Sy2 a: om. M m , quem ad modum ex ipso Oppianico postea est auditum, negavit quemquam esse in civitate praeter se qui id efficere posset. sed primo gravari coepit, quod aedilitatem se petere cum hominibus nobilissimis et invidiam atque offensionem timere dicebat. post exoratus initio permagnam pecuniam poposcit, deinde ad id pervenit quod confici potuit; HS HS S a: et M m dcxl dcxl scripsi : XXXX S s : sexcenta (sestertia M ) quadraginta milia ( om. milia y t ) cett. ( cf. §§82, 87) deferri ad se domum iussit. quae pecunia simul atque ad eum delata est, homo impurissimus statim coepit in eius modi mente et cogitatione versari, nihil esse suis rationibus utilius quam Oppianicum condemnari; illo absoluto pecuniam illam aut iudicibus dispertiendam aut ipsi esse reddendam; damnato repetiturum esse neminem. 
70	itaque rem excogitat singularem. atque haec, iudices, quae vera vera S a: vere M m dicuntur a nobis facilius credetis, si cum animis vestris longo intervallo recordari C. Gaii Staieni vitam et naturam volueritis; nam perinde ut opinio est de cuiusque moribus, ita quid ab eo factum aut non factum sit existimari potest. cum esset egens, sumptuosus, audax, callidus, perfidiosus, et cum domi suae miserrimus miserrimus b 1 t : miserrimis Mb 2 sy s locis] loculis Ernesti : focis Gulielmius in locis inanissimis inanissimis ed. Guar. : et inanissimis M m a: exinanitissimis Classen (et cum... videret om. Severian. Rhet. M. p. 361) tantum nummorum positum videret, ad omnem malitiam et fraudem versare mentem suam suam mentem a a coepit. ' ego dem ego dem (eo ego s ) b 2 y2 a: eodem S : deme M m iudicibus? mihi ipsi igitur ipsi igitur S a: igitur ipsi M m praeter periculum et infamiam quid quaeretur? nihil excogitem quam ob rem Oppianicum Oppianicum S a: Oppianico M m damnari necesse sit? quid quid S b 1a: qui cett. non fieri S a: fieri non M m tandem? — nihil enim est quod non fieri possit — si quis eum forte casus ex periculo eripuerit, nonne reddendum est? praecipitantem igitur impellamus' inquit 'et perditum prosternamus.' 
71	capit hoc consili consilii Sy2 a: consilium M m ut pecuniam quibusdam iudicibus levissimis polliceatur, deinde eam postea supprimat ut, quoniam gravis homines sua sponte severe iudicaturos putabat, eos qui leviores erant destitutione iratos Oppianico redderet. itaque , ut erat semper praeposterus atque perversus, initium facit a Bulbo et eum, quod iam diu nihil quaesierat, tristem atque oscitantem leviter impellit. ' quid tu?' inquit 'ecquid me adiuvas, Bulbe, ne gratiis rei publicae serviamus?' ille vero simul atque hoc audivit 'ne gratiis': ' quo voles quo quod S a ' inquit 'sequar; sed quid adfers?' tum ei ei HS y2 s quadraginta milia, si esset absolutus Oppianicus, pollicetur et eum ut ceteros appellet quibuscum loqui consuesset rogat atque etiam ipse conditor totius negoti Guttam aspergit huic Bulbo. 
72	itaque minime amarus amarus M m : avarus S a eis iis b 2a: is M m visus est qui aliquid ex eius sermone speculae speculae a a: spe gulae M m degustarant degustarant a: degustarat S Mb y ( om. s ) . Vnus et alter dies intercesserat cum res parum certa videbatur; sequester et confirmator pecuniae desiderabatur. tum appellat hilari hilari M m : hilaro a voltu hominem Bulbus ut blandissime blandissime M m : placidissime a potest: ' quid tu' inquit 'Paete? Paete a: Pacete M m : facete b 2 y2 ' — hoc enim sibi Staienus cognomen ex imaginibus Aeliorum aliorum a delegerat ne, si se Ligurem fecisset, nationis magis suae suae om. a quam generis uti cognomine videretur — 'qua de re mecum locutus es, quaerunt a me ubi sit pecunia.' hic ille planus planus M s , Gellius xvi. 7. 10: plane S : planius ba improbissimus quaestu iudiciario pastus, qui illi pecuniae quam condiderat spe iam atque animo incubaret incubarat S b 1 , contrahit frontem — recordamini faciem atque illos eius fictos simulatosque voltus voltus queritur se ab Oppianico destitutum add. codd., del. Peterson — et, qui esset totus ex fraude et mendacio factus quique ea vitia quae ab ab S M y t : a b s s natura habebat etiam studio atque artificio quodam malitiae condivisset condidisset a , pulchre adseverat sese ab Oppianico destitutum sese... destitutum del. Madvig atque hoc addit testimoni, sua illum sententia, cum cum quam b 1 palam omnes laturi essent, condemnatum iri.
73	manarat sermo in consilio pecuniae quandam mentionem inter iudices esse versatam. res neque tam fuerat occulta quam erat occultanda, neque tam erat aperta quam rei publicae causa aperienda. in ea obscuritate ac dubitatione omnium Cannutio, perito homini, qui quodam odore suspicionis Staienum corruptum esse sensisset neque dum rem perfectam arbitraretur, placuit repente pronuntiare pronuntiari pauci dett. : Dixerunt. hic tum Oppianicus non magno opere pertimuit; rem a Staieno perfectam esse arbitrabatur. 
74	in consilium erant ituri iudices xxxii . sententiis xvi absolutio confici poterat. HS HS S s , om. cett. xl XL scripsi : XXXX S b y a: DCXL ( vel DCLX) quadragena M s milia in singulos iudices distributa milia... distributa milibus... distributis a s eum numerum sententiarum conficere debebant ut ad cumulum spe maiorum praemiorum ipsius Staieni sententia septima decima accederet. atque etiam casu tum, quod quod quodam S a illud repente erat factum, Staienus ipse non aderat; causam nescio quam apud iudicem defendebat. facile hoc habitus patiebatur, facile Cannutius, at non Oppianicus neque patronus eius L. Lucius Quinctius; qui, cum esset illo tempore tribunus plebis, convicium C. Gaio Iunio iudici quaestionis maximum fecit ut ne sine illo illo P : Aelio S t : Staieno cett. in consilium iretur; cumque id ei per viatores consulto neglegentius agi videretur, ipse e publico iudicio ad privatum Staieni iudicium profectus est et illud pro potestate dimitti iussit; Staienum ipse ad subsellia adduxit. 
75	consurgitur in consilium, cum sententias Oppianicus, quae tum erat potestas, palam ferri velle dixisset ut Staienus scire posset quid quid quod S a cuique deberet deberet S a: deberetur M m . Varia iudicum genera; nummarii pauci sed omnes irati. Vt qui accipere in campo consuerunt eis candidatis quorum nummos suppressos esse putant inimicissimi solent esse, sic eius modi iudices infesti tum reo venerant; ceteri nocentissimum esse arbitrabantur, sed exspectabant exspectabant S a: spectabant (spera- y1 ) M m sententias eorum quos corruptos esse esse P : om. M m a putabant ut ex eis constituerent a quo iudicium corruptum videretur. ecce tibi eius modi sortitio ut ut fuit ut a a in primis Bulbo et Staieno et Guttae esset iudicandum! summa omnium exspectatio quidnam sententiae ferrent leves ac nummarii iudices. atque illi omnes sine ulla dubitatione condemnant. 
76	hic tum iniectus est hominibus scrupulus et quaedam dubitatio quidnam esset actum actum factum a a . deinde homines sapientes et ex et ex P : ex M m a vetere illa disciplina iudiciorum, qui qui P S a: om. M m neque absolvere hominem nocentissimum possent neque eum de quo esset orta suspicio pecunia oppugnatum re illa incognita primo condemnare vellent, non liquere dixerunt. non nulli autem severi homines qui hoc statuerunt statuerant coni. Peterson , quo quisque animo quid faceret spectari oportere, etsi alii pecunia accepta verum iudicabant, tamen nihilo minus se superioribus suis iudiciis constare putabant oportere; itaque damnarunt. quinque omnino fuerunt qui illum vestrum innocentem Oppianicum sive imprudentia impudentia b 2a sive misericordia sive aliqua suspicione sive ambitione adducti abducti S t absolverunt absolverunt Pb 1a: absolverent Mb 2 sy . 
77	condemnato Oppianico statim L. Lucius Quinctius, homo maxime popularis, qui omnis rumorum et contionum ventos conligere consuesset, oblatam sibi facultatem putavit ut ex invidia senatoria posset possit S a crescere, quod eius ordinis iudicia minus iam probari populo arbitrabatur. habetur una atque altera contio vehemens et gravis; accepisse pecuniam iudices ut innocentem reum condemnarent tribunus plebis clamitabat clamitabat M s a: clamabat P ; agi fortunas omnium dicebat; nulla esse iudicia iudicia esse a ; qui pecuniosum inimicum haberet, incolumem esse neminem posse. homines totius ignari negoti, qui Oppianicum numquam vidissent, virum optimum et hominem pudentissimum pecunia oppressum esse esse P : om. M m a arbitrarentur, incensi suspicione rem in medium vocare coeperunt et causam illam totam deposcere. 
78	atque illo ipso tempore in aedis T. Titi Anni, hominis honestissimi, necessarii et amici mei, noctu Staienus arcessitus ab Oppianico venit. iam cetera nota sunt omnibus, ut cum illo Oppianicus egerit de pecunia, ut ille se redditurum esse dixerit, ut eum sermonem audierint omnem eum sermonem aud. omnem P : eorum sermonem omnem aud. M m viri boni qui tum consulto propter in occulto stetissent, ut res patefacta et in forum prolata et pecunia omnis Staieno Staieno P : ab (a m ) Staieno M m a extorta atque erepta sit. huius Staieni persona populo iam nota atque perspecta ab nulla turpi suspicione abhorrebat; suppressam esse ab eo pecuniam quam pro reo pronuntiasset qui erant in contione non intellegebant; neque enim docebantur. versatam esse in iudicio mentionem pecuniae sentiebant sentiebant a a:... ebant M : sciebant s : aiebant b 1 , innocentem reum condemnatum audiebant, Staieni condemnatum... sententia om. a sententia condemnatum videbant; non gratiis gratiis S : gratis cett. id ab eo factum esse, quod hominem norant, iudicabant. Similis in Bulbo, in Gutta, in aliis non nullis suspicio consistebat. 
79	itaque confiteor — licet enim iam impune hoc praesertim in loco confiteri — quod Oppianici non modo vita sed etiam nomen ante illud tempus populo ignotum fuisset, indignissimum porro videretur circumventum esse innocentem pecunia, hanc deinde suspicionem augeret Staieni improbitas et non nullorum eius similium iudicum turpitudo, causam autem ageret L. Lucius Quinctius L. om. S a , homo cum summa potestate praeditus praeditus om. S a, del. Baiter tum ad inflammandos animos multitudinis accommodatus accommodatus S a: commodatus M m , summam illi illi Habito S iudicio iudicio a a: om. M m invidiam infamiamque esse conflatam. atque in hanc flammam recentem recentem om. s tum C. Iunium qui illi quaestioni praefuerat iniectum esse esse iniectum S a memini, et illum hominem aedilicium iam praetorem opinionibus omnium omnium Peterson : hominum M m a constitutum non disceptatione dicendi sed clamore hominum hominum om. a de foro atque adeo de civitate esse sublatum. 
80	neque me paenitet hoc tempore potius tempore potius S a: potius tempore M m quam illo causam A. Auli Cluenti defendere. causa enim manet eadem, quae mutari nullo modo potest, temporis iniquitas atque invidia recessit, ut quod in tempore mali fuit nihil obsit, quod in causa boni fuit prosit. itaque nunc quem ad modum audiar sentio, non modo ab eis quorum iudicium ac potestas est sed etiam ab illis quorum tantum est existimatio. at at s : ac Mb y a tum si dicerem, non audirer, non quod non quod quod S a alia res esset, immo eadem, sed tempus aliud. id adeo sic cognoscite. quis tum auderet dicere nocentem condemnatum esse Oppianicum? quis nunc audet audet S a: id audet M m negare? quis tum posset arguere ab Oppianico temptatum esse iudicium temptatum esse iud. S a: iud. temptatum esse M m pecunia? quis id hoc tempore infitiari potest? cui tum liceret docere Oppianicum reum factum esse tum denique cum duobus proximis praeiudiciis condemnatus esset? quis est qui id hoc tempore infirmare conetur? 
81	qua re invidia remota quam dies mitigavit, oratio mea deprecata est, vestra fides atque aequitas a veritatis disceptatione reiecit, quid est praeterea quod in causa relinquatur? versatam esse esse om. a in iudicio pecuniam constat; ea quaeritur unde profecta sit, ab accusatore an ab an ab an a s : an t reo. dicit accusator dicit accusator S a: accusator dicit M m haec: ' primum gravissimis criminibus accusabam, ut nihil opus esset pecunia; deinde condemnatum adducebam, ut ne eripi quidem pecunia posset; postremo, etiam si absolutus fuisset fuisset S a: esset M m , mearum tamen omnium fortunarum status incolumis maneret.' quid contra reus? ' primum ipsam ipsam M m : iam a a multitudinem criminum et atrocitatem criminum et atroc. S a: et atroc. criminum M m pertimescebam; deinde Fabriciis propter conscientiam mei sceleris condemnatis me esse condemnatum sentiebam: postremo in eum casum veneram ut omnis mearum fortunarum status unius iudici periculo contineretur. omnes... continerentur s ' 
82	age , quoniam corrumpendi iudici causas ille multas et gravis habuit, hic nullam, profectio ipsius pecuniae requiratur. confecit tabulas diligentissime Cluentius. haec autem res habet hoc certe ut nihil possit neque additum neque detractum de re familiari latere. Anni sunt octo cum ista causa in ista meditatione versatur, cum omnia quae ad eam rem pertinent et ex huius et ex aliorum tabulis agitatis agitatis S b y a: agitis M s , tractatis, inquiritis, cum interea Cluentianae pecuniae vestigium nullum invenitis. quid ? Albiana Abbiana Sy2 s pecunia vestigiisne nobis odoranda est an ad ipsum cubile vobis ducibus ducibus M m : iudicibus S Ba : indicibus Nettleship venire possumus? tenentur uno in loco HS dcxl dcxl M m : XXXX S a ( add. milia S s ) , tenentur apud hominem audacissimum, tenentur apud iudicem; quid voltis amplius? 
83	at enim Staienus non fuit ab Oppianico sed a Cluentio ad iudicium corrumpendum constitutus. cur eum eum S b 2 y a: enim Mb 1 s , cum in consilium iretur, Cluentius et Cannutius abesse patiebantur? cur, cum cur cum S b 2 y a: cum Mb 1 s in consilium mittebant, Staienum iudicem cui cui M m : cui quod a s : quod t : qui Classen pecuniam dederant non requirebant requirebant (-bantur M ) M m : quaerebant a s ? Oppianicus querebatur, Quinctius flagitabat; sine Staieno ne in consilium iretur tribunicia potestate effectum effectum S b 2y1 1a: perfectum M m : confectum y2 est. at condemnavit condemnavit a a: damnavit M m . hanc enim condemnationem dederat obsidem Bulbo et ceteris ut destitutus ab Oppianico videretur. qua re si istinc causa corrumpendi iudici, si iudicii si b 2a: iudicii M m istinc pecunia, istinc Staienus, istinc denique omnis fraus et audacia est, hinc pudor, honesta vita vita S a: vita et M m , nulla suspicio pecuniae, nulla corrumpendi iudici causa, patimini patiamini t veritate patefacta atque omni errore sublato eo transire illius turpitudinis infamiam ubi cetera maleficia consistunt consistunt a a: consistant M m , ab eo invidiam discedere aliquando ad quem numquam accessisse culpam videtis. 
84	at enim pecuniam Staieno dedit Oppianicus non ad corrumpendum iudicium sed ad conciliationem conciliationis (reconc. y2 ) gratiam a a gratiae. Tene hoc, Atti, dicere, tali prudentia, etiam usu atque exercitatione praeditum! sapientissimum esse dicunt eum cui quod opus sit ipsi veniat in mentem; proxime accedere illum qui alterius bene inventis obtemperet. in stultitia contra est. minus enim stultus est is cui nihil in mentem venit quam ille qui quod stulte alteri venit in mentem comprobat. ita Ita scripsi : istam codd. : conciliationem gratiae add. M m : conciliationis (reconc. y2 ) gratiam add. a a: ego delevi Staienus tum recenti re, cum faucibus premeretur — sive ultro sive ultro scripsi : iutro hab. S ante dedit: om. M m a excogitavit sive, ut homines tum loquebantur, a P. Publio Cethego admonitus est est Kayser: om. M m a — istam dedit conciliationis conciliationis gratiae Manutius et gratiae fabulam istam... fabulam om. a: del. Baiter ( cf. Zielinski p. 200) . 
85	nam fuisse hunc tum tum S a: om. M m hominum sermonem recordari potestis, Cethegum, quod hominem odisset et quod eius improbitatem versari in re publica nollet et quod videret eum qui se ab reo pecuniam, cum iudex esset, clam atque extra ordinem accepisse confessus esset, salvum esse non posse, minus ei fidele consilium dedisse. in hoc si improbus Cethegus fuit fuisset a a , videtur mihi adversarium removere voluisse; sin erat eius modi causa ut Staienus nummos se accepisse negare non posset, nihil autem erat periculosius nec turpius quam ad quam rem accepisset confiteri, non est consilium Cethegi reprendendum. 
86	verum alia causa tum Staieni fuit fuit om. S a , alia nunc, Atti, tua est. ille cum re premeretur, quodcumque diceret, honestius diceret quam si quod erat factum fateretur; te vero illud idem quod tum explosum et eiectum est nunc rettulisse retulisse (rei tul- M ) Mb 1 s : re intulisse y : detulisse b 2a demiror. qui enim poterat tum in gratiam redire cum Oppianico Cluentius, qui cum matre? haerebat matre habebat simultates a a in tabulis publicis reus et accusator; condemnati erant Fabricii; nec elabi alio accusatore poterat Albius nec sine ignominia calumniae relinquere accusationem Cluentius Cluentius poterat b 2 sy2 a vero scripsi : ut M m : iis b 2 y a: is Baiter .
87	an vero praevaricaretur? nam nam b 1, Pantagathus : iam Mb 2 sy a id quoque ad corrumpendum iudicium pertinet. sed quid quod S a opus erat ad eam rem iudice sequestre? et omnino quam ob rem tota ista res per Staienum potius, hominem ab utroque alienissimum, sordidissimum, turpissimum, quam per bonum aliquem virum ageretur et amicum necessariumque communem? sed quid ego haec pluribus quasi de re obscura disputo disputo a a , cum ipsa pecunia quae Staieno data est numero ac summa sua non modo quanta fuerit sed etiam ad quam rem fuerit ostendat? Sedecim dico iudices ut Oppianicus absolveretur corrumpendos fuisse; ad Staienum dcxl dcxl s : sexcenta et ( om. et S a) quadraginta cett. milia nummum nummum om. a esse delata. si , ut tu dicis, gratiae conciliandae causa, quadraginta istorum accessio milium quid valet? si, ut nos dicimus, ut quadragena milia nummum sedecim iudicibus darentur, non Archimedes melius potuit discribere discribere Kayser : describere M m a . 
88	at enim iudicia facta permulta sunt a Cluentio iudicium esse corruptum. immo vero ante hoc tempus omnino ista ipsa res suo nomine in iudicium numquam est vocata. ita multum agitata, ita diu iactata ista res ista res del. Garatoni est ut hodierno die primum causa illa defensa sit, hodierno die primum veritas vocem contra invidiam his iudicibus freta miserit. verum tamen ista multa ista multa S ba : multa ista M my iudicia quae sunt? ego enim me ad omnia confirmavi et sic paravi ut docerem quae facta postea iudicia de illo iudicio dicerentur, partim ruinae similiora aut aut partim autem b 2 y2 a (? S ) tempestati quam iudicio et disceptationi fuisse similis fuisse S s 1 , partim nihil contra habitum valere, partim etiam pro hoc esse, partim esse eius modi ut neque appellata umquam iudicia sint neque existimata. 
