119	video igitur, iudices, animadvertisse censores in iudices quosdam illius consili Iuniani, cum istam ipsam causam subscriberent. hic illud primum illud primum S a: primum illud M m commune proponam, numquam animadversionibus censoriis hanc civitatem ita contentam ut rebus iudicatis fuisse. neque in re nota consumam tempus; exempli causa exempli causa y2 a (? S ) ponam illud unum unum illud s , C. Gaium Getam, cum a L. Lucio Metello et Cn. Gnaeo Domitio censoribus ex senatu eiectus esset, censorem esse ipsum postea esse ipsum postea S a: ipsum postea esse M m factum et, cuius mores erant a censoribus erant a censoribus S a: a censoribus erant M m reprehensi, hunc postea et populi Romani et eorum qui in ipsum animadverterant moribus praefuisse. quod si illud iudicium putaretur, ut ceteri turpi iudicio damnati in perpetuum omni honore ac dignitate privantur, sic hominibus ignominia notatis neque ad honorem aditus neque in curiam reditus esset. 
120	nunc si quem Cn. Gnaei Lentuli aut L. Lucii Gelli libertus libertum S s1 furti condemnarit, is omnibus ornamentis amissis numquam ullam honestatis suae partem reciperabit; quos autem ipse ipse ille S L. Lucius Gellius et Cn. Gnaeus Lentulus, duo censores, clarissimi viri sapientissimique homines, furti et captarum pecuniarum nomine notaverunt, ei ei om. m non modo in senatum redierunt sed etiam illarum illarum om. M s ipsarum rerum iudiciis absoluti sunt. neminem voluerunt maiores nostri non modo de existimatione cuiusquam sed ne pecuniaria quidem de re minima esse iudicem, nisi qui inter adversarios convenisset. quapropter in omnibus legibus quibus exceptum est de quibus causis aut magistratum capere non liceat aut iudicem legi aut alterum accusare, haec ignominiae causa praetermissa est causa est praetermissa Zielinski p. 200 . timoris enim causam causam om. a , non vitae poenam in illa potestate esse voluerunt. itaque non solum illud ostendam quod iam videtis, 
121	populi Romani suffragiis saepenumero censorias subscriptiones esse sublatas sublatas S a: delatas M : deletas m , verum etiam iudiciis eorum qui iurati statuere maiore cum religione et diligentia debuerunt. primum iudices, senatores equitesque Romani, in compluribus iam reis quos contra leges pecunias accepisse accepisse S a: cepisse M m subscriptum est suae potius religioni quam censorum opinioni paruerunt. deinde praetores urbani qui iurati debent optimum quemque in lectos lectos S a: selectos M m iudices referre numquam sibi sibi numquam a ad eam rem censoriam ignominiam impedimento esse oportere duxerunt. 
122	censores denique ipsi saepe numero superiorum censorum iudiciis, si ista iudicia appellare appellare S a: appellari M m voltis, non steterunt. atque etiam ipsi inter se censores sua iudicia tanti esse arbitrantur ut alter alterius iudicium non modo reprehendat sed etiam rescindat praescindat S a , ut alter de senatu movere velit, alter retineat et ordine amplissimo dignum existimet, ut alter in aerarios aerarios (-ium b 1) referri Mb2 s : aerario referre Sy a referri aut tribu tribum S : tribus B moveri moveri M m : movere S B a iubeat, alter vetet. qua re qui vobis in mentem venit haec appellare iudicia quae a populo Romano Romano om. a rescindi, ab iuratis iudicibus repudiari, a magistratibus neglegi, ab eis qui eandem potestatem adepti sunt commutari, inter conlegas discrepare videatis?
123	quae cum ita sint, videamus quid tandem censores de illo iudicio corrupto iudicasse dicantur. ac primum illud statuamus utrum, quia censores censores de illo corrupto iudicio add. b2 y2 s2 subscripserint, ita sit, an, quia ita fuerit, illi subscripserint. si quia quia S s : ideo quia M m subscripserint, videte quid agatis ne in unum quemque nostrum censoribus in posterum potestatem regiam permittatis, ne subscriptio censoria non minus calamitatis civibus quam illa acerbissima proscriptio possit adferre, ne censorium stilum cuius mucronem multis remediis maiores nostri rettuderunt aeque posthac atque illum dictatorium gladium gladium om. s ( contra B ): del. Baiter pertimescamus. sin autem quod subscriptum est, 
124	quia verum est, idcirco grave debet esse, hoc quaeramus verum sit an falsum; removeantur auctoritates censoriae, tollatur id ex causa quod in causa non est; doce quam pecuniam Cluentius dederit, unde dederit, quem ad modum dederit quem... dederit om. a ; unum denique aliquod a Cluentio aliquod a Cluentio M m : a Cluentio aliquid S Bs : a Cluentio t profectae pecuniae vestigium ostende. vince deinde bonum virum bonum virum S a: virum bonum M m fuisse Oppianicum, hominem integrum, nihil de illo umquam secus esse existimatum, nihil denique praeiudicatum. tum auctoritatem censoriam censoriam S b y a: censorum M s amplexato amplexato b y , Priscian. ( K. ii. 393): amplexator M s a , tum illorum iudicium cum re coniunctum esse cum re coniunctum esse M m : coniunctum cum re esse s (? S ): coniunctum esse cum re t defendito. 
125	dum vero eum fuisse Oppianicum constabit qui tabulas publicas municipi manu sua manu sua a (? S ): sui M m corrupisse iudicatus iudicatum b 1a sit, qui testamentum interleverit, qui supposita persona falsum testamentum obsignandum curaverit, qui eum cuius nomine id obsignatum est interfecerit, qui avunculum fili sui in servitute ac vinculis necaverit curaverit... necaverit a a: curarit... necarit M m , qui municipes suos proscribendos occidendosque curaverit curaverit y2 s (? S ): curarit M m : curavit t , qui eius uxorem quem occiderat in matrimonium duxerit, qui pecuniam pro abortione abortione a B a: potione M m dederit, qui socrum, qui uxores uxores S a: uxorem M m , qui uno tempore fratris uxorem speratosque liberos fratremque ipsum, qui denique suos liberos interfecerit, qui, cum venenum privigno suo dare vellet dare vellet a a: quaereret M m , manifesto deprehensus sit deprehensus sit S a: sit deprehensus M m , cuius ministris consciisque damnatis ipse adductus in iudicium pecuniam iudici dederit ad sententias iudicum corrumpendas, dum haec, inquam, de Oppianico constabunt neque neque S a: nec M m ullo argumento Cluentianae pecuniae crimen tenebitur, quid est quod te ista censoria sive voluntas sive opinio fuit adiuvare aut hunc innocentem opprimere posse videatur?
126	quid igitur censores secuti sunt? ne ipsi quidem, ut gravissime dicam, quicquam aliud dicent praeter sermonem atque famam. nihil se testibus, nihil tabulis, nihil aliquo gravi aliquo gravi S a: gravi aliquo M m argumento comperisse, nihil denique causa cognita statuisse dicent. quod si ita fecissent, tamen id non ita fixum esse deberet ut convelli non liceret. non utar exemplorum copia quae summa est, non rem veterem, non hominem potentem aliquem aut gratiosum proferam. nuper hominem tenuem, scribam aedilicium, D. Decimum Matrinium, cum defendissem apud M. Marcum Iunium Macrinium (-inum s ) S b2s Q. Quintum Publicium praetores et M. Marcum Plaetorium Pretorium S s C. Gaium Flaminium aedilis curulis, persuasi ut scribam iurati legerent eum quem idem isti censores aerarium reliquissent reliquissent M s : reliquisse subscripserunt (scripserunt s ) S b y a: reliquisse subscripserint b 2 y2 . cum enim in homine nulla culpa inveniretur, quid ille meruisset, non quid de eo statutum esset, quaerendum esse duxerunt dixerunt S a . 
127	nam haec quidem quae de iudicio corrupto iudicio corrupto hinc defic. M s usque ad §132, opinione standum, lac. supplet S in pag. insuta, supplem. in textu hab. b xy a subscripserint subscripserunt cod. Graevii quis est qui ab illis satis cognita et diligenter iudicata arbitretur? in M'. Manlium Aquilium M'. Manutius : M. codd. Ti. Schütz : T. (Titum) codd., cf. §98 et in Ti. Tiberium Guttam video esse subscriptum. quid est hoc? duos esse corruptos solos pecunia iudicant iudicant Madvig : dicant codd. : quid Angelius ; ceteri videlicet gratiis gratiis S : gratis cett. condemnarunt. non est igitur circumventus, non oppressus pecunia, non, ut in illa Quinctiana contione habebatur in illa Quinctiana contione habebatur Graevius : illa Quinctiana contiones habebantur (haberebantur S ) Sxy : illae Quinctianae contiones habebantur cett. , omnes qui Oppianicum condemnarunt in culpa sunt ac suspicione ponendi. duos solos video auctoritate censorum adfinis ei turpitudini iudicari. aut illud adferant, aliquid eos eos Peterson : esse codd. : sese Leclerc quod de his duobus habuerint compertum de ceteris comperisse.
128	nam illud quidem minime probandum est, ad notationes auctoritatemque censoriam exemplum illos e e Baiter: om. codd. : a Naugerius consuetudine militari transtulisse. statuerunt enim ita maiores nostri ut, si a multis esset flagitium rei militaris admissum, sortito sortito Classen : sortitio S a: sortitione b xy ( cf. §129) in quosdam animadverteretur, ut metus videlicet ad omnis, poena ad paucos perveniret. quod idem facere censores in delectu dignitatis et in iudicio civium et in animadversione vitiorum qui convenit? nam miles qui locum non tenuit, qui hostium impetum vimque pertimuit, potest idem postea et miles esse melior et vir bonus et civis utilis. qua re ne quis in bello propter hostium metum delinqueret ne quis... delinqueret scripsi : ne... delinqueret S b1 xy1 : qui... deliquerat b2 y2 a , amplior ei mortis et supplici metus est a maioribus constitutus; ne autem nimium multi poenam capitis subirent, idcirco illa sortitio comparata est. 
129	hoc tu idem facies censor in senatu legendo? si erunt plures qui ob innocentem condemnandum pecuniam acceperint, tu tu ut S b1 y1 non animadvertes animadvertes Lambinus : animadvertis (-tas b1 y1 ) codd. in omnis, sed carpes, ut velis, et paucos ex multis ad ignominiam sortiere? habebit igitur te sciente et vidente curia senatorem, populus Romanus iudicem, res publica civem sine ignominia quemquam qui ad perniciem innocentis fidem suam et religionem pecunia commutarit, et qui pretio adductus eripuerit patriam, fortunas, liberos civi innocenti, is censoriae severitatis nota non inuretur? tu es praefectus moribus, tu magister veteris disciplinae ac ac P: et cett. severitatis, si aut retines quemquam sciens in senatu scelere tanto contaminatum aut statuis qui in quis in S b y a eadem culpa sit non eadem poena adfici convenire? aut quam convenire aut quam P : oportere convenire ut (ut ad a) quam cett. condicionem supplici maiores in bello timiditati militis propositam esse voluerunt, eandem tu in pace constitues constituas a improbitati senatoris? quod si hoc exemplum ex re militari ad animadversionem censoriam transferendum fuit, sortito sortito scripsi : sortitio S : sortitione cett. ( cf. §128) id ipsum factum esse oportuit. sin autem sortiri ad poenam et et P : ad cett. hominum delictum fortunae iudicio committere minime censorium est, certe in multorum peccato carpi paucos ad ignominiam et turpitudinem et turpitudinem om. P ( cf. Verr. 1. 23) non oportet.
130	verum omnes intellegimus in istis subscriptionibus ventum quendam popularem esse quaesitum. iactata res erat in contione a tribuno seditioso a tribuno seditioso om. P ; incognita causa probatum erat illud erat illud P : illud erat cett. multitudini nemini licitum P, Ant. Augustinus : multitudinem inilicitum S : multitudinem illicitum cett. multitudini; nemini licitum est contra dicere, nemo denique ut defenderet contrariam partem laborabat. in invidiam porro magnam illa iudicia venerant. etenim paucis postea mensibus alia vehemens erat in iudiciis ex notatione tabellarum tabellarum P, Garatoni : tabularum cett. invidia versata. praetermitti ab ab P : a cett. censoribus et neglegi macula iudiciorum posse non videbatur. homines , quos ceteris vitiis atque omni dedecore infamis videbant, eos hac quoque subscriptione notare voluerunt, et eo magis quod illo ipso ipso in S b2 y2 a tempore illis censoribus erant iudicia cum equestri ordine communicata, ut viderentur per hominum idoneorum ignominiam sua auctoritate rem rem scripsi : iudicia P : illa iudicia cum equestri ordine cett. ( cf. Zielinski p. 177) reprendisse. 
131	quod si hanc apud eosdem eosdem P : eos cett. ipsos censores mihi aut alii causam agere licuisset, hominibus tali prudentia praeditis praeditis P : om. cett. certe probavissem; res enim indicat nihil ipsos habuisse cogniti, nihil comperti; ex tota ista ista Ernesti : ipsa codd. subscriptione rumorem quendam et plausum popularem esse quaesitum. nam in P. Publium Popilium P. Vrsinus : L. codd. qui Oppianicum condemnarat subscripsit L. Lucius Gellius, quod is pecuniam accepisset quo innocentem condemnaret. iam id ipsum quantae divinationis est, scire innocentem fuisse reum quem fortasse numquam viderat, cum homines sapientissimi, iudices, ut nihil dicam de eis iis b xy : his S a qui condemnarunt, causa cognita sibi sibi b xy : sibi esse S a dixerint dixerint ed. R : dixerunt codd. non liquere! 
132	verum esto; condemnat Popilium Gellius, iudicat eum iudicat eum scripsi : iudicat... S : iudicat cett. accepisse a Cluentio pecuniam. negat hoc Lentulus; nam Popilium, quod erat libertini filius, in senatum non legit, locum quidem senatorium ludis et cetera ornamenta relinquit relinquit Lambinus : reliquit codd. et eum omni ignominia liberat. quod cum facit, iudicat eius sententia gratiis gratiis S : gratis cett. esse Oppianicum condemnatum. et eundem Popilium postea Lentulus in ambitus iudicio pro testimonio diligentissime laudat. qua re si neque L. Lucii Gelli iudicio stetit Lentulus neque Lentuli existimatione contentus fuit Gellius, et si uterque censor censoris opinione standum non standum ne S b1 xy putavit, quid est quam ob rem quisquam nostrum censorias subscriptiones omnis fixas et in perpetuum ratas putet putet M m : putat S a esse oportere?
133	at in ipsum habitum animadverterunt. nullam quidem ob turpitudinem, nullum ob totius vitae non dicam vitium sed erratum. neque enim hoc homine sanctior neque probior neque in omnibus officiis retinendis diligentior esse quisquam potest; neque illi aliter dicunt, sed eandem illam famam iudici corrupti secuti sunt; neque ipsi secus existimant quam nos existimari volumus de huius pudore, integritate, virtute, sed putarunt praetermitti accusatorem non potuisse potuisse posse Madvig , cum animadversum esset in iudices. qua de re tota tota om. a si unum factum ex omni antiquitate protulero, plura non dicam. 
134	non enim mihi exemplum summi et clarissimi viri, P. Publii Africani, praetereundum videtur; qui cum esset censor et in equitum censu C. Gaius Licinius Sacerdos prodisset, clara voce ut omnis contio audire posset dixit se scire illum verbis conceptis peierasse periurasse S ; si qui contra vellet dicere vellet dicere S a: dicere vellet M m , usurum esse eum suo testimonio. deinde cum nemo contra nemo contra S a: contra nemo M m diceret, iussit equum traducere. ita ita S a: itaque M m is cuius arbitrio et populus Romanus et exterae gentes contentae esse consuerunt consuerunt M m a: consuerant Angelius ipse sua scientia ad ignominiam alterius contentus non fuit. quod si hoc habito facere licuisset, facile illis ipsis iudicibus et falsae suspicioni et invidiae populariter excitatae restitisset. 
135	Vnum etiam est quod me maxime perturbat perturbat a a: conturbat M m , cui loco respondere vix videor posse vix videor posse Sy2 a: posse vix videor M m , quod elogium recitasti de testamento Cn. Gnaei Egnati patris, hominis honestissimi videlicet et sapientissimi, idcirco se exheredasse filium quod is ob ob (ab t ) a a: ad M m Oppianici condemnationem condemn. Sy2 a: damn. M m pecuniam accepisset. de cuius hominis levitate et inconstantia plura non dicam; hoc testamentum ipsum quod recitas eius modi est ut ille, cum eum filium exheredaret quem oderat, ei filio coheredes homines alienissimos adiungeret adiungeret a a: coniungeret M m quem diligebat. sed tu, Atti, consideres censeo diligenter utrum censorium censorium S a, Quintil. v. 13. 33: censorum M m iudicium grave velis esse an Egnati. si Egnati, leve est quod censores de ceteris subscripserunt; ipsum enim Cn. Gnaeum Egnatium quem tu gravem esse vis ex senatu eiecerunt; sin autem censorium censorium Quintil. : censorum (-rem b2s ) M m a , hunc Egnatium quem pater censoria subscriptione exheredavit censores in senatu, cum patrem eicerent, retinuerunt.
136	at enim senatus universus iudicavit illud corruptum esse iudicium. quo modo? suscepit causam. an potuit rem delatam eius modi repudiare? cum tribunus plebis, populi concitator, rem populi concitator rem scripsi : populi concitatorem S : populo concitato rem cett. paene ad manus revocasset, cum vir optimus et homo innocentissimus pecunia circumventus diceretur diceretur S a: esse diceretur M m , cum invidia flagraret ordo senatorius, potuit nihil decerni, potuit illa concitatio multitudinis sine summo periculo rei publicae repudiari? at quid est decretum? quam iuste, quam sapienter, quam diligenter! si qui sunt quorum opera factum sit ut iudicium publicum corrumperetur. Vtrum videtur id senatus id senatus S a: senatus id M m factum iudicare an, si factum sit, moleste graviterque ferre? si ipse A. Aulus Cluentius sententiam de iudiciis rogaretur, aliam non diceret atque ei dixerunt quorum sententiis Cluentium condemnatum esse dicitis. 
137	sed quaero a vobis num istam legem ex isto senatus consulto L. Lucius Lucullus consul, homo sapientissimus, tulerit, num anno post M. Marcus Lucullus et C. Gaius Cassius, in quos tum consules designatos idem illud senatus decreverat decreverat S a: decreverit M m . non tulerunt; et quod tu habiti pecunia factum esse arguis neque id ulla tenuissima suspicione confirmas, factum est primum illorum aequitate et sapientia consulum, ut, quod senatus decreverat ad illud invidiae praesens incendium restinguendum, id postea ut quod... id postea Peterson : ut id quod... id postea M m a: fort. ut id quod... ii postea referendum referendum a a: perferendum M m : ferendum Manutius ad populum non arbitrarentur. ipse deinde populus Romanus qui L. Lucii Quincti Quinctii S a: Quinctii, tribuni plebis M m fictis querimoniis antea ante S s concitatus rem illam et rogationem flagitarat, idem C. Gaii Iuni fili, pueri parvoli, lacrimis commotus maximo clamore et concursu totam quaestionem illam et legem quaest. illam et legem S a: illam legem et quaest. M m repudiavit. 
138	ex quo intellegi potuit, id quod saepe dictum est, ut mare quod sua natura natura sua S a, contra Rufinian. ( Rhet, M. p. 44) tranquillum sit ventorum vi agitari atque turbari, sic sic S a, Rufinian. : sic et M m populum Romanum sua sponte esse placatum, hominum seditiosorum vocibus ut violentissimis tempestatibus concitari. est etiam reliqua permagna auctoritas quam ego turpiter paene praeterii; mea enim esse dicitur. recitavit ex oratione nescio qua Attius quam meam esse dicebat cohortationem quandam iudicum ad honeste iudicandum et commemorationem cum cum S Ms : tum b y : om. s t aliorum aliorum Ernesti : illorum M m a iudiciorum quae probata non essent tum illius ipsius iudici Iuniani; proinde quasi ego non ab initio huius defensionis dixerim invidiosum illud iudicium fuisse iudicium fuisse S a: fuisse iudicium M m aut, cum de infamia iudiciorum disputarem, potuerim illud quod tam populare esset illo illo a: in illo M m tempore praeterire.
139	ego vero si quid eius modi dixi, neque cognitum commemoravi neque pro testimonio dixi, et illa oratio potius temporis mei quam iudici et auctoritatis fuit. cum enim accusarem et mihi initio proposuissem ut animos et populi Romani et iudicum commoverem, cumque omnis offensiones iudiciorum non ex mea opinione sed ex hominum rumore proferrem, istam rem quae tam populariter esset agitata praeterire non potui. sed errat vehementer, si quis in orationibus nostris quas in iudiciis habuimus auctoritates nostras consignatas se habere arbitratur. omnes enim illae illae S Bs ( om. t ): illae orationes M m causarum ac temporum temporis B sunt, non hominum ipsorum aut aut Sy2 a: ac M m patronorum. nam si causae ipsae pro se loqui possent, nemo adhiberet oratorem. nunc adhibemur ut ea dicamus, non quae auctoritate nostra auctoritate nostra M a: nostra auctoritate m constituantur sed quae ex re ipsa causaque ducantur dicantur S t . 
140	hominem ingeniosum, M. Marcum Antonium, aiunt solitum esse dicere 'idcirco se nullam umquam numquam ullam S s orationem scripsisse ut, si quid aliquando non opus esset ab se esse dictum, posset negare negare S B a: se negare M m dixisse'; proinde quasi, si quasi si a a: quasi M m quid a nobis dictum aut actum sit, id nisi litteris mandarimus mandarimus S a: mandaverimus M m , hominum memoria non comprehendatur. ego vero in isto isto M m : ipso S a genere libentius cum multorum tum hominis eloquentissimi et sapientissimi, L. Lucii Crassi, auctoritatem sequor qui, cum Cn. Gnaeum Plancum Cn. Cic. de Or. ii. 220: C. S a, Quintil. vi. 3. 43: L. M m defenderet accusante M. Marco Bruto, homine in dicendo vehementi et callido, cum Brutus duobus recitatoribus constitutis ex duabus eius eius om. S B a orationibus capita alterna inter se contraria recitanda curasset, quod in dissuasione rogationis eius quae contra coloniam Narbonensem ferebatur quantum potest de auctoritate senatus detrahit, in suasione legis Serviliae summis ornat senatum laudibus, et multa in equites Romanos cum ex ea oratione asperius dicta recitasset quo animi illorum iudicum in Crassum incenderentur, aliquantum esse commotus dicitur. 
141	itaque in in M m : om. a a respondendo primum exposuit utriusque rationem temporis ut oratio ex re et ex et ex a s : ex t : et M m causa habita videretur, deinde ut intellegere posset Brutus quem hominem et non solum qua eloquentia verum etiam quo lepore et quibus facetiis praeditum lacessisset, tris ipse ipse S a: et ipse M m excitavit recitatores cum singulis libellis quos M. Brutus, pater illius accusatoris, de iure civili reliquit. Eorum initia cum recitarentur, ea quae vobis nota esse arbitror: ' forte evenit ut ruri in Privernati Privernati Cic. de Or. l. c., Quintil. l. c. : Privernate M m essemus essem S Bs ego et Brutus Brutus Marcus Cic. de Or., ita mox ( bis ) filius,' fundum Privernatem flagitabat; ' in Albano eramus ego et Brutus filius,' Albanum poscebat; ' in Tiburti forte cum adsedissemus cum adsedissemus adsedimus Cis. de Or. ego et Brutus filius om. b y ego et Brutus filius, Albanum... filius om. M s s forte om. S ' Tiburtem fundum requirebat; Brutum autem, hominem sapientem, quod fili nequitiam videret, quae praedia ei relinqueret testificari testificari se Sy2 a voluisse dicebat voluisse dicebat Sy2 a: dicebat ( add. se b 2) voluisse M m . quod si potuisset honeste scribere se in balneis cum id aetatis filio fuisse, non praeterisset; eas se tamen ab eo balneas non ex libris patris sed ex tabulis et ex censu quaerere. Crassus tum ita Brutum ultus est ut illum recitationis suae paeniteret; moleste enim fortasse tulerat se in eis orationibus reprehensum quas de re publica habuisset, in quibus forsitan magis requiratur constantia. ego autem illa recitata esse esse a a: om. M m non moleste fero. 
142	neque enim ab illo tempore quod tum erat, neque ab ea causa quae tum agebatur aliena fuerunt; neque mihi quicquam oneris suscepi, cum ita ita S a: ista M m : illa Halm dixi, quo minus honeste hanc causam et libere possem defendere. quod si velim confiteri me causam A. Auli Cluenti nunc cognosse cognosse ( ante lac. b y ) m s : cognosce Mt , antea fuisse in ea ea S a: illa M m opinione populari populari opinione a a , quis tandem id possit reprehendere? praesertim, iudices, cum a vobis quoque ipsis hoc impetrari sit aequissimum quod ego et ab initio petivi et nunc peto ut, si quam huc huic S a ( s 1) graviorem de illo iudicio opinionem attulistis attulissetis S a , hanc causa perspecta atque omni veritate cognita deponatis.
143	nunc , quoniam ad omnia quae abs te dicta sunt, T. Titi Atti T. om. S a , de Oppianici damnatione respondi, confiteare confitearis a necesse est te opinionem multum fefellisse, quod existimaris me causam A. Auli Cluenti non facto eius sed lege defensurum. nam hoc persaepe dixisti tibi sic renuntiari, me habere in animo causam hanc praesidio legis defendere. itane est? ab amicis imprudentes videlicet imprud. videlicet S s, Quintil. v. 13. 47: videlicet imprud. M m prodimur, et est nescio quis de eis iis (is M ) Mb : his sy a nobis M m , Quintil. : nostros a a quos amicos nobis arbitramur qui nostra consilia ad adversarios adversarium Quintil. deferat. quisnam hoc tibi hoc tibi S a, Quintil. : tibi hoc M m renuntiavit, quis tam improbus fuit? cui ego autem autem om. a a ( contra Quintil. ) narravi? nemo , ut opinor, in culpa est est Quintil. : est et S a: est sed M m ; nimirum tibi istud istud Quintil. : istunc (-tuc m ) M m lex ipsa renuntiavit. sed num tibi ita defendisse videor ut tota in causa mentionem ullam legis fecerim legis fecerim S a: fecerim legis M m , num secus hanc causam defendisse defendisse Manutius : defendissem M m a ac si lege habitus teneretur? certe , ut hominem confirmare oportet, nullus est locus a me purgandi istius invidiosi criminis praetermissus. 
144	quid ergo est? quaeret fortasse fortassis S a quispiam displiceatne displicetne a mihi legum praesidio capitis capitis S a: a capite M m periculum propulsare. mihi vero, iudices, non displicet, sed utor instituto meo. in hominis honesti prudentisque iudicio non solum meo consilio uti consuevi sed multum etiam eius quem defendo et consilio et voluntati obtempero. nam ut haec ad me causa delata est, qui leges eas ad quas adhibemur et in quibus versamur nosse deberem, dixi habito statim eo: ' Qui coisset quo quis condemnaretur eo capite t ' illum esse liberum, teneri autem nostrum ordinem. atque ille me orare atque obsecrare coepit ne sese ne sese (se a) S a: ut ne sese M m lege defenderem. cum ego quae mihi videbantur videbantur S a: viderentur M m dicerem, traduxit me ad suam sententiam; adfirmabat enim lacrimans non se cupidiorem esse civitatis retinendae quam existimationis. 
